ID;TITULAR;RUC;TITULO_PROYECTO;UNIDAD_PROYECTO;TIPO;ACTIVIDAD;FECHA_INICIO;ESTADO;DESCRIPCION;LONGITUD;LATITUD;RESOLUCION;LABEL;
1221;GOBIERNO REGIONAL DE JUN÷N;20486021692;CREACI‡N DEL PUENTE SAN FERNANDO SOBRE EL RIO SHULLCAS, ENTRE LOS DISTRITOS DE HUNCAYO Y EL TAMBO, PROVINCIA DE HUANCAYO, REGI‡N JUN÷N;SIN UNIDAD;Clasificaci¢n;Transportes;7/03/2017;Aprobado;SIN DESCRIPCION;-75.20514488;-12.05152679;RD N¯ 227-2017-SENACE/DCA;null;
1268;CONCESIONARIA INTEROCEANICA SUR - TRAMO 3 S.A.;20511129975;ITS PARA EL ACOPIO, DEP‡SITO DE MATERIAL EXCEDENTE Y ZONA DE MEZCLA ASFµLTICA KM 622+660 LI DEL PROYECTO CORREDOR VIAL INTEROCEµNICO SUR PERÈ- BRASIL, TRAMO Nß 3 INAMBARI - I•APARI;ACOPIO, DEP‡SITO DE MATERIAL EXCEDENTE Y ZONA DE MEZCLA ASFµLTICA KM 622+660 LI DEL PROYECTO CORREDOR VIAL INTEROCEµNICO SUR PERÈ- BRASIL, TRAMO Nß 3 INAMBARI - I•APARI;ITS;Transportes;7/03/2019;Aprobado;SIN DESCRIPCION;-69.54933007;-11.21758265;RD N¯ 00084-2019-SENACE-PE/DEIN ;null;
1272;COMPA•IA MINERA SAN IGNACIO DE MOROCOCHA S.A.A.;20100177421;MODIFICACI‡N DEL ESTUDIO DE IMPACTO AMBIENTAL DEL PROYECTO DE CONDUCCI‡N Y DISPOSICI‡N FINAL DE RELAVES LA ESPERANZA DE LA UNIDAD MINERA SAN VICENTE;U.M. SAN VICENTE;MEIA-d;Miner°a;1/03/2019;Aprobado;SIN DESCRIPCION;-75.3829728;-11.2295836;RD N¯ 00039-2020-SENACE-PE/DEAR;null;
1413;EMPRESA REGIONAL DE SERVICIO PUBLICO DE ELECTRICIDAD ELECTRONORTEMEDIO SOCIEDAD ANONIMA - HIDRANDINA;20132023540;ITS DE VARIANTE SIHUAS;LINEA DE TRANSMISION 138 KV, HUALLANCA - SIHUAS - TAYABAMBA Y SUBESTACIONES;ITS;Electricidad;10/08/2018;Aprobado;SIN DESCRIPCION;-77.6387576;-8.57847123;RD N¯ 00056-2018-SENACE-PE/DEIN;null;
1414;ENGIE ENERGIA PERU S.A.;20333363900;MEJORA TECNOL‡GICA PARA LA RECEPCI‡N DE DIêSEL DE LA CENTRAL TERMOELêCTRICA NODO ENERGêTICO EN EL SUR DEL PERU - PLANTA Nß2 - REGI‡N MOQUEGUA;CENTRAL TERMOELêCTRICA NODO ENERGêTICO EN EL SUR DEL PERÈ;ITS;Electricidad;27/08/2020;Aprobado;SIN DESCRIPCION;-70.39899865;-13.15209764;RD N¯ 0128-2020-SENACE-PE/DEAR;null;
1415;INNOVA AMBIENTAL S.A.;20302891452;EIA-SD PARA INFRAESTRUCTURA DE RESIDUOS SOLIDOS NO MUNICIPALES;INFRAESTRUCTURA DE DISPOSICI‡N FINAL DE RESIDUOS S‡LIDOS NO MUNICIPALES PELIGROSOS Y NO PELIGROSOS - RELLENO DE SEGURIDAD LA JOYA;EIA-sd;Transportes;4/01/2021;Aprobado;SIN DESCRIPCION;-71.86403004;-16.5482078;En Evaluaci¢n;null;
1416;CNPC PERÈ S.A.;20356476434;LOTE X;LOTE X;ITS;Hidrocarburos;18/05/2018;Aprobado;SIN DESCRIPCION;-81.14483936;-4.39190904;RD N¯ 100-2018-SENACE-JEF/DEAR;null;
1136;PROGRAMA DE GOBIERNO REGIONAL DE LIMA METROPOLITANA;20518396332;"DIA MEJORAMIENTO DE PISTAS Y VEREDAS DE LA AV. QUINTA AVENIDA, TRAMO: AV. LAURELES - AV. LAS TORRES - Y EN LA AV. LOS LAURELES, TRAMO: AUTOPISTA RAMIRO PRIALê %u2013 RIO HUAYCOLORO, DISTRITO DE LURIGANCH*""";MEJORAMIENTO DE PISTAS Y VEREDAS DE LA AV. QUINTA AVENIDA, TRAMO: AV. LAURELES - AV. LAS TORRES - Y EN LA AV. LOS LAURELES, TRAMO: AUTOPISTA RAMIRO PRIALê %u2013 RIO HUAYCOLORO, DISTRITO DE LURIGANCHO, PROVINCIA DE LIMA %u2013 LIMA, CODIGO DE INVERSION 2396626;Clasificaci¢n;Transportes;21/08/2018;Aprobado;SIN DESCRIPCION;-76.92707727;-12.01490658;RD N¯ 0058-2019-SENACE-PE/DEIN;null;
1137;EMPRESA MINERA LOS QUENUALES S.A.;20332907990;RECRECIMIENTO DEL DEP‡SITO DE RELAVES GENIOCOCHA - ESCONDIDA;ISCAYCRUZ;MEIA-d;Miner°a;4/05/2017;Aprobado;SIN DESCRIPCION;-76.72114929;-10.78726025;RD N¯ 007-2017-SENACE-JEF/DEAR;null;
1138;MUNICIPALIDAD DISTRITAL DE SANTO TOMµS;20163126908;CREACI‡N DEL CAMINO VECINAL YERBABUENA - SAN FRANCISCO DE TINTIN - DISTRITO DE SANTO TOMµS -LUYA-AMAZONAS;SIN UNIDAD;Clasificaci¢n;Transportes;27/01/2017;Aprobado;SIN DESCRIPCION;-77.84899363;-6.6059009;RD N¯ 277-2017-SENACE/DCA;null;
1139;COMPA•IA MINERA CARAVELI S.A.C.;20126702737;APROBACI‡N DE LA PROPUESTA DE LOS MECANISMO DE PARTICIPACI‡N CIUDADANA Y PROTOCOLO COVID-19;CARAVEL÷;PPC;Miner°a;23/10/2020;Aprobado;SIN DESCRIPCION;-68.0780889;-15.6431234;RD N¯ 156-2020-SENACE-PE/DEAR;null;
1224;MUNICIPALIDAD DISTRITAL DE VILCABAMBA;20170327391;CREACION DEL CAMINO VECINAL TRAMO PAMPACONAS - VISTA ALEGRE, CUENCA DE VILCABAMBA, DISTRITO DE VILCABAMBA - LA CONVENCION - CUSCO (COD. 2302631);CREACION DEL CAMINO VECINAL TRAMO PAMPACONAS - VISTA ALEGRE, CUENCA DE VILCABAMBA, DISTRITO DE VILCABAMBA - LA CONVENCION - CUSCO (COD. 2302631);Clasificaci¢n;Transportes;11/12/2019;Aprobado;SIN DESCRIPCION;-73.06309094;-13.09222044;RD N¯ 069-2020-SENACE-PE/DEI;null;
1225;MINERA COLQUISIRI S.A.;20107290177;PRIMER INFORME TêCNICO SUSTENTATORIO DE LA MODIFICACI‡N DEL ESTUDIO DE IMPACTO AMBIENTAL DETALLADO;U.M. COLQUISIRI;ITS;Miner°a;19/12/2019;Aprobado;SIN DESCRIPCION;-77.27457429;-11.49252771;RD N¯ 00030-2020-SENACE-PE/DEAR;null;
1226;CONCESIONARIA INTEROCEµNICA SUR %u2013 TRAMO 2 S.A.;20511125040;"ITS PARA EL DEPOSITO DE MATERIAL EXCEDENTE KM 240+030 LD DEL PROYECTO CORREDOR VIAL INTEROCEANICO SUR PERÈ-BRASIL, TRAMO N¯2 URCOS-INAMBARI""""";SIN UNIDAD;ITS;Transportes;6/10/2017;Aprobado;SIN DESCRIPCION;-70.42803486;-13.18399565;RD N¯ 018-2017-SENACE- JEF/DEIN;null;
1228;BPZ EXPLORACI‡N & PRODUCCI‡N S.R.L.;20503238463;LOTE Z-1;LOTE Z-1;ITS;Hidrocarburos;24/10/2017;Aprobado;SIN DESCRIPCION;-80.58493767;-3.41461515;RD N¯ 041-2017-SENACE-JEF/DEAR;null;
1229;GOLD FIELDS LA CIMA S.A.;20507828915;PPC PREVIO A LA PRESENTACI‡N DE LA OCTAVA MEIA DE CERRO CORONA;SIN UNIDAD;PPC;Miner°a;26/09/2018;Aprobado;SIN DESCRIPCION;-78.63109127;-6.76606242;RD N¯ 00031-2018-SENACE-PE/DEAR;null;
1273;MUNICIPALIDAD DISTRITAL DE UCHIZA;20160770032;CONSTRUCCION DE PUENTE, EN EL(LA) PUENTE HUAYNAVE EN LA LOCALIDAD DE HUAYNAVE, DISTRITO DE UCHIZA, PROVINCIA TOCACHE, DEPARTAMENTO SAN MARTIN;CONSTRUCCI‡N DE PUENTE;Clasificaci¢n;Transportes;3/03/2021;Aprobado;SIN DESCRIPCION;-76.27181603;-8.33329743;RD N¯ 00108-2021-SENACE-PE/DEIN;null;
1274;MUNICIPALIDAD DISTRITAL DE SANTA ROSA;20215744907;MEJORAMIENTO Y CREACI‡N DEL CAMINO VECINAL CRUCE CHIVIL - LAGUNA DE OCHENTA, DISTRITO DE ASUNCI‡N - CHACHAPOYAS - AMAZONAS;SIN UNIDAD;Clasificaci¢n;Transportes;31/03/2017;Aprobado;SIN DESCRIPCION;-77.75417632;-5.98675731;RDN¯ 197-2017-SENACE/DCA;null;
1275;PROYECTO ESPECIAL DE INFRAESTRUCTURA DE TRANSPORTE NACIONAL - PROVIAS NACIONAL;20503503639;"ITS PARA EL SERVICIO DE GESTI‡N Y CONSERVACI‡N VIAL POR NIVELES DE SERVICIO DEL CORREDOR VIAL: HUµNUCO - LA UNI‡N - HUALLANCA - DV. ANTAMINA Y PTE. TINGO MAR÷A - LLATA - ANTAMINA, TRAMOS I - VI""""";SIN UNIDAD;ITS;Transportes;28/04/2017;Aprobado;SIN DESCRIPCION;-76.59226419;-9.87836628;RD N¯ 143-2017-SENACE/DCA;null;
1276;COMPA•÷A MINERA ARES S.A.C.;20192779333;SEGUNDO INFORME TêCNICO SUSTENTATORIO DE LA SEGUNDA MEIA - AMPLIACI‡N A 3000 DE LA U.O. PALLANCATA;PALLANCATA;ITS;Miner°a;9/09/2018;Aprobado;SIN DESCRIPCION;-73.17972761;-14.72682934;RD N¯ 020-2018-SENACE-PE/DEAR;null;
1279;EGEJUNIN TUTLUMAYO-IV S.A.C.;20546151167;PRIMER INFORME TêCNICO SUSTENTATORIO PARA LA INSTALACION DE COMPONENTES AUXILIARES;C.H. TULUMAYO IV;ITS;Electricidad;13/06/2020;Aprobado;SIN DESCRIPCION;-75.10089754;-11.56285786;RD N¯ 00143-2020-SENACE-PE/DEAR;null;
1421;MUNICIPALIDAD PROVINCIAL DE AMBO;20146008926;CREACI‡N DE INFRAESTRUCTURA DE DEFENSA RIBERE•A EN LA ZONA EL ARROYO DEL DISTRITO DE AMBO - PROVINCIA DE AMBO - DEPARTAMENTO DE HUµNUCO;INFRAESTRUCTURA DE DEFENSA RIBERE•A;Clasificaci¢n;Agricultura;21/03/2022;Aprobado;SIN DESCRIPCION;-76.20325873;-10.12302545;RD N¯ 156-2022-SENACE-PE/DEIN;null;
1424;COMPA•÷A MINERA ARES S.A.C.;20192779333;QUINTO INFORME TêCNICO SUSTENTATORIO DE LA SEGUNDA MODIFICACI‡N DEL ESTUDIO DE IMPACTO AMBIENTAL DE LA U.O. PALLANCATA;PALLANCATA;ITS;Miner°a;7/09/2020;Aprobado;SIN DESCRIPCION;-70.39899865;-13.15209764;RD N¯ 132-2020-SENACE-PE/DEAR;null;
1143;CONCESIONARIA INTEROCEANICA SUR TRAMO 2 S.A.;20511125040;INFORME TêCNICO SUSTENTATORIO PARA LA CANTERA MARKJOPATA KM 54+190 LI, DEL PROYECTO CORREDOR VIAL INTEROCEµNICO SUR PERÈ-BRASIL, TRAMO N¯ 2 URCOS %u2013 PUENTE INAMBARI;PROYECTO %u201CCORREDOR VIAL INTEROCEµNICO SUR, PERÈ %u2013 BRASIL TRAMO N¯2: URCOS %u2013 INAMBARI%u201D;ITS;Transportes;11/08/2021;Aprobado;SIN DESCRIPCION;-71.00137096;-13.58334373;RD N¯ 00185-2021-SENACE-PE/DEIN;null;
1144;JINZHAO MINING PERÈ S.A.;20520694839;INFORME TêCINOC SUSTENTATORIO PROYECTO MINERO PAMPA DEL PONGO;PAMPA DEL PONGO;ITS;Miner°a;30/12/2017;Aprobado;SIN DESCRIPCION;-74.8361;-15.3609;RD N¯ 020-2018-SENACE-JEF/DEAR;null;
1145;CONCESIONARIA INTEROCEANICA SUR - TRAMO 3 S.A.;20511129975;OBRA ACCESORIA DE ESTABILIZACI‡N DEL SECTOR CR÷TICO KM 318+000 %u2013 KM 321+000 DEL PROYECTO CORREDOR VIAL INTEROCEµNICO SUR PERÈ-BRASIL, TRAMO N¯ 3 PUENTE INAMBARI %u2013 I•APARI;OBRA ACCESORIA DE ESTABILIZACI‡N DEL SECTOR CR÷TICO KM 318+000 %u2013 KM 321+000 DEL PROYECTO CORREDOR VIAL INTEROCEµNICO SUR PERÈ-BRASIL, TRAMO N¯ 3 PUENTE INAMBARI %u2013 I•APARI;ITS;Transportes;19/02/2019;Aprobado;SIN DESCRIPCION;-70.06839137;-12.89360479;RD N¯ 00096-2019--SENACE-PE/DEIN;null;
1230;MUNICIPALIDAD DIST.DE CHALLHUAHUACHO;20288774553;CREACI‡N DE CAMINOS VECINALES DE CHOCCOYO A LOS ANEXOS PAQQARY %u2013 UNION LOMAS, CHOCCOYO %u2013 CCATCCANTA, CHOCCOYO %u2013 ALMASAMACHINAPATA, DE LA COMUNIDAD CAMPESINA DE CHOCCOYO DEL DISTRITO DE CHALLHUAHUACHO - PROVINCIA DE COTABAMBAS - DEPARTAMENTO DE APURIMAC;OFICINA DE ESTUDIOS Y PROYECTOS;Clasificaci¢n;Transportes;16/06/2021;Aprobado;SIN DESCRIPCION;-72.3591563;-14.22511115;RD N¯ 00026-2022-SENACE-PE/DEIN;null;
1231;CNPC PERÈ S.A.;20356476434;MODIFICACI‡N DE LA UBICACI‡N DEL PROYECTO DE S÷SMICA 2D;SIN UNIDAD;ITS;Hidrocarburos;5/06/2019;Aprobado;SIN DESCRIPCION;-73.08533707;-12.16711456;RD N¯ 137-2019-SENACE-PE/DEAR;null;
1232;COMPA•IA MINERA MISKI MAYO S.R.L.;20506285314;SEGUNDO INFORME TêCNICO SUSTENTATORIO DE LA SEGUNDA MODIFICACI‡N DEL ESTUDIO DE IMPACTO AMBIENTAL DETALLADO DE LA MINA DE FOSFATOS BAY‡VAR;MINA DE FOSFATOS BAY‡VAR;ITS;Miner°a;18/09/2020;Aprobado;SIN DESCRIPCION;-80.79762408;-6.02137901;RD N¯ 137-2020-SENACE-PE/DEAR;null;
1234;SAVIA PERÈ S.A.;20203058781;PERFORACION EXPLORATORIA Y DESARROLLO LOTE Z-2B - PE•A NEGRA;LOTE Z-2B;ITS;Hidrocarburos;20/02/2018;Aprobado;SIN DESCRIPCION;-81.26696204;-4.3061036;RD N¯ 054-2018-SENACE-JEF/DEAR;null;
1235;CONCESIONARIA IIRSA NORTE S.A.;20511004251;ITS PARA LAS OBRAS ACCESORIAS EN LOS SECTORES KM 552+970 %u2013 KM 553+000 Y KM 501+870 %u2013 KM 501+950 DEL PROYECTO CORREDOR VIAL AMAZONAS NORTE, TRAMO 2: TARAPOTO - RIOJA;OBRAS ACCESORIAS EN LOS SECTORES KM 552+970 %u2013 KM 553+000 Y KM 501+870 %u2013 KM 501+950 DEL PROYECTO CORREDOR VIAL AMAZONAS NORTE, TRAMO 2: TARAPOTO - RIOJA;ITS;Transportes;9/07/2019;Aprobado;SIN DESCRIPCION;-76.84167805;-6.12385326;RD N¯ 00149-2019-SENACE-PE/DEIN;null;
1280;COMPA•IA MINERA ARES S.A.C.;20192779333;PRIMER INFORME TêCNICO SUSTENTATORIO DEL PROYECTO DE EXPLOTACI‡N CRESPO;U.M. CRESPO;ITS;Miner°a;31/03/2020;Aprobado;SIN DESCRIPCION;-72.38519095;-14.76404163;RD N¯ 083-2020-SENACE-PE;null;
1281;MUNICIPALIDAD DISTRITAL DE  SAN MIGUEL DE CAURI;20176232227;CREACION DEL SERVICIO DE TRANSITABILIDAD EN EL TRAMO: EMP. HU-1161 (TUNANCANCHA) %u2013 HUANCAN %u2013 PICON (COLPAS) DISTRITO DE SAN MIGUEL DE CAURI - PROVINCIA DE LAURICOCHA DEPARTAMENTO DE HUANUCO;CREACION DEL SERVICIO DE TRANSITABILIDAD EN EL TRAMO: EMP. HU-1161 (TUNANCANCHA) %u2013 HUANCAN %u2013 PICON (COLPAS) DISTRITO DE SAN MIGUEL DE CAURI - PROVINCIA DE LAURICOCHA DEPARTAMENTO DE HUANUCO;Clasificaci¢n;Transportes;7/05/2021;Aprobado;SIN DESCRIPCION;-76.48726519;-10.14966886;RD N¯ 00142-2021-SENACE-PE/DEIN;null;
1284;COMPA•÷A MINERA COIMOLACHE S.A.;20140688640;SEXTO INFORME TêCNICO SUSTENTATORIO DE LA SEGUNDA MODIFICACI‡N DEL ESTUDIO DE IMPACTO AMBIENTAL;U.M. TANTAHUATAY-CIêNAGA NORTE;ITS;Miner°a;24/02/2020;Aprobado;SIN DESCRIPCION;-78.69104144;-6.73433487;RD N¯ 00080-2020-SENACE-PE/DEAR;null;
1285;AUTORIDAD PARA LA RECONSTRUCCION CON CAMBIOS;20602114091;CREACI‡N DEL SERVICIO DE PROTECCI‡N CONTRA INUNDACIONES EN LA QUEBRADA SAN IDELFONSO, EN LOS DISTRITOS DE EL PORVENIR, TRUJILLO Y VICTOR LARCO HERRERA DE LA PROVINCIA DE TRUJILLO - DEPARTAMENTO DE LA LIBERTAD;SIN UNIDAD;IGAPRO;Agricultura;29/05/2022;Aprobado;SIN DESCRIPCION;-78.97361703;-8.02890098;RD N¯ 00142-2022-SENACE-PE/DEIN;null;
1425;MUNICIPALIDAD DISTRITAL DE ANCHIHUAY;20574738866;CREACI‡N CAMINO VECINAL BUENA GANA - MARAYNIYOQ, DISTRITO DE ANCHIHUAY %u2013 LA MAR - AYACUCHO;CREACI‡N CAMINO VECINAL BUENA GANA - MARAYNIYOQ, DISTRITO DE ANCHIHUAY %u2013 LA MAR - AYACUCHO;Clasificaci¢n;Transportes;10/07/2019;Aprobado;SIN DESCRIPCION;-73.60211956;-12.90625629;RD N¯ 00181-2019-SENACE-PE/DEIN;null;
1426;MINSUR S.A.;20100136741;INFORME TêCNICO SUSTENTATORIO MODIFICACIONES EN EL DEPOSITO DE RELAVES B3 Y EN LA PLANTA DE TRATAMIENTO DE AGUA POTABLE;U.M. SAN RAFAEL;ITS;Miner°a;2/07/2016;Aprobado;SIN DESCRIPCION;-70.3237;-14.2258;RD N¯ 055-2016-SENACE/DCA;null;
1428;ENERGêTICA MONZ‡N S.A.C.;20566087457;L÷NEA DE TRANSMISI‡N 138 KV S.E. AYANUNGA - S.E. AMPLIACI‡N 8 DE AGOSTO;L.T. AYANUNGA-AMPLIACION;Clasificaci¢n;Electricidad;8/03/2017;Aprobado;SIN DESCRIPCION;-76.4582175;-9.31037971;RD N¯ 134-2017-SENACE/DCA;null;
1429;CONCESIONARIA IIRSA NORTE S.A.;20511004251;OBRA ACCESORIA EN EL SECTOR KM 581+039 %u2013 KM 581+409 DEL PROYECTO CORREDOR VIAL AMAZONAS NORTE, TRAMO 2: TARAPOTO %u2013 RIOJA.;OBRA ACCESORIA EN EL SECTOR KM 581+039 %u2013 KM 581+409 DEL PROYECTO CORREDOR VIAL AMAZONAS NORTE, TRAMO 2: TARAPOTO %u2013 RIOJA.;ITS;Transportes;20/02/2019;Aprobado;SIN DESCRIPCION;-76.84167805;-6.12385326;RD N¯ 00114-2019-SENACE-PE/DEIN;null;
1054;ANDEAN POWER S.A.C.;20503684242;L÷NEA DE TRANSMISI‡N 60 KV TRAMO V-10 HACIA S.E. CARHUAC;L.T. CARHUAC;Clasificaci¢n;Electricidad;25/04/2016;Aprobado;SIN DESCRIPCION;-76.5035;-11.6613;RD N¯ 049-2016-SENACE/DCA;null;
1055;UPLAND OIL AND GAS LLC SUCURSAL DEL PERÈ;20516244161;REUBICACI‡N DE PLATAFORMAS D PERFORACI‡N D 02 POZOS EXPLORATORIOS Y 19 POZOS CONFIRMATORIOS DEL EIA DE PERFORACI‡N DE 36 POZOS EN LA FASE DE EXPLORACI‡N(6 EXPLORATORIOS Y 30 CONFIRMATORIOS)-LOTE X;LOTE XXIII;ITS;Hidrocarburos;30/04/2018;Aprobado;SIN DESCRIPCION;-80.631;-3.7036;RD N¯ 103-2018-SENACE-JEF/DEAR;null;
1056;AUTOPISTA DEL NORTE S.A.C.;20520929658;ITS PARA %u201CINCORPORAR EL DEP‡SITO DE MATERIAL EXCEDENTE (DME) LA LµMPARA KM 377+300 MD Y EL DEP‡SITO DE MATERIAL EXCEDENTE (DME) R÷O CASMA KM 379+500 MI%u201D, DEL PROYECTO MEIA %u201CSEGUNDA CALZADA RED VIAL N¯ 4 PATIVILCA %u2013 DV. SALAVERRY%u201D;SIN UNIDAD;ITS;Transportes;15/12/2017;Aprobado;SIN DESCRIPCION;-78.32465574;-9.46633917;RD N¯ 057-2018-SENACE-JEF/DEIN;null;
1057;SHAHUINDO S.A.C.;20505792042;"PROYECTO: ACTUALIZACI‡N DEL ESTUDIO DEFINITIVO DE INGENIER÷A PARA EL PUENTE CHUQUIBAMBA Y ACCESOS""""";SIN UNIDAD;Clasificaci¢n;Transportes;16/06/2017;Aprobado;SIN DESCRIPCION;-78.14029134;-7.60848716;RD N¯ 320-2017-SENACE/DCA;null;
759;SAPET DEVELOPMENT PERÈ INC., SUCURSAL DEL PERÈ;20168702346;MODIFICACI‡N DE UBICACI‡N DE DIECIOCHO (18) POZOS DE DESARROLLO EN EL LOTE VII/VI;LOTE VII/VI;ITS;Hidrocarburos;8/06/2017;Aprobado;SIN DESCRIPCION;-81.21173445;-4.52022958;RD N¯ 200-2017-SENACE/DCA;null;
760;COMPA•IA MINERA CHUNGAR S.A.C.;20514608041;PLAN DE PARTICIPACI‡N CIUDADANA (CON TUPA) - M-CLS-NT-00044-2019 - PLAN DE PARTICIPACI‡N CIUDADANA PREVIO A LA PRESENTACI‡N DE LA MEIA-D ANIMON;ANIMON;PPC;Miner°a;25/08/2020;Aprobado;SIN DESCRIPCION;-70.39899865;-13.15209764;RD N¯ 140-2020-SENACE-PE/DEAR;null;
761;MUNICIPALIDAD DISTRITAL SAN ISIDRO DE MAINO;20168006862;CREACI‡N DE LA V÷A VECINAL EN LOS TRAMOS HISHMISHTRANCA %u2013 PUMAHUASI, HISHMISHTRANCA %u2013 TIOPUCRO, CORRAL %u2013 SAHUAL, DISTRITO DE SAN ISIDRO DEL MAINO, PROVINCIA CHACHAPOYAS, REGI‡N AMAZONAS;CREACI‡N DE LA V÷A VECINAL EN LOS TRAMOS HISHMISHTRANCA %u2013 PUMAHUASI, HISHMISHTRANCA %u2013 TIOPUCRO, CORRAL %u2013 SAHUAL, DISTRITO DE SAN ISIDRO DEL MAINO, PROVINCIA CHACHAPOYAS, REGI‡N AMAZONAS;Clasificaci¢n;Transportes;29/04/2019;Aprobado;SIN DESCRIPCION;-77.86909847;-6.32619989;RD N¯ 00122-2019-SENACE-PE/DEIN;null;
762;COMPA•÷A MINERA ANTAPACCAY S.A.;20114915026;MEIA DEL PROYECTO ANTAPACCAY EXPANSI‡N TINTAYA INTEGRACI‡N COROCCOHUAYCO;U.M. ANTAPACCAY;MEIA-d;Miner°a;27/04/2018;Aprobado;SIN DESCRIPCION;-71.2618;-14.9546;RD N¯ 00196-2019-SENACE-PE/DEAR;null;
764;MUNICIPALIDAD DISTRITAL DE MEGANTONI;20601625017;CONSTRUCCI‡N DEL CAMINO VECINAL DEL SECTOR VISTA ALEGRE MISHAHUA HACIA ALTO MISHAHUA, DEL DISTRITO DE MEGANTONI, LA CONVENCI‡N - CUSCO;CONSTRUCCI‡N DEL CAMINO VECINAL DEL SECTOR VISTA ALEGRE MISHAHUA HACIA ALTO MISHAHUA, DEL DISTRITO DE MEGANTONI, LA CONVENCI‡N - CUSCO;Clasificaci¢n;Transportes;21/11/2019;Aprobado;SIN DESCRIPCION;-72.96531854;-11.30276426;RD N¯ 074-2020-SENACE-PE;null;
856;MINSUR S.A.;20100136741;REAPROVECHAMIENTO DE RELAVES DE LA UNIDAD MINERA SAN RAFAEL;U.M. SAN RAFAEL;MEIA-d;Miner°a;14/09/2016;Aprobado;SIN DESCRIPCION;-70.3254;-14.2296;RD N¯ 095-2017-SENACE-DCA;null;
858;GERENCIA SUB REGIONAL LUCIANO CASTILLO COLONNA DEL GOBIERNO REGIONAL DE PIURA;20315880069;"PROYECTO DE INVERSI‡N PÈBLICA MEJORAMIENTO Y CONSTRUCCI‡N CARRETERA EL GUINEO - CHIVATOS, DISTRITO DE SUYO - AYABACA -PIURA""""";SIN UNIDAD;Clasificaci¢n;Transportes;31/05/2017;Aprobado;SIN DESCRIPCION;-80.13431348;-4.51346691;RD N¯ 034-2017-SENACE- JEF/DEIN;null;
859;TREVALI PERÈ S.A.C.;20516488973;SEGUNDO INFORME TêCNICO SUSTENTATORIO (ITS) DE LA UNIDAD MINERA SANTANDER;SANTANDER;ITS;Miner°a;2/02/2021;Aprobado;SIN DESCRIPCION;-76.52423823;-11.18433573;"RD N¯ 051-2021-SENACE-PE/DEAR";null;
861;COMPAN÷A MINERA ARES S.A.C.;20192779333;TERCER ITS DE LA 2DA MODIFICACI‡N DEL ESTUDIO DE IMPACTO AMBIENTAL DE LA U.O. PALLANCATA;PALLANCATA;ITS;Miner°a;7/12/2018;Aprobado;SIN DESCRIPCION;-73.17972761;-14.72682934;RD N¯ 010-2019-SENACE-PE/DEAR;null;
862;CONCESIONARIA IIRSA NORTE S.A.;20511004251;ITS DE LAS INSTALACIONES AUXILIARES PARA EL MANTENIMIENTO DEL TRAMO N¯6: PIURA - PAITA, DEL PROYECTO CORREDOR VIAL AMAZONAS NORTE;INSTALACIONES AUXILIARES PARA EL MANTENIMIENTO DEL TRAMO N¯6: PIURA - PAITA, DEL PROYECTO CORREDOR VIAL AMAZONAS NORTE;ITS;Transportes;18/07/2019;Aprobado;SIN DESCRIPCION;-80.75123974;-5.15656882;RD N¯ 00155-2019-SENACE-PE/DEIN;null;
883;COMPA•÷A DE MINAS BUENAVENTURA S.A.A.;20100079501;PRIMER ITS DE LA MEIA DE LA UEA UCHUCCHACUA;U.M. UCHUCCHACUA;ITS;Miner°a;10/02/2017;Aprobado;SIN DESCRIPCION;-76.68099049;-10.62593988;RD N¯ 077-2017-SENACE/DCA;null;
954;MUNICIPALIDAD DISTRITAL DE MORROPE;20198667260;MEJORAMIENTO DEL CAMINO VECINAL, MORROPE, PEDREGAL, LAS MERCEDES, HUACA DE BARRO, LAS PAMPAS, LAGARTERA, BARRIO NUEVO. DISTRITO DE MORROPE - LAMBAYEQUE - LAMBAYEQUE;SIN UNIDAD;Clasificaci¢n;Transportes;3/01/2017;Aprobado;SIN DESCRIPCION;-79.97486426;-79.97486426;RD N¯ 116-2017-SENACE/DCA;null;
956;CEPSA PERUANA S.A.C.;20516908930;MODIFICACI‡N DE COMPONENTES Y ACTIVIDADES DEL PROYECTO DE PERFORACI‡N EXPLORATORIA DEL POZO SAN ALEJANDRO 2X;LOTE 131;ITS;Hidrocarburos;5/04/2017;Aprobado;SIN DESCRIPCION;-75.10423389;-8.83863417;RD N¯ 173-2017-SENACE/DCA;null;
957;CONSORCIO TRANSMANTARO S.A.;20383316473;L÷NEA DE DISTRIBUCI‡N EN10KV VILLA AZUL - S.E. COLCABAMBA;S.E. MATARO;ITS;Electricidad;31/01/2017;Aprobado;SIN DESCRIPCION;-74.64658938;-12.37538878;RD N¯ 047-2017-SENACE/DCA;null;
1060;COMPA•IA DE MINAS BUENAVENTURA S.A.A.;20100079501;TERCER INFORME TêCNICO SUSTENTATORIO DE LA U.E.A. JULCANI;U.E.A. JULCANI;ITS;Miner°a;26/04/2019;Aprobado;SIN DESCRIPCION;-74.80457437;-12.94399997;RD N¯ 095-2019-SENACE-PE/DEAR;null;
1062;AEROPUERTOS DEL PERU S.A.;20514513172;PPC DEL EIA DETALLADO PARA EL PROYECTO %u201CMEJORAMIENTO DEL SERVICIO AEROPORTUARIO DE LA REGI‡N LAMBAYEQUE MEDIANTE LA MODERNIZACI‡N DEL AEROPUERTO INTERNACIONAL CAPITµN FAP JOSê ABELARDO QUI•ONES GONZµLES DE CHICLAYO%u201D;SIN UNIDAD;PPC;Transportes;15/03/2021;Aprobado;SIN DESCRIPCION;-79.82734978;-79.82734978;RD N¯ 00071-2021-SENACE-PE/DEIN;null;
1063;PETR‡LEOS DEL PERÈ PETROPERÈ S.A.;20100128218;PPC DE LA MODIFICACI‡N DEL EIA DEL %u201CPROYECTO ODERNIZACI‡N REFINER÷A TALARA - PROYECTO CONSTRUCCI‡N E INSTALACI‡N DE LA L÷NEA DE TRANSMISI‡N ELêCTRICA DESDE LA SUBESTACI‡N PARI•AS HASTA LA REFINER÷A TALARA%u201D;SIN UNIDAD;PPC;Hidrocarburos;9/05/2018;Aprobado;SIN DESCRIPCION;-81.22969648;-4.59001059;RD N¯ 070-2018-SENACE-JEF/DEAR;null;
1064;ARIANA OPERACIONES MINERAS S.A.C.;20543905306;SEGUNDO ITS UNIDAD MINERA ARIANA;SIN UNIDAD;ITS;Miner°a;21/11/2019;Aprobado;SIN DESCRIPCION;-76.32123846;-11.49626839;RDN¯0041 -2020-SENACE-PE/DEAR;null;
765;INNOVA AMBIENTAL S.A.;20302891452;INFORME TECNICO SUSTENTATORIO DEL RELLENO SANITARIO CUMBRE;RELLENO SANITARIO CUMBRE;ITS;Residuos S¢lidos;9/11/2022;Aprobado;SIN DESCRIPCION;-79.03521741;-7.94229141;;null;
766;GOBIERNO REGIONAL DE PASCO;20489252270;EVAP DEL PROYECTO MEJORAMIENTO DE LA CARRETERA DEL CENTRO POBLADO DE PARIAMARCA %u2013 YANACACHI %u2013 NUEVA AURORA, DISTRITO DE TICLACAYAN %u2013 PASCO %u2013 PASCO;MEJORAMIENTO DE LA CARRETERA DEL CENTRO POBLADO DE PARIAMARCA %u2013 YANACACHI %u2013 NUEVA AURORA, DISTRITO DE TICLACAYAN %u2013 PASCO %u2013 PASCO;Clasificaci¢n;Transportes;6/11/2018;Aprobado;SIN DESCRIPCION;-76.15976918;-10.64982749;RD N¯ 00099-2019-SENACE-PE/DEIN ;null;
769;CONCESIONARIA IIRSA NORTE S.A.;20511004251;ITS DEP‡SITO DE MATERIAL EXCEDENTE KM 154 +000 LD, TRAMO 4 OLMOS - CORRAL QUEMADO (DISTRITO DE CALLAYUC, PROVINCIA DE CUTERVO, REGI‡N CAJAMARCA);CORREDOR VIAL AMAZONAS NORTE;ITS;Transportes;25/07/2018;Aprobado;SIN DESCRIPCION;-78.85800693;-6.00821737;RD N¯ 00050-2018-SENACE-PE/DEIN;null;
770;PROYECTO ESPECIAL DE INFRAESTRUCTURA DE TRANSPORTE NACIONAL - PROVIAS NACIONAL;20503503639;MEJORAMIENTO A NIVEL DE AUTOPISTA Y/O PAR VIAL, MATARANI %u2013 EMP. PE -1S;MEJORAMIENTO A NIVEL DE AUTOPISTA Y/O PAR VIAL, MATARANI %u2013 EMP. PE -1S;Clasificaci¢n;Transportes;27/02/2019;Aprobado;SIN DESCRIPCION;-71.87181486;-16.62430383;RD N¯ 00134-2019-SENACE-PE/DEIN;null;
864;CONSORCIO TRANSMANTARO S.A.;20383316473;INFORME TêCNICO SUSTENTATORIO N¯ 3 PARA EL PROYECTO %u201CENLACE 500 KV MANTARO-NUEVA YANANGO-CARAPONGO Y SUBESTACIONES ASOCIADAS%u201D %u2013 ITS N¯ 3 %u2013 COYA.;ENLACE 500 KV MANTARO-NUEVA YANANGO-CARAPONGO Y SUBESTACIONES ASOCIADAS;ITS;Electricidad;30/07/2021;Aprobado;SIN DESCRIPCION;-74.84604225;-12.06818581;RD N¯ 00166-2021-SENACE-PE/DEIN;null;
867;LUZ DEL SUR S.A.A.;20331898008;EVAP DEL PROYECTO NUEVA SET SAN MIGUEL Y L÷NEAS ASOCIADAS.;SIN UNIDAD;Clasificaci¢n;Electricidad;16/04/2018;Aprobado;SIN DESCRIPCION;-76.86430774;-11.97240524;RD N¯ 00107-2018-SENACE-JEF/DEIN;null;
868;CONCESIONARIA IIRSA NORTE S.A.;20511004251;ITS PARA LAS OBRAS ACCESORIAS EN LOS SECTORES KM 487+850 %u2013 KM 487+950 Y KM 506+080 %u2013 KM 506+190 DEL PROYECTO CORREDOR VIAL AMAZONAS NORTE, TRAMO 2: TARAPOTO - RIOJA;INFORME TêCNICO SUSTENTATORIO PARA LAS OBRAS ACCESORIAS EN LOS SECTORES KM 487+850 %u2013 KM 487+950 Y KM 506+080 %u2013 KM 506+190 DEL PROYECTO CORREDOR VIAL AMAZONAS NORTE, TRAMO 2: TARAPOTO - RIOJA;ITS;Transportes;30/04/2019;Aprobado;SIN DESCRIPCION;-77.01973776;-6.04602129;RD N¯ 00100-2019-SENACE-PE/DEIN ;null;
961;GOLD FIELDS LA CIMA S.A.;20507828915;CUARTO ITS DE LA UM CERRO CORONA;U.M. CERRO CORONA;ITS;Miner°a;18/06/2018;Aprobado;SIN DESCRIPCION;-78.6297;-6.7658;RD N¯ 109-2018-SENACE-JEF/DEAR;null;
962;PLUSPETROL PERÈ CORPORATION S.A.;20304177552;INFORME TêCNICO SUSTENTATORIO PARA LA REUBICACI‡N A LA LOCACI‡N MALVINAS DEL POZO 1 PROYECTADO EN LA LOCACI‡N KIMARO OSTE DEL LOTE 88;LOTE 88;ITS;Hidrocarburos;6/12/2018;Aprobado;SIN DESCRIPCION;-72.88;-11.8096;RD N¯ 00042-2019-SENACE-PE/DEAR;null;
964;MARCOBRE S.A.C.;20508972734;PRIMER ITS AL EIA DEL PROYECTO MINA JUSTA;MINA JUSTA;ITS;Miner°a;26/09/2016;Aprobado;SIN DESCRIPCION;-75.0756;-15.1505;RD N¯ 102-2016-SENACE-DCA;null;
1067;CONCESIONARIA IIRSA NORTE S.A.;20511004251;ITS MODIFICACI‡N DEL PROYECTO CORREDOR VIAL AMAZONAS NORTE, PARA LA AMPLIACI‡N DE TRES µREAS AUXILIARES (DMEÔS): TRAMO N¯ 3 DV. CORRAL QUEMADO - RIOJA (AMPLIACI‡N DEL DME KM 198+855 LI Y AMPLIACI‡N DEL DME KM 293+550 LD) Y TRAMO N¯4 DV. OLMOS - C;SIN UNIDAD;ITS;Transportes;26/06/2017;Aprobado;SIN DESCRIPCION;-79.61749765;-79.61749765;RD N¯ 030-2017-SENACE- JEF/DEIN;null;
1068;OLYMPIC PERU INC SUCURSAL DEL PERU;20305875539;INFORME TECNICO SUSTENTATORIO PROYECTO DE AMPLIACI‡N PARA LA INSTALACI‡N DE LA ESTACI‡N DE FISCALIZACI‡N OLYMPIC 01 (EFO-01), LOTE XIII-B;LOTE XIII-B;ITS;Hidrocarburos;11/08/2021;Aprobado;SIN DESCRIPCION;-81.06760443;-5.253305;RD N¯ 00136-2021-SENACE-PE/DEAR;null;
771;LIMA AIRPORT PARTNERS S.R.L.;20501577252;SEGUNDA MODIFICACI‡N DEL ESTUDIO DE IMPACTO AMBIENTAL DETALLADO DEL AEROPUERTO INTERNACIONAL JORGE CHµVEZ;INFRAESTRUCTURA AEROPORTUARIA;MEIA-d;Transportes;21/12/2021;Aprobado;SIN DESCRIPCION;-77.11944211;-12.02151859;RD N¯ 00167-2022-SENACE-PE/DEIN;null;
772;VOLCAN COMPA•÷A MINERA S.A.A.;20383045267;PRIMER INFORME TêCNICO SUSTENTATORIO DE LA UNIDAD MINERA TICLIO;U.M. TICLIO;ITS;Miner°a;9/01/2019;Aprobado;SIN DESCRIPCION;-76.17609795;-11.59769712;RD N¯ 045-2019-SENACE-PE/DEAR;null;
774;NATUCULTURA S.A.;20451871286;FUNDO MATSUBARA III Y SALAS DE LA EMPRESA NATUCULTURA S.A.;NATUCULTURA;Clasificaci¢n;Agricultura;28/06/2019;Aprobado;SIN DESCRIPCION;-76.3819833;-13.00621581;RD N¯ 00192-2019-SENACE-PE/DEAR;null;
