ID;TITULAR;RUC;TITULO_PROYECTO;UNIDAD_PROYECTO;TIPO;ACTIVIDAD;FECHA_INICIO;ESTADO;DESCRIPCION;LONGITUD;LATITUD;RESOLUCION;LABEL;
523;MUNICIPALIDAD PROVINCIAL DE AREQUIPA;20154489895;PIP %u201CMEJORAMIENTO DE LA INTERCONEXI‡N VIAL ENTRE LA AV. JUAN DE LA TORRE, CALLE PERAL, CALLE RIVERO Y CALLE JERUSALêN%u201D;SIN UNIDAD;Clasificaci¢n;Transportes;23/03/2018;Aprobado;SIN DESCRIPCION;-71.5320623;-16.39190689;RD N¯ 00028-2018-SENACE-PE/DEIN;null;
530;LA ARENA S.A.;20205467603;CUARTO ITS DE LA TERCERA MEIA-D DE LA U.M. LA ARENA;LA ARENA;ITS;Miner°a;15/09/2020;Aprobado;SIN DESCRIPCION;-70.39899865;-13.15209764;RD N¯ 0131-2020-SENACE-PE/DEAR;null;
531;EMP REG DE SERV PUBLICO DE ELECTRICIDAD;20103795631;MEJORAMIENTO Y AMPLIACI‡N DE REDES DE DISTRIBUCI‡N PRIMARIA, SECUNDARIA Y CONEXIONES DOMICILIARIAS DE 26 SECTORES EN 03 PROVINCIAS DE LOS DEPARTAMENTO DE AMAZONAS Y CAJAMARCA;SIN UNIDAD;Clasificaci¢n;Electricidad;11/10/2018;Aprobado;SIN DESCRIPCION;-78.79819141;-5.68992025;RD N¯ 042-2018-SENACE-JEF/DEIN;null;
498;MUNICIPALIDAD DISTRITAL DE PAUCARTAMBO;20191043546;CREACI‡N DE TROCHA CARROZABLE PUMARAUCA-CARTUCHOPAMPA-GOCHACHUPAN, DISTRITO DE PAUCARTAMBO-PROVINCIA Y REGION PASCO;CREACI‡N DE TROCHA CARROZABLE PUMARAUCA-CARTUCHOPAMPA-GOCHACHUPAN, DISTRITO DE PAUCARTAMBO-PROVINCIA Y REGION PASCO;Clasificaci¢n;Transportes;19/06/2019;Aprobado;SIN DESCRIPCION;-75.7632838;-10.75306818;RD N¯ 0026-2020-SENACE-PE/DEIN;null;
499;CONCESIONARIA INTEROCEANICA SUR - TRAMO 2 S.A.;20601375932;ITS PARA LA OBRA ACCESORIA DE ESTABILIZACI‡N DEL SECTOR CR÷TICO KM 3+440 %u2013 KM 3+500 DEL PROYECTO CORREDOR VIAL INTEROCEµNICO SUR PERÈ-BRASIL, TRAMO N¯ 2 URCOS - PUENTE INAMBARI;OBRA ACCESORIA DE ESTABILIZACI‡N DEL SECTOR CR÷TICO KM 3+440 %u2013 KM 3+500 DEL PROYECTO CORREDOR VIAL INTEROCEµNICO SUR PERÈ-BRASIL, TRAMO N¯ 2 URCOS - PUENTE INAMBARI;ITS;Transportes;9/08/2019;Aprobado;SIN DESCRIPCION;-71.60369033;-13.67505976;RD N¯ 00160-2019-SENACE-PE/DEIN;null;
500;MUNICIPALIDAD DE LA MOLINA;20131365722;MEJORAMIENTO VIAL DE LA AV. MOLINA, TRAMO COMPRENDIDO ENTRE LA AV. JAVIER PRADO - AV. MELGAREJO, DISTRITO DE LA MOLINA - LIMA - LIMA;SIN UNIDAD;Clasificaci¢n;Transportes;27/10/2016;Aprobado;SIN DESCRIPCION;-76.93194915;-12.07776764;RD N¯ 007-2017-SENACE/DCA;null;
503;CONSORCIO TRANSMANTARO S.A.;20383316473;"ITS DE VARIENTES DE LINEA DE TRANSMISI‡N 220KV FRIASPATA-MOLLEPATA Y SUBESTACIONES ASOCIADAS Y MODIFICACI‡N DE UBICACI‡N DE TORRES""""";SIN UNIDAD;ITS;Electricidad;8/11/2017;Aprobado;SIN DESCRIPCION;-74.21613328;-13.11567022;RD N¯ 012-2017-SENACE- JEF/DEIN;null;
504;MINSUR S.A.;20100136741;SEGUNDA MEIA DE LA UNIDAD MINERA PUCAMARCA;U.M. PUCAMARCA;MEIA-d;Miner°a;10/10/2017;Aprobado;SIN DESCRIPCION;-69.80963762;-17.81840252;RD N¯ 065-2018-SENACE-JEF/DEAR;null;
506;ENGIE ENERG÷A PERÈ S.A.;20333363900;EVALUACI‡N PRELIMINAR (EVAP) DEL PROYECTO INTIPAMPA;INTIPAMPA;Clasificaci¢n;Electricidad;8/06/2016;Aprobado;SIN DESCRIPCION;-70.86;-17.2312;RD N¯ 071-2016-SENACE/DCA;null;
509;AUTOPISTA DEL NORTE S.A.C.;20520929658;INFORME TECNICO SUSTENTATORIO (ITS) PARA INCORPORAR NUEVAS AREAS AUXILIARES: DME 01 KM 0+800, CANTERA VESIQUE KM 0+800, PATIO DE MAQUINAS KM 4+600 Y PLANTA DE CONCRETO KM 34+820;V÷A DE EVITAMIENTO CHIMBOTE;ITS;Transportes;13/05/2021;Aprobado;SIN DESCRIPCION;-78.47093463;-9.19702212;RD N¯ 00115-2021-SENACE-PE/DEIN;null;
549;MARCOBRE S.A.C.;20508972734;QUINTO INFORME TêCNICO SUSTENTATORIO DE LA MODIFICACI‡N DEL ESTUDIO DE IMPACTO AMBIENTAL DEL PROYECTO MINA JUSTA;MINA JUSTA;ITS;Miner°a;9/07/2021;Aprobado;SIN DESCRIPCION;-75.06873612;-15.16531649;RD N¯ 00116-2021-SENACE-PE/DEAR;null;
551;CONCESIONARIA IIRSA NORTE S.A.;20511004251;MANTENIMIENTO DE PROYECTOS DE INFRAESTRUCTURA DE TRANSPORTES  EN OPERACI‡N  (NO CONSIDERADOS EN EL ANEXO 1 RM 891-2019-MTC);TRAMO III;ITS;Transportes;20/07/2022;Aprobado;SIN DESCRIPCION;-78.48852721;-5.71524758;RD N¯ 00174-2022-SENACE-PE/DEIN;null;
552;GRA•A Y MONTERO PETROLERA S.A.;20100153832;REUBICACI‡N DE 20 POZOS DE DESARROLLO Y FACILIDADES DE PRODUCCI‡N EN LAS ZONAS A Y D DEL LOTE IV;LOTE IV;ITS;Hidrocarburos;11/11/2016;Aprobado;SIN DESCRIPCION;-81.162;-4.4791;RD N¯ 133-2016-SENACE/DCA;null;
554;MINSUR S.A.;20100136741;SEGUNDO INFORME TêCNICO SUSTENTATORIO DE CAMBIOS A LA PLANTA FUNDICI‡N Y REFINER÷A DE ESTA•O DE MINSUR S.A.;MINSUR;ITS;Miner°a;26/04/2016;Aprobado;SIN DESCRIPCION;-76.1745;-13.7791;RD N¯ 024-2016-SENACE/DCA;null;
555;NEXA RESOURCES EL PORVENIR S.A.C.;20492744833;QUINTO INFORME TêCNICO SUSTENTATORIO PARA LA MODIFICACI‡N DE COMPONENTES AUXILIARES DE LA UNIDAD MINERA EL PORVENIR;U.M. EL PORVENIR;ITS;Miner°a;8/11/2018;Aprobado;SIN DESCRIPCION;-76.21057555;-10.62619379;RD N¯ 058-2018-SENACE-PE/DEAR;null;
556;ANGLO AMERICAN QUELLAVECO S.A.;20137913250;IV MODIFICACI‡N DEL EIA DEL PROYECTO QUELLAVECO;U.M. QUELLAVECO;ITS;Miner°a;5/03/2018;Aprobado;SIN DESCRIPCION;-70.6942;-17.1652;RD N¯ 055-2018-SENACE-JEF/DEAR;null;
558;PETR‡LEOS DEL PERÈ PETROPERÈ S.A.;20100128218;MODIFICACI‡N PLANTA DE µCIDO SULFÈRICO Y MEJORA TECN. EN ALTERNATIVAS DE CONSTRUCCI‡N DEL SIST.CAPTACI‡N DE AGUA DE MAR Y DE EFLUENTES INDUSTRIALES TRATADOS DEL PROYECTO MODERNIZACI‡N REFINER÷A;REFINERIA TALARA;ITS;Hidrocarburos;21/06/2017;Aprobado;SIN DESCRIPCION;-81.28524297;-4.57665534;RD N¯ 256-2017-SENACE/DCA;null;
559;SAPET DEVELOPMENT PERÈ INC., SUCURSAL DEL PERÈ;20168702346;MODIFICACI‡N Y AMPLIACI‡N DEL DUCTO DE RECOLECCI‡N DE GAS NATURAL DE BAJA PRESI‡N PARA SU DISPOSICI‡N EN EL EX LOTE VII;LOTE VII;ITS;Hidrocarburos;30/06/2017;Aprobado;SIN DESCRIPCION;-81.23100692;-4.68613935;RD N¯ 230-2017-SENACE/DCA;null;
572;PROYECTO ESPECIAL DE INFRAESTRUCTURA DE TRANSPORTE NACIONAL - PROVIAS NACIONAL;20503503639;SOLICITUD DE CLASIFICACION DE ESTUDIOS AMBIENTAL DEL PROYECTO REEMPLAZO DEL PUENTE TABLACHACA I EN LOS CORREDOR VIAL NACIONAL RUTA PE 3N TRAMO CONOCOCHA - HUARAZ - PUENTE QUIROZ;REEMPLAZO DEL PUENTE TABLACHACA I EN LOS CORREDOR VIAL NACIONAL RUTA PE 3N TRAMO CONOCOCHA - HUARAZ - PUENTE QUIROZ;Clasificaci¢n;Transportes;3/07/2018;Aprobado;SIN DESCRIPCION;-78.21119124;-8.54273107;RD N¯ 00042-2018-SENACE-PE/DEIN;null;
573;LA ARENA S.A.;20205467603;SEGUNDO ITS DE LA TERCERA MEIA-D DE LA U.M. LA ARENA;U.M. LA ARENA;ITS;Miner°a;26/11/2018;Aprobado;SIN DESCRIPCION;-78.13074324;-7.89273372;RD N¯ 0006-2019-SENACE-PE/DEAR;null;
575;PERU LNG S.R.L.;20506342563;INCORPORACI‡N DE UNA MEJORA TECNOL‡GICA PARA RECUPERAR ETANO DEL GAS NATURAL DE LA PLANTA DE LICUEFACCI‡N %u2013 PAMPA MELCHORITA %u2013 PERU LNG;SIN UNIDAD;ITS;Hidrocarburos;8/05/2019;Aprobado;SIN DESCRIPCION;-76.2978417;-13.2446993;RD N¯ 104-2019-SENACE-PE/DEAR;null;
561;CIA MINERA COIMOLACHE SA;20140688640;PLAN DE PARTICIPACI‡N CIUDADANA (CON TUPA) - 01753-2017 - PLAN DE PARTICIPACI‡N CIUDADANA PREVIO A LA PRESENTACI‡N DE LA TERCERA MODIFICACI‡N DEL ESTUDIO DE IMPACTO AMBIENTAL DE LA U. P. TANTAHUATAY;SIN UNIDAD;PPC;Miner°a;15/01/2021;Aprobado;SIN DESCRIPCION;-78.68525161;-6.73371564;RD N¯ 00038-2021-SENACE-PE/DEAR;null;
562;SAPET DEVELOPMENT PERÈ INC., SUCURSAL DEL PERÈ;20168702346;MODIFICACI‡N Y AMPLIACI‡N DEL DUCTO DE RECOLECCI‡N DE GAS NATURAL DE BAJA PRESI‡N, EX LOTE VI;LOTE VI;ITS;Hidrocarburos;16/09/2016;Aprobado;SIN DESCRIPCION;-81.2953;-4.4747;RD N¯ 085-2016-SENACE/DCA;null;
564;GOLD FIELDS LA CIMA S.A.;20507828915;EXPLOTACI‡N, BENEFICIO Y LABOR GENERAL MINERO METµLICOS;CERRO CORONA;ITS;Miner°a;19/07/2022;Aprobado;SIN DESCRIPCION;-78.63396933;-6.76319334;RD N¯ 0146-2022-SENACE-PE/DEAR;null;
565;COMPA•IA MINERA LINCUNA S.A.;20458538701;PLAN DE PARTICIPACI‡N CIUDADANA (CON TUPA) - M-CLS-NT-00232-2019 - PLAN DE PARTICIPACI‡N CIUDADANA DURANTE LA ELABORACI‡N DEL PROYECTO;PROYECTO HUANCAPET÷;PPC;Miner°a;27/10/2021;Aprobado;SIN DESCRIPCION;-77.51906029;-9.76714244;R. D. N¯ 00164-2021-SENACE-PE/DEAR;null;
566;ENEL GREEN POWER PERÈ S.A.;20543298574;MODIFICACI‡N DEL ESTUDIO DE IMPACTO AMBIENTAL DETALLADO DE LA CENTRAL E‡LICA WAYRA I PARA EL PROYECTO WAYRA EXTENSI‡N;CENTRAL EOLICA WAYRA;Clasificaci¢n;Electricidad;14/03/2019;Aprobado;SIN DESCRIPCION;-75.05621473;-15.05347184;RD N¯ 00087-2019-SENACE-PE/DEAR;null;
569;GENRENT DEL PERÈ S.A.C.;20567129331;INFORME TêCNICO SUSTENTATORIO PARA MODIFICACI‡N DE V÷AS DE ACCESO %u2013 L÷NEA DE TRANSMISI‡N DE 60 KV - IQUITOS;C.T. IQUITOS NUEVA;ITS;Electricidad;6/07/2017;Aprobado;SIN DESCRIPCION;-73.24670539;-3.65695563;RD N¯ 211-2017-SENACE/DCA;null;
571;MUNICIPALIDAD PROVINCIAL DE CANDARAVE;20159714285;CREACI‡N DEL SERVICIO DE AGUA PARA RIEGO DEL SECTOR DE RIEGO CALLAZAS PARA LAS COMISIONES DE USUARIOS DE CAIRANI, HUANUARA, QUILAHUANI Y CANDARAVE, PROVINCIA DE CANDARAVE - TACNA;REPRESA CALLAZAS;Clasificaci¢n;Agricultura;23/09/2020;Aprobado;SIN DESCRIPCION;-70.27191924;-17.05040715;RD N¯ 00028-2021-SENACE-PE/DEIN;null;
537;CONCESIONARIA INTEROCEANICA SUR TRAMO 2 S.A.;20511125040;ITS PARA LA OBRA ACCESORIA DE ESTABILIZACI‡N DEL SECTOR CR÷TICO KM 244+300 %u2013 KM 244+500 DEL PROYECTO CORREDOR VIAL INTEROCEµNICO SUR PERÈ-BRASIL, TRAMO N¯ 2 URCOS - PUENTE INAMBARI;"INFORME TêCNICO SUSTENTATORIO PARA LA OBRA ACCESORIA DE ESTABILIZACI‡N DEL SECTOR CR÷TICO KM 244+300 %u2013 KM 244+500 DEL PROYECTO CORREDOR VIAL INTEROCEµNICO SUR PERÈ-BRASIL, TRAMO N¯ 2 URCOS - PUENTE INAMBARI
";ITS;Transportes;4/06/2020;Aprobado;SIN DESCRIPCION;-70.39727314;-13.18942492;RD N¯ 00087-2020-SENACE-PE/DEIN;null;
539;GASODUCTO SUR PERUANO S.A.;20563236354;MEJORAS A LA SEGURIDAD ENERGêTICA DEL PA÷S Y DESARROLLO DEL GASODUCTO SUR PERUANO;GASODUCTO SUR PERUANO;ITS;Hidrocarburos;25/04/2016;Aprobado;SIN DESCRIPCION;-73.0767;-12.2132;RD N¯ 057-2016-SENACE/DCA;null;
540;MINERA LAS BAMBAS S.A.;20538428524;TERCER ITS DE LA SEGUNDA MODIFICACI‡N DEL EIA PROYECTO LAS BAMBAS;LAS BAMBAS;ITS;Miner°a;21/06/2017;Aprobado;SIN DESCRIPCION;-72.3111318;-14.08383574;RD N¯ 219-2017-SENACE-DCA;null;
544;PROYECTO ESPECIAL DE INFRAESTRUCTURA DE TRANSPORTE NACIONAL - PROVIAS;20503503639;"ITS PARA INCORPORAR 10 NUEVOS DEP‡SITOS DE MATERIAL EXCEDENTE: DME 01KM 103+810 LI; DME 02 KM 106+150 LI; DME 03 KM 108+160 LI; DME 04 KM 111+490 LI; DME 05 KM 116+820 LI; DME 06 KM 117+653 LI; DME 07 KM 124+750 LI; DME 08 KM 128+675 LI";MEJORAMIENTO DE LA CARRETERA;ITS;Transportes;14/12/2020;Aprobado;SIN DESCRIPCION;-76.80432;-9.776518;RD N¯ 00029-2021-SENACE-PE/DEIN;null;
545;MUNICIPALIDAD DISTRITAL DE ORONCCOY;20601577608;CONSTRUCCION DE CAMINO VECINAL UNION PROGRESO TORRE - PACCHA - MANDOR - BELEN CHAPI - VACAHUASI - HUALLHUA - PUMACHACA, DISTRITO DE ORONCCOY - LA MAR - AYACUCHO;%u201CCREACION DE TROCHA CARROZABLE TRAMO UCHUMARCA %u2013 CARAHUAIN L=7+000 KM DISTRITO DE YANAHUANCA, PROVINCIA DANIEL ALCIDES CARRION %u2013 PASCO.;Clasificaci¢n;Transportes;27/07/2020;Aprobado;SIN DESCRIPCION;-73.42595264;-13.16606323;RD N¯ 00149-2020-SENACE-PE/DEIN;null;
546;GASODUCTO SUR PERUANO S.A.;20563236354;MODIFICACI‡N DE COMPONENTES AUXILIARES DEL TRAZO ENTRE LOS TRAMOS KP 04+000 AL KP 40+000;GASODUCTO SUR PERUANO;ITS;Hidrocarburos;28/06/2016;Aprobado;SIN DESCRIPCION;-73.0502;-11.9885;RD N¯ 078-2016-SENACE/DCA;null;
547;COMPA•IA MINERA SAN IGNACIO DE MOROCOCHA S.A.A.;20100177421;PRIMER INFORME TêCNICO SUSTENTATORIO DE LA MODIFICACI‡N DEL ESTUDIO DE IMPACTO AMBIENTAL DEL PROYECTO CONDUCCI‡N Y DISPOSICI‡N FINAL DE RELAVES LA ESPERANZA DE LA UNIDAD MINERA SAN VICENTE %u201CMEJORA TECNOL‡GICA EN LA PLANTA CONCENTRADORA%u201D;UNIDAD MINERA SAN VICENTE;ITS;Miner°a;18/10/2021;Aprobado;SIN DESCRIPCION;-75.38652163;-11.23406477;RD N¯ 00162-2021-SENACE-PE/DEAR;null;
579;SOCIEDAD MINERA EL BROCAL S.A.A.;20100017572;MODIFICACION DEL EIA AMPLIACION DE OPERACIONES A 18000 TMD;U.M. COLQUIJIRCA;ITS;Miner°a;11/10/2016;Aprobado;SIN DESCRIPCION;-76.2856;-10.7663;RD N¯ 113-2016-SENACE/DCA;null;
580;NEXA RESOURCES PERU S.A.C.;20100110513;TERCER ITS DE LA MODIFICACI‡N DEL ESTUDIO DE IMPACTO AMBIENTAL DE LA U.M. CERRO LINDO PARA AMPLIACI‡N DE LA PLANTA CONCENTRADORA A 22.5 K TMD E INSTALACIONES ADICIONALES.;UM CERRO LINDO;ITS;Miner°a;7/08/2020;Aprobado;SIN DESCRIPCION;-75.99558315;-13.09060665;RD N¯ 00145-2020-SENACE-PE/DEAR;null;
581;COMPA•÷A MINERA CONDESTABLE S.A.;20100056802;INCORPORACI‡N Y/O AMPLIACI‡N DE COMPONENTES E INTEGRACI‡N DE LAS UNIDADES;U.M. CONDESTABLE;ITS;Miner°a;23/04/2018;Aprobado;SIN DESCRIPCION;-76.5951;-12.6975;RD N¯ 071-2018-SENACE-JEF/DEAR;null;
582;CONSORCIO TRANSMANTARO S.A.;20383316473;CONSTRUCCI‡N DE LA PRIMERA ETAPA DE LA S.E. CARAPONGO Y ENLACES DE CONEXI‡N A L÷NEAS ASOCIADAS;S.E. CARAPONGO;Clasificaci¢n;Electricidad;8/04/2016;Aprobado;SIN DESCRIPCION;-76.8656;-11.9805;RD N¯ 029-2016-SENACE/DCA;null;
595;COMPA•÷A MINERA LINCUNA S.A.;20458538701;"TERCER INFORME TêCNICO SUSTENTATORIO ACTIVIDADES DE EXPLORACI‡N, MODIFICACI‡N DE COMPONENTES AUXILIARES Y CAMBIO DE CRONOGRAMA EN RELLENO HIDRAÈLICO""""";U.M. HUANCAPETI;ITS;Miner°a;24/01/2020;Aprobado;SIN DESCRIPCION;-77.54510754;-9.75729587;RD N¯ 066-2020-SENACE-PE/DEAR;null;
596;TERNA PERU S.A.C.;20602232256;ITS PARA EL MEJORAMIENTO TECNOL‡GICO EN LAS FUNDACIONES DE TORRES EN LOS TRAMOS T230-T267 Y T274-T297;MEJORAMIENTO TECNOL‡GICO EN LAS FUNDACIONES DE TORRES EN LOS TRAMOS T230-T267 Y T274-T298;ITS;Electricidad;12/02/2020;Aprobado;SIN DESCRIPCION;-74.66033373;-8.41843332;RD N¯ 056-2020-SENACE-PE/DEI;null;
597;MINERA LA ZANJA S.R.L.;20507975977;QUINTO INFORME TêCNICO SUSTENTATORIO DE LA IV MEIAD DE LA UM LA ZANJA;LA ZANJA;ITS;Miner°a;23/01/2022;Aprobado;SIN DESCRIPCION;-78.90192169;-6.82886942;RD N¯ 00055-2022-SENACE-PE/DEAR;null;
598;SOCIEDAD MINERA CERRO VERDE S.A.A.;20170072465;SêPTIMO INFORME TêCNICO SUSTENTATORIO DE LA  MODIFICACI‡N DE ESTUDIO DE IMPACTO AMBIENTAL Y SOCIAL DE LA EXPANSI‡N  DE LA UNIDAD DE PRODUCCI‡N CERRO VERDE;UNIDAD DE PRODUCCI‡N CERRO VERDE;ITS;Miner°a;22/01/2022;Aprobado;SIN DESCRIPCION;-71.58299055;-16.52561525;RD N¯ 00079-2022-SENACE-PE/DEAR;null;
599;GAZ ET L'ENERGIE S.A.C.;20522662462;PROYECTO CENTRAL TêRMICA HUMAY;C.T. HUMAY;Clasificaci¢n;Electricidad;22/02/2017;Aprobado;SIN DESCRIPCION;-75.95838916;-13.71404519;RD N¯ 114-2017-SENACE/DCA;null;
601;PROGRAMA DE GOBIERNO REGIONAL DE LIMA METROPOLITANA;20518396332;"DIA MEJORAMIENTO DE PISTAS Y VEREDAS DE LA CALLE TOKIO, TRAMO: AV. LOS LAURELES - AV. LAS AGUILAS Y EN LA AV. LAS AGUILAS, TRAMO: CALLE TOKIO - AV. LOS CISNES DISTRITO DE LURIGANCHO, PROVINCIA DE LI*""";MEJORAMIENTO DE PISTAS Y VEREDAS DE LA CALLE TOKIO, TRAMO: AV. LOS LAURELES - AV. LAS AGUILAS Y EN LA AV. LAS AGUILAS, TRAMO: CALLE TOKIO - AV. LOS CISNES DISTRITO DE LURIGANCHO, PROVINCIA DE LIMA -LIMA, CODIGO DE INVERSION 2386505;Clasificaci¢n;Transportes;8/08/2018;Aprobado;SIN DESCRIPCION;-76.93109746;-12.01830267;RD N¯ 00007-2019-SENACE-PE/DEIN;null;
602;GOBIERNO REGIONAL DE ANCASH;20530689019;CREACI‡N DEL SERVICIO DE PROTECCI‡N EN RIBERA DEL RIO HUARMEY VULNERABLE ANTE EL PELIGRO EN EL SECTOR EL ARENAL %u2013 PUENTE PANAMERICANA, DISTRITO DE HUARMEY, PROVINCIA DE HUARMEY, DEPARTAMENTO DE ANCASH;PROTECCI‡N EN RIBERA DEL RIO HUARMEY;IGAPRO;Agricultura;28/10/2020;Aprobado;SIN DESCRIPCION;-78.15508061;-10.0726606;RD N¯ 00007-2021-SENACE-PE/DEIN;null;
603;CNPC PERÈ S.A.;20356476434;AMPLIACI‡N DEL µREA DE LAS PLATAFORMAS DE PERFORACI‡N Y FACILIDADES DE PRODUCCI‡N PARA 42 POZOS;LOTE X;ITS;Hidrocarburos;17/02/2017;Aprobado;SIN DESCRIPCION;-81.16118187;-4.28121767;RD N¯ 072-2017-SENACE/DCA;null;
604;COMPA•÷A MINERA CHUNGAR S.A.C.;20514608041;MOD. POR AMPLIACI‡N EIA ISLAY 500 A 2000 TMSD;U.M. ISLAY;ITS;Miner°a;28/05/2018;Aprobado;SIN DESCRIPCION;-76.468;-11.0103;RD N¯ 094-2018-SENACE-JEF/DEAR;null;
617;IMPALA TERMINALS PERU S.A.C.;20506377600;TERCER ITS DEL ALMACêN GARZA AZUL;ILO;ITS;Miner°a;1/07/2020;Aprobado;SIN DESCRIPCION;-77.12860255;-12.04388931;RD N¯ 105-2020-SENACE-PE/DEAR;null;
619;CNPC PERÈ S.A.;20356476434;ITS PARA LA %u201CMODIFICACI‡N DE LA UBICACI‡N, TAMA•O DE LA PLATAFORMA, V÷AS DE ACCESO, PROFUNDIDAD Y L÷NEA DE CONDUCCI‡N DE POZO PROFUNDO 1416 EN EL LOTE X%u201D;SIN UNIDAD;ITS;Hidrocarburos;24/07/2019;Aprobado;SIN DESCRIPCION;-81.22897636;-4.32147629;RD N¯ 0167-2019-SENACE-PE/DEAR;null;
620;EMERGENT COLD PERU S.A.C.;20603281994;PLANTA DE PROCESAMIENTO, CONGELAMIENTO, EMPAQUE Y ALMACENAMIENTO DE FRUTAS;CONGELADOS ERMERGENT;Clasificaci¢n;Agricultura;24/10/2018;Aprobado;SIN DESCRIPCION;-80.68951908;-5.15702479;RD N¯ 00037-2019-SENACE-PE/DEAR;null;
621;SOCIEDAD MINERA AUSTRIA DUVAZ S.A.C.;20100102171;EXTENSI‡N DEL DEP‡SITO DE RELAVES PUQUIOCOCHA, AMPLIACI‡N DEL ALMACêN DE CONCENTRADOS Y MODIFICACI‡N DE COMPONENTES AUXILIARES;U.M. PUQUIOCOCHA;ITS;Miner°a;20/12/2016;Aprobado;SIN DESCRIPCION;-76.13276867;-11.59644155;RD N¯ 023-2017-SENACE/DCA;null;
622;ENGIE ENERG÷A PERÈ S.A.;20333363900;MODIFICACI‡N DE COMPONENTES AUXILIARES DE LA CENTRAL HIDROELêCTRICA QUITARACSA I, POR LA INCLUSI‡N DEL CAMPAMENTO CAVERNA Y SISTEMAS DE TRATAMIENTO EN CASA DE MµQUINAS;C.H. QUITARACSA I;ITS;Electricidad;18/07/2017;Aprobado;SIN DESCRIPCION;-77.84703518;-8.80356492;RD N¯ 270-2017-SENACE/DCA;null;
623;ACCESS WORLD (PERÈ) S.A.C.;20557068245;ESTACI‡N DE TRASVASE DE CONCENTRADOS MINERALES ACCESS WORLD;ACCESS WORLD;Clasificaci¢n;Miner°a;11/12/2017;Aprobado;SIN DESCRIPCION;-77.12164439;-12.04754348;RD N¯ 041-2018-SENACE-JEF/DEAR;null;
605;MINERA LA ZANJA S.R.L.;20507975977;CUARTO ITS DE LA CUARTA MODIFICACI‡N DEL ESTUDIO DE IMPACTO AMBIENTAL DETALLADO DEL PROYECTO LA ZANJA;U.M. LA ZANJA;ITS;Miner°a;22/07/2019;Aprobado;SIN DESCRIPCION;-78.88720346;-6.82124766;RD N¯ 0160-2019-SENACE-PE/DEAR;null;
606;EMPRESA DE GENERACI‡N ELêCTRICA SAN GABµN S.A.;20262221335;PLAN DE PARTICIPACI‡N CIUDADANA PARA LA ELABORACI‡N Y EVALUACI‡N DE LA MODIFICACI‡N DEL EIA DEL PROYECTO %u201CCENTRAL HIDROELêCTRICA SAN GABµN II%u201D;SIN UNIDAD;PPC;Electricidad;23/07/2021;Aprobado;SIN DESCRIPCION;-70.60936713;-70.60936713;RD N¯ 00113-2021-SENACE-PE/DEAR;null;
607;MUNICIPALIDAD DISTRITAL DE LA JOYA;20167246029;PROYECTO MEJORAMIENTO DEL SERVICIO DE AGUA PARA RIEGO DE LA JOYA NUEVA EN LOS SECTORES DE LA CANO, SAN CAMILO Y SAN ISIDRO, DISTRITO DE LA JOYA, PROVINCIA DE AREQUIPA, REGI‡N AREQUIPA%u201D;SIN UNIDAD;Clasificaci¢n;Agricultura;9/03/2018;Aprobado;SIN DESCRIPCION;-71.83911149;-16.66295493;RD N¯ 00076-2018-SENACE-PE/DEIN;null;
609;GEOPARK PERÈ S.A.C.;20565367952;LOTE 64;LOTE 64;Clasificaci¢n;Hidrocarburos;1/12/2017;Aprobado;SIN DESCRIPCION;-77.29823814;-3.14220073;RD N¯ 040-2018-SENACE-JEF/DEAR;null;
610;GOBIERNO REGIONAL MOQUEGUA;20519752604;MEJORAMIENTO DEL SERVICIO DE PROVISI„N DE AGUA PARA RIEGO EN LOS BLOQUES DE ILUBAYA, TORATA Y YACANGO DEL DISTRITO DE TORATA - PROVINCIA DE MARISCAL NIETO - DEPARTAMENTO DE MOQUEGUA;MEJORAMIENTO DEL SERVICIO DE PROVISI‡N DE AGUA PARA RIEGO EN LOS BLOQUES DE ILUBAYA, TORATA Y YACANGO, DISTRITO DE TORATA, PROVINCIA DE MARISCAL NIETO, DEPARTAMENTO DE MOQUEGUA;Clasificaci¢n;Agricultura;16/02/2022;Aprobado;SIN DESCRIPCION;-70.64478329;-17.00153883;RD N¯ 0148-2022-SENACE-PE/DEIN;null;
611;SHAHUINDO S.A.C.;20505792042;MODIFICACI‡N DE INSTALACIONES AUXILIARES;U.M. SHAHUINDO;ITS;Miner°a;28/02/2017;Aprobado;SIN DESCRIPCION;-78.20191828;-7.61210397;RD N¯ 089-2017-SENACE/DCA;null;
613;CONCESIONARIA INTEROCEANICA SUR - TRAMO 2 S.A.;20511125040;ITS PARA EL DEP‡SITO DE MATERIAL EXCEDENTE KM 146+900 LD DEL PROYECTO CORREDOR VIAL INTEROCEµNICO SUR PERÈ- BRASIL, TRAMO Nß 2 URCOS %u2013 INAMBARI;CORREDOR VIAL INTEROCEµNICO SUR, PERÈ-BRASIL, TRAMO 2: URCOS - INAMBARI;ITS;Transportes;31/07/2018;Aprobado;SIN DESCRIPCION;-70.89579055;-13.52613218;RD N¯ 00097-2018-SENACE-PE/DEIN;null;
614;MINERA YANACOCHA S.R.L.;20137291313;MODIFICACI‡N DEL ESTUDIO DE IMPACTO AMBIENTAL YANACOCHA;U.M. YANACOCHA;MEIA-d;Miner°a;30/04/2018;Aprobado;SIN DESCRIPCION;-78.5205;-6.9862;RD N¯ 00049-2019-SENACE-PE/DEAR;null;
615;GOLD FIELDS LA CIMA S.A.;20507828915;U.M. CERRO CORONA;U.M. CERRO CORONA;ITS;Miner°a;29/12/2017;Aprobado;SIN DESCRIPCION;-78.62061249;-6.76329946;RD N¯ 021-2018-SENACE-JEF/DEAR;null;
616;AUTOPISTA DEL NORTE S.A.C.;20520929658;EVAP PROYECTO DE REHABILITACI‡N DE LA CALZADA ACTUAL: TRAMO VIAL PATIVILCA %u2013 SANTA %u2013 CRUCE DE LA PANAMERICANA NORTE CON EL PUERTO SALAVERRY Y SALAVERRY - EMPALME R01N;REHABILITACI‡N DE LA CALZADA ACTUAL: TRAMO VIAL PATIVILCA %u2013 SANTA %u2013 CRUCE DE LA PANAMERICANA NORTE CON EL PUERTO SALAVERRY Y SALAVERRY - EMPALME R01N;Clasificaci¢n;Transportes;29/03/2019;Aprobado;SIN DESCRIPCION;-78.99739628;-8.17464834;Oficio N¯ 00444-2019-SENACE-PE/DEIN ;null;
583;MUNICIPALIDAD DISTRITAL DE CHIRIMOTO;20207202127;CREACI‡N DE LA CARRETERA VECINAL LUZ DEL ORIENTE %u2013 TRIANGULO DE LA ESPERANZA %u2013 NUEVA UNI‡N DISTRITO DE CHIRIMOTO, PROVINCIA DE RODRIGUEZ DE MENDOZA %u2013 AMAZONAS;CREACI‡N DE LA CARRETERA VECINAL;Clasificaci¢n;Transportes;19/04/2021;Aprobado;SIN DESCRIPCION;-77.30511404;-6.73968598;En Evaluaci¢n;null;
584;CONCESIONARIA INTEROCEµNICA SUR - TRAMO 3 S.A.;20511129975;ITS PARA EL %u201CDEP‡SITO DE MATERIAL EXCEDENTE KM 551+860 LI DEL PROYECTO CORREDOR VIAL INTEROCEµNICO SUR PERÈ %u2013 BRASIL, TRAMO N¯ 3 PUENTE INAMBARI - I•APARI%u201D;SIN UNIDAD;ITS;Transportes;10/04/2018;Aprobado;SIN DESCRIPCION;-69.24283774;-69.24283774;RD N¯ 078-2018-SENACE-JEF/DEIN;null;
585;CONCESIONARIA INTEROCEµNICA SUR - TRAMO 3 S.A.;20511129975;ITS PARA LA %u201CHABILITACI‡N DEL ACOPIO KM 590+500 LD DEL CORREDOR VIAL INTEROCEµNICO SUR, TRAMO N¯ 3 PUENTE INAMBARI %u2013 I•APARI%u201D;SIN UNIDAD;ITS;Transportes;28/03/2018;Aprobado;SIN DESCRIPCION;-69.42130935;-69.42130935;RD N¯ 088-2018-SENACE-JEF/DEIN;null;
586;MINERA YANACOCHA S.R.L.;20137291313;SEGUNDO INFORME TêCNICO SUSTENTATORIO DE LA SEGUNDA MODIFICACI‡N DEL ESTUDIO DE IMPACTO AMBIENTAL YANACOCHA;YANACOCHA;ITS;Miner°a;17/11/2021;Aprobado;SIN DESCRIPCION;-78.52286097;-6.98703181;RD N¯ 0031-2022-SENACE-PE/DEAR;null;
587;COMPA•÷A DE MINAS BUENAVENTURA S.A.A.;20100079501;SEGUNDO INFORME TêCNICO SUSTENTATORIO DE LA MODIFICACI‡N DEL ESTUDIO DE IMPACTO AMBIENTAL - UNIDAD MINERA ORCOPAMPA;U.M. ORCOPAMPA;ITS;Miner°a;25/07/2018;Aprobado;SIN DESCRIPCION;-72.35781806;-15.27144774;RD N¯ 008-2018-SENACE-PE/DEAR;null;
588;PROYECTO ESPECIAL DE INFRAESTRUCTURA DE TRANSPORTE NACIONAL - PROVIAS NACIONAL;20503503639;ITS PARA LA INTEGRACI‡N DE TERRENOS ADICIONALES AL POL÷GONO DEL PROYECTO %u201CMEJORAMIENTO DEL SERVICIO AEROPORTUARIO EN LA REGI‡N CUSCO MEDIANTE EL NUEVO AEROPUERTO INTERNACIONAL DE CHINCHERO %u2013 CUSCO%u201D;%u201CMEJORAMIENTO DEL SERVICIO AEROPORTUARIO EN LA REGI‡N CUSCO MEDIANTE EL NUEVO AEROPUERTO INTERNACIONAL DE CHINCHERO %u2013 CUSCO%u201D;ITS;Transportes;5/10/2018;Aprobado;SIN DESCRIPCION;-72.06550063;-13.40699091;RD N¯ 00078-2018-SENACE-PE/DEIN;null;
589;DIRECCION REGIONAL DE TRANSPORTES Y COMUNICACIONES DEL GOBIERNO REGIONAL MADRE DE DIOS;20199189710;CREACI‡N DEL CAMINO VECINAL, INICIO DESV÷O MARGEN DERECHA KM 92 V÷A INTEROCEµNICA (PE. 30C) SOL NACIENTE %u2013 HUACAMAYO, DISTRITO DE INAMBARI, PROVINCIA DE TAMBOPATA %u2013 MADRE DE DIOS;%u201CCREACI‡N DEL CAMINO VECINAL, INICIO DESV÷O MARGEN DERECHA KM 92 V÷A INTEROCEµNICA (PE. 30C) SOL NACIENTE %u2013 HUACAMAYO, DISTRITO DE INAMBARI, PROVINCIA DE TAMBOPATA %u2013 MADRE DE DIOS%u201D;Clasificaci¢n;Transportes;25/11/2021;Aprobado;SIN DESCRIPCION;-69.89347401;-12.89414201;RD N¯ 00095-2022-SENACE-PE/DEIN;null;
590;MARCOBRE S.A.C.;20508972734;CUARTO ITS DE LA MODIFICACI‡N DEL EIAD DEL PROYECTO MINA JUSTA;MINA JUSTA;ITS;Miner°a;29/01/2021;Aprobado;SIN DESCRIPCION;-75.0857432;-15.16364374;RD N¯ 00041-2021-SENACE-PE/DEAR;null;
592;COMPA•÷A MINERA ARES S.A.C.;20192779333;SEGUNDA MEIA - AMPLIACI‡N A 3000 DE LA U.O. PALLANCATA;PALLANCATA;MEIA-d;Miner°a;2/05/2017;Aprobado;SIN DESCRIPCION;-73.17802817;-14.7201373;RD N¯ 342-2017-SENACE-DCA;null;
593;GRA•A Y MONTERO PETROLERA S.A.;20100153832;MEJORAS Y AMPLIACI‡N DE BATER÷AS DE PRODUCCI‡N EN EL LOTE IV: BATER÷A 191, BATER÷A 193 Y BATER÷A 5058;SIN UNIDAD;ITS;Hidrocarburos;7/08/2019;Aprobado;SIN DESCRIPCION;-81.18253829;-4.49652438;RD N¯ 0180-2019-SENACE-PE/DEAR;null;
634;CONCESIONARIA IIRSA NORTE S.A.;20511004251;ITS PARA LA OBRA ACCESORIA EN EL KM 167+740 - KM 167+950 DEL PROYECTO CORREDOR VIAL AMAZONAS NORTE, TRAMO 4: OLMOS - CORRAL QUEMADO;INFORME TêCNICO SUSTENTATORIO PARA LA OBRA ACCESORIA EN EL KM 167+740 - KM 167+950 DEL PROYECTO CORREDOR VIAL AMAZONAS NORTE, TRAMO 4: OLMOS - CORRAL QUEMADO;ITS;Transportes;26/05/2019;Aprobado;SIN DESCRIPCION;-78.83737738;-5.8988517;RD N¯ 00148-2019-SENACE-PE/DEIN;null;
636;MARCOBRE S.A.C.;20508972734;TERCER ITS DE LA MODIFICACI‡N DEL EIAD DEL PROYECTO MINA JUSTA;MINA JUSTA;ITS;Miner°a;12/11/2018;Aprobado;SIN DESCRIPCION;-75.0617;-15.1625;RD N¯ 059-2018-SENACE-PE/DEAR;null;
637;MINSUR S.A.;20100136741;"MODIFICACI‡N DEL EIA DEL PROYECTO REAPROVECHAMIENTO DE RELAVES EN LA UNIDAD MINERA ACUMULACI‡N QUENAMARI - SAN RAFAEL""""";SIN UNIDAD;MEIA-d;Miner°a;14/09/2016;Aprobado;SIN DESCRIPCION;-70.3211634;-14.23732838;RD N¯ 095-2017-SENACE/DCA;null;
642;CONCESIONARIA INTEROCEANICA SUR - TRAMO 3 S.A.;20511129975;INFORME TêCNICO SUSTENTATORIO PARA EL DEP‡SITO DE MATERIAL EXCEDENTE KM 289+626 LI DEL PROYECTO CORREDOR VIAL INTEROCEµNICO SUR PERÈ-BRASIL, TRAMO N¯ 3 PUENTE INAMBARI - I•APARI;CORREDOR VIAL INTEROCEµNICO SUR PERÈ %u2013 BRASIL TRAMO N¯ 3;ITS;Transportes;19/05/2021;Aprobado;SIN DESCRIPCION;-69.42227177;-12.69722958;RD N¯ 00116-2021-SENACE-PE/DEIN;null;
