ID;TITULAR;RUC;TITULO_PROYECTO;UNIDAD_PROYECTO;TIPO;ACTIVIDAD;FECHA_INICIO;ESTADO;DESCRIPCION;LONGITUD;LATITUD;RESOLUCION;LABEL;
2074;HUDBAY PERÈ S.A.C.;20511165181;TERCER ITS DE LA UM CONSTANCIA;U.M. CONSTANCIA;ITS;Miner°a;5/06/2019;Aprobado;SIN DESCRIPCION;-71.77388212;-14.47432846;RD N¯ 120-2019-SENACE-PE/DEAR;null;
1799;PROVIAS DESCENTRALIZADO - MTC;20380419247;%u201CCONSTRUCCI‡N DEL PUENTE VEHICULAR SALVADOR SOBRE EL R÷O HUALLAGA EN AUCAYACU, DISTRITO DE JOSê CRESPO Y CASTILLO - LEONCIO PRADO - HUµNUCO (SNIP 282952)%u201D;SIN UNIDAD;Clasificaci¢n;Transportes;6/03/2018;Aprobado;SIN DESCRIPCION;-76.12771391;-8.91587517;RD N¯ 00087-2018-SENACE-PE/DEIN;null;
1801;COMPA•IA MINERA ANTAMINA S.A.;20330262428;SEXTO INFORME TêCNICO SUSTENTATORIO DE LA UNIDAD MINERA ANTAMINA;ANTAMINA;ITS;Miner°a;9/02/2021;Aprobado;SIN DESCRIPCION;-77.03114493;-9.56878021;RD N¯ 057-202021-SENACE-PE/DEAR;null;
1803;COMPA•IA MINERA KOLPA S.A.;20600020022;PLAN DE PARTICIPACI‡N CIUDADANA (CON TUPA) - 06786-2017 - PROPUESTA DE MECANISMO DE PARTICIPACION CIUDADANA PREVIO A LA PRESENTACI‡N DE LA MEIA;SIN UNIDAD;PPC;Miner°a;22/12/2020;Aprobado;SIN DESCRIPCION;-74.9824;-13.074;RD N¯ 022-2021-SENACE-PE/DEAR;null;
1939;GOBIERNO REGIONAL DE AREQUIPA;20498390570;MEJORAMIENTO Y CULMINACI‡N DE CONSTRUCCI‡N DE LA CARRETERA PAMPACOCHA %u2013 CUPE, DISTRITO DE TORO, PROVINCIA LA UNI‡N, REGI‡N AREQUIPA;MEJORAMIENTO Y APERTURA;Clasificaci¢n;Transportes;23/11/2021;Aprobado;SIN DESCRIPCION;-72.96906366;-15.27569409;RD N¯ 00092-2022-SENACE-PE/DEIN;null;
1940;MINERA CHINALCO PERÈ S.A.;20506675457;MODIFICACI‡N DEL ESTUDIO DE IMPACTO AMBIENTAL PARA EL PROYECTO DE LA UNIDAD MINERA TOROMOCHO A 170 000 TPD;U.M. TOROMOCHO;MEIA-d;Miner°a;6/03/2020;Aprobado;SIN DESCRIPCION;-76.14117887;-11.60780137;RD N¯ 00083-2021-SENACE-PE/DEAR;null;
1942;AUTORIDAD PARA LA RECONSTRUCCION CON CAMBIOS;20602114091;CREACI‡N DEL SERVICIO DE PROTECCI‡N FRENTE A INUNDACIONES EN LA QUEBRADA CORRALES, DISTRITO DE CORRALES, PROVINCIA DE TUMBES, DEPARTAMENTO DE TUMBES;SIN UNIDAD;IGAPRO;Agricultura;6/07/2022;Aprobado;SIN DESCRIPCION;-80.48007869;-3.61799272;RD N¯ 00144-2022-SENACE-PE/DEIN;null;
1943;MINSUR S.A.;20100136741;PRIMER INFORME TêCNICO SUSTENTATORIO DE LA SEGUNDA MODIFICACI‡N DEL ESTUDIO DE IMPACTO AMBIENTAL DETALLADO DE LA U.M. PUCAMARCA.;PUCAMARCA;ITS;Miner°a;3/05/2019;Aprobado;SIN DESCRIPCION;-69.81586669;-17.76055095;RD N¯ 0113-2019-SENACE-PE/DEAR;null;
1944;CONCESIONARIA INTEROCEANICA SUR TRAMO 2 S.A.;20511125040;INFORME TêCNICO SUSTENTATORIO PARA EL DEP‡SITO DE MATERIAL EXCEDENTE (DME) KM 179+200 LI DEL PROYECTO CORREDOR VIAL INTEROCEµNICO SUR PERÈ - BRASIL, TRAMO N¯ 2: URCOS %u2013 PUENTE INAMBARI;PROYECTO %u201CCORREDOR VIAL INTEROCEµNICO SUR, PERÈ %u2013 BRASIL TRAMO N¯2: URCOS %u2013 INAMBARI%u201D;ITS;Transportes;25/02/2022;Aprobado;SIN DESCRIPCION;-70.82404972;-13.31380948;RD N¯ 00102-2022-SENACE-PE/DEIN;null;
1813;GRAN TIERRA ENERGY PERÈ S.R.L.;20513842377;PROYECTO DE DESARROLLO DEL CAMPO PETROLERO BRETA•A NORTE LOTE 95;LOTE 95;EIA-d;Hidrocarburos;17/10/2018;Aprobado;SIN DESCRIPCION;-74.3282;-5.2437;RD N¯ 00091-2019-SENACE-PE/DEAR;null;
1989;GOBIERNO REGIONAL HUANUCO;20489250731;MEJORAMIENTO Y AMPLIACION DE LOS SERVICIOS DE PROTECCION CONTRA DESBORDES DE AGUA EN EL CENTRO POBLADO DE LLICUA MARGEN DERECHA E IZQUIERDA DE LA QUEBRADA AGORAGRA (LONG. 1395 ML) DISTRITO DE AMARILIS, PROVINCIA Y REGION HUANUCO;MEJORAMIENTO Y AMPLIACION DE LOS SERVICIOS DE PROTECCION CONTRA DESBORDES DE AGUA;Clasificaci¢n;Agricultura;14/04/2021;Aprobado;SIN DESCRIPCION;-76.22277082;-9.93345654;RD N¯ 00154-2021-SENACE-PE/DEIN;null;
1990;AUTORIDAD AUT‡NOMA DE MAJES DEL GOBIERNO REGIONAL DE AREQUIPA;20162554167;CUARTO ITS MODIFICACI‡N DE COMPONENTES AUXILIARES APROBADOS POR EL EIA DE LA REPRESA ANGOSTURA Y GESTI‡N A NIVEL DEFINITIVO;SIN UNIDAD;ITS;Agricultura;18/05/2018;Aprobado;SIN DESCRIPCION;-71.63175549;-15.19108696;RD N¯ 0088-2019-SENACE-PE/DEIN;null;
1718;CNPC PERÈ S.A.;20356476434;MODIFICACI‡N DEL µREA DE LAS PLATAFORMAS DE PERFORACI‡N E INCORPORACI‡N DEL USO DE TUBER÷AS DE HDPE EN LAS L÷NEAS DE CONDUCCI‡N %u2013 LOTE X;LOTE X;ITS;Hidrocarburos;15/06/2017;Aprobado;SIN DESCRIPCION;-81.17085359;-4.28361388;RD N¯ 210-2017-SENACE/DCA;null;
1720;MINERA AURIFERA RETAMAS S.A.;20132367800;MODIFICACI‡N DEL PLAN DE PARTICIPACI‡N CIUDADANA;UEA RETAMAS;MPPC;Miner°a;15/11/2022;Aprobado;SIN DESCRIPCION;-77.43774348;-8.05748115;RD N¯ 00004-2023-SENACE-PE/DEAR;null;
1805;RED DE ENERGIA DEL PERU SA;20504645046;ITS DEL PROYECTO INSTALACI‡N DEL TRANSFORMADOR DE 30 MVA 138/22.9/10,5 KV Y CELDAS EN 22.9 KV Y 10.5 KV EN LA SUBESTACI‡N TINGO MAR÷A;INFORME TêCNICO SUSTENTATORIO DEL PROYECTO INSTALACI‡N DEL TRANSFORMADOR DE 30 MVA 138/22.9/10,5 KV Y CELDAS EN 22.9 KV Y 10.5 KV EN LA SUBESTACI‡N TINGO MAR÷A;ITS;Electricidad;10/05/2019;Aprobado;SIN DESCRIPCION;-75.99279245;-9.28966138;RD N¯ 00110-2019-SENACE-PE/DEIN;null;
1807;MUNICIPALIDAD DISTRITAL DE PAUCARTAMBO;20191043546;CREACION DE TROCHA CARROZABLE ANEXO LIRIOPAMPA %u2013 PARACSHA DEL CENTRO POBLADO DE CHUPACA, DISTRITO DE PAUCARTAMBO, PASCO %u2013 PASCO;CREACION DE TROCHA CARROZABLE ANEXO LIRIOPAMPA %u2013 PARACSHA DEL CENTRO POBLADO DE CHUPACA, DISTRITO DE PAUCARTAMBO, PASCO %u2013 PASCO;Clasificaci¢n;Transportes;3/06/2019;Aprobado;SIN DESCRIPCION;-75.8875789;-10.70727699;RD N¯ 00153-2019-SENACE-PE/DEIN;null;
1808;SOUTHERN PERU COPPER CORPORATION, SUCURSAL DEL PERÈ;20100147514;QUINTO INFORME TêCNICO SUSTENTATORIO;EXPLOTACI‡N, BENEFICIO Y LABOR GENERAL MINERO METµLICOS;ITS;Miner°a;27/12/2022;Aprobado;SIN DESCRIPCION;-70.70980438;-17.04308217;RD N¯ 00069-2023-SENACE-PE/DEAR;null;
1809;PETROLEOS DEL PERU PETROPERU SA;20100128218;AMPLIACI‡N DE LA CAPACIDAD DEL SISTEMA DE TRATAMIENTO DE TURBO Y DE LA CAPACIDAD DE ALMACENAMIENTO DE CRUDO Y NAFTAS DEL PROYECTO MODERNIZACI‡N REFINER÷A TALARA;REFINER÷A TALARA;ITS;Hidrocarburos;13/11/2020;Aprobado;SIN DESCRIPCION;-81.28099823;-4.579;RD N¯ 00044-2021-SENACE-PE/DEAR;null;
1852;PROYECTO ESPECIAL DE INFRAESTRUCTURA DE TRANSPORTE NACIONAL - PROVIAS NACIONAL;20503503639;INFORME TêCNICO SUSTENTATORIO PARA INCORPORAR 01 NUEVO DEP‡SITO DE MATERIAL EXCEDENTE (DME) UBICADO EN EL µREA DE INFLUENCIA INDIRECTA DEL PROYECTO: DME 57 KM 35+830B LD;MEJORAMIENTO DE LA CARRETERA HUµNUCO %u2013 CONOCOCHA, SECTOR: HUµNUCO %u2013 LA UNI‡N %u2013 HUALLANCA, RUTA PE-3N;ITS;Transportes;15/12/2020;Aprobado;SIN DESCRIPCION;-76.47641208;-9.8679757;RD N¯ 00039-2021-SENACE-PE/DEIN;null;
1856;SOUTHERN PERU COPPER CORPORATION, SUCURSAL DEL PERÈ;20100147514;LOS CHANCAS;LOS CHANCAS;Clasificaci¢n;Miner°a;10/01/2022;Aprobado;SIN DESCRIPCION;-73.11193964;-14.15743265;RD N¯ 00111-2022-SENACE-PE/DEAR;null;
1992;CNPC PERU S.A.;20356476434;PROYECTO DE MODIFICACI‡N DE LA UBICACI‡N, TAMA•O DE LA PLATAFORMA, PROFUNDIDAD, V÷AS DE ACCESO Y L÷NEAS DE CONDUCCI‡N DE 59 POZOS DE DESARROLLO EN EL LOTE X;LOTE X;ITS;Hidrocarburos;30/10/2019;Aprobado;SIN DESCRIPCION;-81.14532234;-4.27808254;RD N¯ 00035-2020-SENACE-PE/DEAR;null;
1993;FENIX POWER PERU S.A.;20509514641;INFORME TêCNICO SUSTENTATORIO PARA LA OPTIMIZACI‡N DEL USO DE AGUA DEL SISTEMA DE ENFRIAMIENTO Y MODIFICACI‡N DE COMPONENTES AUXILIARES DE LA CENTRAL TERMOELêCTRICA FENIX POWER - LAS SALINAS, CHILCA;FENIX;ITS;Electricidad;1/12/2020;Aprobado;SIN DESCRIPCION;-76.73636358;-12.54372625;RD N¯ 054-2021-SENACE-PE/DEAR;null;
1994;CONCESIONARIA IIRSA NORTE S.A.;20511004251;ITS PARA LOS DEP‡SITOS DE MATERIAL EXCEDENTE KM 357+800 LI, KM 357+920 LI Y KM 362+100 LI DEL PROYECTO CORREDOR VIAL AMAZONAS NORTE, TRAMO 3: CORRAL QUEMADO - RIOJA;DEP‡SITOS DE MATERIAL EXCEDENTE KM 357+800 LI, KM 357+920 LI Y KM 362+100 LI DEL PROYECTO CORREDOR VIAL AMAZONAS NORTE, TRAMO 3: CORRAL QUEMADO - RIOJA;ITS;Transportes;8/05/2020;Aprobado;SIN DESCRIPCION;-77.84966467;-5.70652126;RD N¯ 00102-2020-SENACE-PE/DEIN;null;
1995;PETROLEOS DEL PERU PETROPERU S.A.;20100128218;ITS MODIFICACI‡N Y REUBICACI‡N DE LA PLANTA DE PRODUCCI‡N Y PURIFICACI‡N DE HIDR‡GENO DEL PROYECTO MODERNIZACI‡N REFINER÷A TALARA;REFINERIA TALARA;ITS;Hidrocarburos;14/06/2019;Aprobado;SIN DESCRIPCION;-81.28112485;-4.58133407;RD N¯ 0129-2019-SENACE-PE/DEAR;null;
1722;PROYECTO ESPECIAL DE INFRAESTRUCTURA DE TRANSPORTE NACIONAL - PROVIAS NACIONAL;20503503639;PLAN DE PARTICIPACI‡N CIUDADANA Y TêRMINOS DE REFERENCIA DEL EIA-D (EIA-D) DEL PROYECTO %u201CMEJORAMIENTO A NIVEL DE AUTOPISTA Y/O PAR VIAL, MATARANI - EMP. PE-1S%u201D,;PROYECTO %u201CMEJORAMIENTO A NIVEL DE AUTOPISTA Y/O PAR VIAL, MATARANI - EMP. PE-1S%u201D,;Clasificaci¢n;Transportes;3/10/2019;Aprobado;SIN DESCRIPCION;-71.87181486;-16.62430383;RD N¯ 00018-2020-SENACE-PE/DEIN;null;
1723;CONCESIOARIA  INREROCEµNICA SUR - TRAMO 2 S.A.;20511125040;ITS DE LOS OBRA ACCESORIA DE ESTABILIZACI‡N Y RECUPERACI‡N DEL SECTOR INESTABLE KM 240+995 - KM 241+145 DEL PROYECTO CORREDOR VIAL INTEROCEµNICO SUR PERÈ-BRASIL, TRAMO N¯2 URCOS - INAMBARI;SIN UNIDAD;ITS;Transportes;21/12/2017;Aprobado;SIN DESCRIPCION;-70.99881358;-13.5834599;RD N¯ 018-2018-SENACE-JEF/DEIN;null;
1725;COMPA•IA MINERA CHUNGAR S.A.C.;20514608041;PLAN DE PARTICIPACI‡N CIUDADANA (CON TUPA) - M-CLS-NT-00018-2019 - PLAN DE PARTICIPACI‡N CIUDADANA PREVIO A LA PRESENTACI‡N DEL EIA-D DEL PROYECTO ROMINA;ROMINA;PPC;Miner°a;30/11/2021;Aprobado;SIN DESCRIPCION;-76.5163;-11.1591;RD N¯ 00017-2022-SENACE-PE/DEAR;null;
1726;TRANSMISORA ELECTRICA DEL SUR 4 S.A.C. - TESUR 4;20602801072;INFORME TêCNICO SUSTENTATORIO DEL EIA-D DEL PROYECTO L÷NEA DE TRANSMISI‡N TINTAYA NUEVA%u2013 PUMIRI EN 220 KV Y AMPLIACI‡N DE SUBESTACIONES ASOCIADAS;LINEA DE TRANSMISI‡N;ITS;Electricidad;2/06/2021;Aprobado;SIN DESCRIPCION;-70.76849846;-14.9265967;RD N¯ 00194-2021-SENACE-PE/DEIN;null;
1727;MINSUR S. A.;20100136741;QUINTO INFORME TêCNICO SUSTENTATORIO (ITS) DE LA PLANTA DE FUNDICI‡N Y REFINER÷A DE ESTA•O DE MINSUR S.A.;PLANTA FUNDICI‡N Y REFINER÷A DE ESTA•O;ITS;Miner°a;26/05/2021;Aprobado;SIN DESCRIPCION;-76.17360434;-13.77974606;RD N¯ 00097-2021-SENACE-PE/DEAR;null;
1811;MINSUR S.A.;20100136741;ITS INVESTIGACIONES GEOL‡GICAS Y GEOTêCNICAS PARA DEFINIR LA ESTRATIGRAF÷A DE LA ZONA SAN GERMAN E IMPLEMENTACI‡N DE UN ACCESO EN LA UNIDAD MINERA NUEVA ACUMULACI‡N QUENAMARI-SAN RAFAEL;U.M. SAN RAFAEL;ITS;Miner°a;27/02/2017;Aprobado;SIN DESCRIPCION;-70.32541821;-14.22957477;RD N¯ 101-2017-SENACE-DCA;null;
1812;CONCESIONARIA L÷NEA DE TRANSMISI‡N CCNCM S.A.C.;20551938868;MODIFICACI‡N DEL TRAZO DE LA L÷NEA DE TRANSMISI‡N CARHUAQUERO-CAJAMARCA NORTE-CµCLIC-MOYOBAMBA EN 220 KV/ SUB TRAMO SE MOYOBAMBA NUEVA-MOYOBAMBA EXISTENTE LT 138 KV;L.T. CARHUAQUERO-CAJAMARCA-CACLIC-MOYOBAMBA;ITS;Electricidad;23/04/2017;Aprobado;SIN DESCRIPCION;-76.97260448;-6.06786698;RD N¯ 125-2017-SEANCE/DCA;null;
1858;COMPA•IA MINERA CARAVELI S.A.C.;20126702737;SEGUNDO ITS PARA EL RECRECIMIENTO DEL DEPOSITO DE RELAVES CHACCHUILLE II, PRECISION DE COORDENADAS DE POZOS SEPTICOS Y PRECISION DE DATOS RESPECTO A LA GEOREFERENCIACION DE LAS ESTACIONES DE MONITOREO;U.M. CHACCHUILLE;ITS;Miner°a;14/10/2016;Aprobado;SIN DESCRIPCION;-74.0468;-15.642;RD N¯ 116-2016-SENACE/DCA;null;
1859;CONCESIONARIA VIAL DEL SOL S.A.;20522547957;CREACI‡N DE CARRETERAS (RED VIAL NACIONAL) SIN TRAZO EXISTENTE;TRAMO: TRUJILLO - CHICLAYO;ITS;Transportes;20/07/2022;Aprobado;SIN DESCRIPCION;-79.54426757;-7.38660939;RD N¯ 00182-2022-SENACE-PE/DEIN;null;
1860;CONCESIONARIA IIRSA NORTE S.A.;20511004251;INFORME TêCNICO SUSTENTATORIO PARA EL ACOPIO KM 357+400 LI DEL PROYECTO CORREDOR VIAL AMAZONAS  NORTE, TRAMO N¯3: CORRAL QUEMADO %u2013 RIOJA;TRAMO III;ITS;Transportes;26/07/2021;Aprobado;SIN DESCRIPCION;-77.54706127;-5.73389239;RD N¯ 00157-2021-SENACE-PE/DEIN;null;
1862;COMPA•÷A DE MINAS BUENAVENTURA S.A.A.;20100079501;TERCER INFORME TêCNICO SUSTENTATORIO DE LA UNIDAD MINERA UCHUCCHACUA;UCHUCCHACUA;ITS;Miner°a;1/12/2020;Aprobado;SIN DESCRIPCION;-76.69256759;-10.62937221;RD N¯ 00032-2021-SENACE-PE/DEAR;null;
1998;MINERA LAS BAMBAS S.A.;20538428524;TERCER INFORME TêCNICO SUSTENTATORIO DE LA TERCERA MODIFICACI‡N DEL ESTUDIO DE IMPACTO AMBIENTAL DE LA UNIDAD MINERA LAS BAMBAS;LAS BAMBAS;ITS;Miner°a;17/10/2021;Aprobado;SIN DESCRIPCION;-72.32332129;-14.07711761;RD N¯ 00033-2022-SENACE-PE/DEAR;null;
1999;UNNA ENERG÷A S.A.;20100153832;AMPLIACI‡N DE LA ESTACI‡N DE COMPRESI‡N EC-8014 - INSTALACI‡N DE SISTEMA DE SECADO DE GAS NATURAL DEL LOTE III, UBICADO EN EL DISTRITO DE VICHAYAL, EN LA PROVINCIA DE PAITA DEL DEPARTAMENTO DE PIURA;LOTE III;ITS;Hidrocarburos;21/10/2022;Aprobado;SIN DESCRIPCION;-81.14143895;-4.8816558;RD N¯ 00053-2023-SENACE-PE/DEAR;null;
2000;CNCP PERÈ S.A.;20356476434;ITS ESTIMULACI‡N POR INYECCI‡N C÷CLICA DE GAS EN 81 POZOS DEL LOTE X;LOTE X;ITS;Hidrocarburos;31/12/2020;Aprobado;SIN DESCRIPCION;-81.18150849;-4.25828048;RD N¯ 00105-2021-SENACE-PE/DEAR;null;
2001;INLAND ENERGY S.A.C.;20600676084;CENTRAL HIDROELêCTRICA GARIBALDI 202 MW;C.H. GARIBALDI;Clasificaci¢n;Electricidad;18/09/2017;Aprobado;SIN DESCRIPCION;-75.3443276;-11.10113708;RD N¯ 018-2017-SENACE-JEF/DEAR;null;
1729;NEXA RESOURCES PERU S.A.A.;20100110513;CUARTO INFORME TêCNICO SUSTENTATORIO PARA LA UNIDAD MINERA CERRO LINDO;UM CERRO LINDO;ITS;Miner°a;4/07/2022;Aprobado;SIN DESCRIPCION;-76.10811534;-13.20477989;RD N¯ 00117-2022-SENACE-PE/DEAR;null;
1730;COMPA•÷A MINERA RAURA S.A.;20100163552;SEXTO INFORME TêCNICO SUSTENTATORIO DE LA UNIDAD MINERA RAURA;U.M. RAURA;ITS;Miner°a;23/04/2018;Aprobado;SIN DESCRIPCION;-76.7469;-10.4578;RD N¯ 073-2018-SENACE-JEF/DEAR;null;
1732;COMPA•IA DE MINAS BUENAVENTURA S.A.A.;20100079501;TERCER ITS DE COMPONENTES AUXILIARES DE LA MEIA DE DEP‡SITO DE RELAVES 4A Y 5 E INCREMENTO DE LA CAPACIDAD DE LA PLANTA A 4,000 TMSD DE LA U.M. ORCOPAMPA;U.M. ORCOPAMPA;ITS;Miner°a;16/08/2019;Aprobado;SIN DESCRIPCION;-72.34836713;-15.27492198;RD N¯ 0174-2019-SENACE-PE/DEAR;null;
1733;ACQUA ENERG÷A S.A.C.;20550343461;L÷NEA DE TRANSMISI‡N EN 50 KV DE SE MARCA-SE CASCA-SE ALCAPARROSA II;L.T. MARCA-CASCA-ALCAPARROSA;Clasificaci¢n;Electricidad;6/05/2016;Aprobado;SIN DESCRIPCION;-75.9934;-11.4328;RD N¯ 051-2016-SENACE/DCA;null;
1734;FêNIX POWER PERÈ S.A.;20509514641;INFORME TêCNICO SUSTENTATORIO DE MEJORAS EN LA CENTRAL TERMOELêCTRICA FêNIX POWER;C.T. FENIX;ITS;Electricidad;28/02/2017;Aprobado;SIN DESCRIPCION;-76.73533058;-12.54376339;RD N¯ 076-2017-SENACE/DCA;null;
1818;CONCESIONARIA IIRSA NORTE S.A.;20511004251;INFORME TêCNICO SUSTENTATORIO PARA LA AMPLIACI‡N DEL DEP‡SITO DE MATERIAL EXCEDENTE KM 512+720 LI, DEL PROYECTO CORREDOR VIAL AMAZONAS NORTE, TRAMO N¯2: RIOJA %u2013 TARAPOTO;TRAMO II;ITS;Transportes;1/09/2021;Aprobado;SIN DESCRIPCION;-76.84053853;-6.12443165;RD N¯ 00186-2021-SENACE-PE/DEIN;null;
1819;COMPA•÷A MINERA MISKI MAYO S.R.L.;20506285314;MODIFICACIONES AL PROCESO Y COMPONENTES DE LA UM BAYOVAR;U.M. BAYOVAR;ITS;Miner°a;8/08/2017;Aprobado;SIN DESCRIPCION;-80.81926158;-6.06144346;RD N¯ 258-2017-SENACE/DCA;null;
1820;GOBIERNO REGIONAL DE PASCO;20489252270;SOLICITUD DE CLASIFICACION DE ESTUDIOS AMBIENTALES DEL PROYECTO MEJORAMIENTO DE LA CARRETERA DEPARTAMENTAL EMP.PE-18 DV UCHUMARCA - GOLAC MOJADA - POCCO - UCHUMARCA - GORINA ALTA - HUANGUR - YURAC HUANCA - QUIULACOCHA CERRO DE PASCO EMP. PE-3N PROVINCIA D;SIN UNIDAD;Clasificaci¢n;Transportes;12/04/2018;Aprobado;SIN DESCRIPCION;-76.25199614;-10.72564899;RD N¯ 00072-2018-SENACE-PE/DEIN;null;
1821;GOBIERNO REGIONAL DE TACNA;20519752515;EMBALSE CALIENTES SANTA CRUZ - CANDARAVE;REPRESA CALIENTES;PPC;Agricultura;28/09/2021;Aprobado;SIN DESCRIPCION;-70.0983;-17.062;RD N¯ 00014-2022-SENACE-PE/DEIN;null;
1863;OLYMPIC PERÈ INC SUCURSAL DEL PERÈ;20305875539;ITS PROYECTO DE MODIFICACI‡N DE LA UBICACI‡N, LINEAS DE FLUJO Y VIAS DE ACCESO DE 10 POZOS DE PRODUCCI‡N Y LA CONVERSI‡N DE POZO PRODUCTOR A POZO INYECTOR DE 26 POZOS Y ADECUACI‡N O REEMPLAZO DE SUS LINEAS DE INYECCI‡N EN EL LOTE XIII-A;LOTE XIII-A;ITS;Hidrocarburos;16/08/2022;Aprobado;SIN DESCRIPCION;-81.12919777;-4.9139332;RD N¯ 00060-2023-SENACE-PE/DEAR;null;
1864;SERVICIOS MEDIOAMBIENTALES SOCIEDAD ANONIMA SERVICIOS MEDIOAMBIENTALES S.A.;20565964292;EIA-SD PARA INFRAESTRUCTURAS DE RESIDUOS SOLIDOS NO MUNICIPALES DEL PROYECTO: TRATAMIENTO Y AISLAMIENTO DEFINITIVO DE REMANENTES INDUSTRIALES - RELLENO DE SEGURIDAD DE ICA, EN VERSION DIGITAL (REF. A*;INFRAESTRUCTURAS DE RESIDUOS SOLIDOS NO MUNICIPALES DEL PROYECTO: TRATAMIENTO Y AISLAMIENTO DEFINITIVO DE REMANENTES INDUSTRIALES - RELLENO DE SEGURIDAD DE ICA, EN VERSION DIGITAL (REF. ANTES RS-CLS-0060-2019);EIA-sd;Residuos S¢lidos;3/04/2019;Aprobado;SIN DESCRIPCION;-76.02620635;-13.94584223;RD N¯ 071-2020-SENACE-PE/DEI;null;
1865;MUNICIPALIDAD PROVINCIAL DE CASTILLA;20208253086;CONSTRUCCI‡N DE LA CARRETERA AYO ANDAMAYO (PROG KM 0+000 A PROG KM 46+524) DISTRITOS DE APLAO Y AYO, PROVINCIA DE CASTILLA-AREQUIPA;CONSTRUCCI‡N DE LA CARRETERA AYO ANDAMAYO (PROG KM 0+000 A PROG KM 46+524) DISTRITOS DE APLAO Y AYO, PROVINCIA DE CASTILLA-AREQUIPA;Clasificaci¢n;Transportes;8/06/2020;Aprobado;SIN DESCRIPCION;-72.44798171;-15.8464252;RD N¯ 00115-2020-SENACE-PE/DEIN;null;
1866;LA VIRGEN SOCIEDAD ANONIMA CERRADA;20492925030;ITS DE LA MEJORA TECNOL‡GICA DEL SISTEMA DE CAPTACI‡N DEL PROYECTO C.H. LA VIRGEN-03 BARRERAS DISIPADORAS;C.H. LA VIRGEN;ITS;Electricidad;7/08/2019;Aprobado;SIN DESCRIPCION;-75.46484505;-11.18528009;RD N¯ 197-2019-SENACE-PE/DEAR;null;
2003;EMPRESA ADMINISTRADORA CERRO S.A.C.;20538848060;ITS PARA LA OPTIMIZACI‡N DE LA PLANTA PARAGSHA PARA EL PROCESAMIENTO DE STOCK PILES;U.M. CERRO DE PASCO;ITS;Miner°a;1/08/2017;Aprobado;SIN DESCRIPCION;-76.27556573;-10.67901185;RD N¯ 249-2017-SENACE/DCA;null;
2004;LA ARENA S.A.;20205467603;III MODIFICACI‡N DEL EIA DEL PROYECTO LA ARENA;U.M. LA ARENA;MEIA-d;Miner°a;15/02/2017;Aprobado;SIN DESCRIPCION;-78.13050296;-7.89209965;RD N¯ 255-2017-SENACE/DCA;null;
2009;HUDBAY PERU S.A.C.;20511165181;PRIMER INFORME TêCNICO SUSTENTATORIO DE LA TERCERA MODIFICACI‡N DEL ESTUDIO DE IMPACTO AMBIENTAL DETALLADO DE LA UNIDAD MINERA CONSTANCIA;CONSTANCIA;ITS;Miner°a;2/06/2022;Aprobado;SIN DESCRIPCION;-71.78682462;-14.47934118;RD N¯ 0126-2022-SENACE-PE/DEAR;null;
1735;INLAND ENERGY S.A.C.;20600676084;CENTRALES HIDROELêCTRICAS MAJES I Y II;C.H. MAJES I & II;Clasificaci¢n;Electricidad;25/09/2017;Aprobado;SIN DESCRIPCION;-72.029423;-16.01873088;RD N¯ 022-2017-SENACE-JEF/DEAR;null;
1736;TERNA PERÈ S.A.C.;20602232256;PPC DEL PROYECTO %u201CINGENIER÷A DETALLADA, ESTUDIOS AMBIENTALES Y ESTUDIOS DE PREOPERATIVIDAD DE LA L÷NEA DE TRANSMISI‡N 138 KV Y AMPLIACI‡N DE LAS SUBESTACIONES AGUAYT÷A Y PUCALLPA 138 KV%u201D;SIN UNIDAD;PPC;Electricidad;19/01/2018;Aprobado;SIN DESCRIPCION;-75.0509443;-75.0509443;RD N¯ 038-2018-SENACE-JEF/DEIN;null;
1737;CNPC PERU S.A.;20356476434;MODIFICACI‡N DE LA UBICACI‡N, TAMA•O DE LAS PLATAFORMAS, PROFUNDIDAD, L÷NEAS DE CONDUCCI‡N Y V÷AS DE ACCESO DE 118 POZOS EN EL LOTE X;LOTE X;ITS;Hidrocarburos;10/09/2018;Aprobado;SIN DESCRIPCION;-81.13390524;-4.28196569;RD N¯ 0039-2018-SENACE-PE/DEAR;null;
1739;TRANSPORTADORA DE GAS DEL PERÈ S.A.;20499432021;INFORME TêCNICO SUSTENTATORIO DEL %u201CDEP‡SITO DE MATERIAL EXCEDENTE A LA ALTURA DEL KP 244 DEL SISTEMA DE TRANSPORTE POR DUCTOS - SIERRA%u201D;KP244;ITS;Hidrocarburos;17/05/2021;Aprobado;SIN DESCRIPCION;-74.31411741;-13.26904235;RD N¯ 00142-2021-SENACE-PE/DEAR;null;
1740;CONCESIONARIA IIRSA NORTE S.A.;20511004251;INFORME TêCNICO SUSTENTATORIO PARA LAS OBRAS ACCESORIAS DE LOS SECTORES KM 517+390 - KM 517+430, KM 518+250 - KM 518+300 Y KM 537+770 - KM 537+800, DEL PROYECTO CORREDOR VIAL AMAZONAS NORTE, TRAMO N¯ 2 TARAPOTO - RIOJA;TRAMO II;ITS;Transportes;17/05/2021;Aprobado;SIN DESCRIPCION;-76.77106296;-6.27298957;RD N¯ 00104-2021-SENACE-PE/DEIN;null;
1823;QUMIR S.A.C.;20559625966;PLANTA DE TRATAMIENTO DE RESIDUOS S‡LIDOS DE ESTABLECIMIENTOS DE SALUD Y SERVICIOS MêDICOS DE APOYO EN TRUJILLO;SIN UNIDAD;Clasificaci¢n;Residuos S¢lidos;10/04/2018;Aprobado;SIN DESCRIPCION;-79.08448388;-8.06032814;RD N¯ 123-2019-SENACE-PE/DEIN;null;
1826;MINERA SHOUXIN PERU S.A.;20392776975;MODIFICACION EXPLOTACION DE RELAVES;U.M. MARCONA;Clasificaci¢n;Miner°a;28/09/2017;Aprobado;SIN DESCRIPCION;-75.20848653;-15.27404788;RD N¯ 027-2017-SENACE-JEF/DEAR;null;
1828;MUNICIPALIDAD DISTRITAL DE TICLACAYAN;20168299436;CREACION DE TROCHA CARROZABLE MACAY %u2013 CHUPANA, DE DISTRITO DE TICLACAYAN %u2013 PASCO - PASCO;CREACION DE TROCHA CARROZABLE MACAY %u2013 CHUPANA, DE DISTRITO DE TICLACAYAN %u2013 PASCO - PASCO;Clasificaci¢n;Transportes;11/06/2019;Aprobado;SIN DESCRIPCION;-76.09179021;-10.65750133;RD N¯ 00005-2020-SENACE-PE/DEIN;null;
1829;COMPA•IA MINERA MISKI MAYO S.R.L.;20506285314;TERCER INFORME TêCNICO SUSTENTATORIO DE LA SEGUNDA MODIFICACI‡N DEL ESTUDIO DE IMPACTO AMBIENTAL DETALLADO DE LA MINA DE FOSFATOS BAY‡VAR;MINA DE FOSFATOS BAY‡VAR;ITS;Miner°a;1/10/2021;Aprobado;SIN DESCRIPCION;-80.85435919;-6.00099636;RD N¯ 00147-2021-SENACE-PE/DEAR;null;
1871;EDEGEL S.A.A.;20330791412;MODIFICACI‡N DEL EIA DEL PROYECTO CONVERSI‡N A GAS NATURAL Y TRANSFORMACI‡N A CICLO COMBINADO DE LA CENTRAL TêRMICA DE VENTANILLA POR CAMBIO DE PUNTO DE VERTIMIENTO DEL R÷O CHILL‡N AL MAR;CENTRAL TêRMICA VENTANILLA;MEIA-d;Electricidad;31/12/2017;Aprobado;SIN DESCRIPCION;-77.11759633;-11.93624031;RD N¯ 131-2018-SENACE-JEF/DEAR;null;
2010;CONSORCIO TRANSMANTARO S.A.;20383316473;EIA-D PARA EL PROYECTO %u201CENLACE 500 KV NUEVA YANANGO - NUEVA HUµNUCO Y SUBESTACIONES ASOCIADAS;ENLACE 500 KV NUEVA YANANGO - NUEVA HUµNUCO Y SUBESTACIONES ASOCIADAS;EIA-d;Electricidad;28/10/2019;Aprobado;SIN DESCRIPCION;-75.34112128;-11.15499649;RD N¯ 00085-2020-SENACE-PE/DEIN;null;
2013;RED DE ENERG÷A DEL PERÈ S.A.;20504645046;MODIFICACI‡N DE LA SUBESTACI‡N FRIASPATA;S.E. FRIASPATA;Clasificaci¢n;Electricidad;9/05/2016;Aprobado;SIN DESCRIPCION;-74.9527;-12.7846;RD N¯ 045-2016-SENACE/DCA;null;
2014;AGRICOLA CAMPONOBLE SOCIEDAD ANONIMA CERRADA;20600720679;EVALUACI‡N AMBIENTAL PRELIMINAR (EVAP) PARA EL FUNDO DEL LOTE B6C %u2013 AGRICOLA CAMPO NOBLE S.A.C.;FUNDO DEL LOTE B6C;Clasificaci¢n;Agricultura;7/02/2022;Aprobado;SIN DESCRIPCION;-79.92864266;-6.08192377;RD N¯ 00095-2022-SENACE-PE/DEAR;null;
2016;COMPA•÷A MINERA CONDESTABLE S.A.;20100056802;INCORPORACI‡N Y/O AMPLIACI‡N DE COMPONENTES E INTEGRACI‡N DE LAS UNIDADES;U.M. CONDESTABLE;ITS;Miner°a;7/12/2017;Aprobado;SIN DESCRIPCION;-76.59507001;-12.69745209;RD N¯ 016-2018-SENACE-JEF/DEAR;null;
1741;GOBIERNO REGIONAL HUANCAVELICA;20486020882;"EVAP DEL PROYECTO: MEJORAMIENTO DE SERVICIO DE AGUA DEL SISTEMA DE RIEGO HATUNCCACCA%u2013 LEOPALLANAPAMPA DE LOS CENTROS POBLADOS DE PUEBLO NUEVO, CHALHUAPUQUIO, ANTACCACCA, PIRCAPAHUANA Y RUMICHACA, DISTRITO DE LIRCAY PROV DE ANGARAES, DEP DE HUANCAVELIC""";SIN UNIDAD;Clasificaci¢n;Agricultura;1/02/2018;Aprobado;SIN DESCRIPCION;-74.76348386;-13.05541893;RD N¯ 093-2018-SENACE-JEF/DEIN;null;
1742;COMPA•÷A MINERA ARGENTUM S.A.;20507845500;IMPLEMENTACI‡N DE UN µREA PARA LA PREPARACI‡N DE CONCRETO;U.M. MOROCOCHA;ITS;Miner°a;27/04/2018;Aprobado;SIN DESCRIPCION;-76.1269;-11.5929;RD N¯ 074-2018-SENACE-JEF/DEAR;null;
1744;PETR‡LEOS DEL PERÈ PETROPERÈ S.A.;20100128218;INSTRUMENTACI‡N DE TRES ISLAS DE DESPACHO EN PLANTA DE VENTAS CONCHµN;REFINERIA CONCHAN;ITS;Hidrocarburos;15/11/2016;Aprobado;SIN DESCRIPCION;-76.9258;-12.2527;RD N¯ 128-2016-SENACE/DCA;null;
1830;CONCESIONARIA INTEROCEANICA SUR - TRAMO 3 S.A.;20511129975;INFORME TêCNICO SUSTENTATORIO PARA EL MANTENIMIENTO DE PAVIMENTOS DEL SECTOR UNI‡N PROGRESO KM 351+392 %u2013 PUERTO MALDONADO KM 426+281 DEL CORREDOR VIAL INTEROCEµNICO SUR PERÈ-BRASIL, TRAMO N¯ 3 PUENTE INAMBARI %u2013 I•APARI;CORREDOR VIAL INTEROCEµNICO SUR PERÈ %u2013 BRASIL TRAMO N¯ 3;ITS;Transportes;30/09/2021;Aprobado;SIN DESCRIPCION;-69.42232672;-12.69728388;RD N¯ 00002-2022-SENACE-PE/DEIN;null;
1831;CONCESIONARIA VIAL DEL SOL S.A.;20522547957;INFORME TêCNICO SUSTENTARLO %u2013 INCORPORACI‡N DE µREAS AUXILIARES, TRAMO: TRUJILLO %u2013 CHICLAYO CANTERA CERRO CHILCO IV, DME SAGASTEGUI Y DME NUEVO CEMENTERIO PAIJµN;INCORPORACI‡N DE µREAS AUXILIARES, TRAMO: TRUJILLO %u2013 CHICLAYO CANTERA CERRO CHILCO IV, DME SAGASTEGUI Y DME NUEVO CEMENTERIO PAIJµN;ITS;Transportes;16/01/2020;Aprobado;SIN DESCRIPCION;-79.45282809;-7.47037554;RD N¯ 051-2020-SENACE-PE/DEI;null;
1873;CONCESIONARIA INTEROCEµNICA SUR - TRAMO 2 S.A.;20511125040;"ITS DEL DEP‡SITO DE MATERIAL EXCEDENTE KM. 242+100 LD DEL PROYECTO CORREDOR VIAL INTEROCEµNICO SUR, PERÈ-BRASIL, TRAMO 2: URCOS - PUENTE INAMBARI""""";SIN UNIDAD;ITS;Transportes;28/08/2017;Aprobado;SIN DESCRIPCION;-70.41201812;-13.19189876;RD N¯ 323-2017-SENACE/DCA;null;
1875;MUNICIPALIDAD PROVINCIAL DE VIRÈ;20166028842;CREACI‡N DEL PUENTE DE ACCESO VIAL EN EL SECTOR LA GLORIA PROVINCIA DE VIRÈ DEPARTAMENTO LA LIBERTAD;CREACI‡N DE PUENTE;Clasificaci¢n;Transportes;17/03/2021;Aprobado;SIN DESCRIPCION;-78.73662182;-8.39806279;RD N¯ 00110-2021-SENACE-PE/DEIN;null;
2017;FOSFATOS DEL PACIFICO S.A.;20523108574;EVALUACI‡N PRELIMINAR (EVAP) DEL PROYECTO %u201CNUEVA µREA DE EXPLOTACI‡N DE DIATOMITAS DENTRO DE LA CONCESI‡N BAY‡VAR N¯ 9%u201D;BAYOVAR 9;Clasificaci¢n;Miner°a;26/05/2022;Aprobado;SIN DESCRIPCION;-80.86378464;-5.9960066;RD N¯ 0137-2022-SENACE-PE/DEAR;null;
2018;GLOBAL SIME S.A.C.;20605245154;INFRAESTRUCTURA DE TRATAMIENTO DE RESIDUOS S‡LIDOS PELIGROSOS: TERRA WASI;PLANTA CANTA;Clasificaci¢n;Residuos S¢lidos;2/06/2022;Aprobado;SIN DESCRIPCION;-76.95232604;-11.71956501;RD N¯ 00200-2022-SENACE-PE/DEIN;null;
