ID,TITULAR,RUC,TITULO_PROYECTO,UNIDAD_PROYECTO,TIPO,ACTIVIDAD,FECHA_INICIO,ESTADO,DESCRIPCION,LONGITUD,LATITUD,RESOLUCION,LABEL
1228,BPZ EXPLORACIÓN & PRODUCCIÓN S.R.L.,20503238463,LOTE Z-1,LOTE Z-1,ITS,Hidrocarburos,24/10/2017,Aprobado,SIN DESCRIPCION,-80.58493767,-3.41461515,RD N° 041-2017-SENACE-JEF/DEAR,
1229,GOLD FIELDS LA CIMA S.A.,20507828915,PPC PREVIO A LA PRESENTACIÓN DE LA OCTAVA MEIA DE CERRO CORONA,SIN UNIDAD,PPC,Minería,26/09/2018,Aprobado,SIN DESCRIPCION,-78.63109127,-6.76606242,RD N° 00031-2018-SENACE-PE/DEAR,
1273,MUNICIPALIDAD DISTRITAL DE UCHIZA,20160770032,"CONSTRUCCION DE PUENTE, EN EL(LA) PUENTE HUAYNAVE EN LA LOCALIDAD DE HUAYNAVE, DISTRITO DE UCHIZA, PROVINCIA TOCACHE, DEPARTAMENTO SAN MARTIN",CONSTRUCCIÓN DE PUENTE,Clasificación,Transportes,03/03/2021,Aprobado,SIN DESCRIPCION,-76.27181603,-8.33329743,RD N° 00108-2021-SENACE-PE/DEIN,
1274,MUNICIPALIDAD DISTRITAL DE SANTA ROSA,20215744907,"MEJORAMIENTO Y CREACIÓN DEL CAMINO VECINAL CRUCE CHIVIL - LAGUNA DE OCHENTA, DISTRITO DE ASUNCIÓN - CHACHAPOYAS - AMAZONAS",SIN UNIDAD,Clasificación,Transportes,31/03/2017,Aprobado,SIN DESCRIPCION,-77.75417632,-5.98675731,RDN° 197-2017-SENACE/DCA,
1275,PROYECTO ESPECIAL DE INFRAESTRUCTURA DE TRANSPORTE NACIONAL - PROVIAS NACIONAL,20503503639,"ITS PARA EL ""SERVICIO DE GESTIÓN Y CONSERVACIÓN VIAL POR NIVELES DE SERVICIO DEL CORREDOR VIAL: HUÁNUCO - LA UNIÓN - HUALLANCA - DV. ANTAMINA Y PTE. TINGO MARÍA - LLATA - ANTAMINA, TRAMOS I - VI""",SIN UNIDAD,ITS,Transportes,28/04/2017,Aprobado,SIN DESCRIPCION,-76.59226419,-9.87836628,RD N° 143-2017-SENACE/DCA,
1276,COMPAÑÍA MINERA ARES S.A.C.,20192779333,SEGUNDO INFORME TÉCNICO SUSTENTATORIO DE LA SEGUNDA MEIA - AMPLIACIÓN A 3000 DE LA U.O. PALLANCATA,PALLANCATA,ITS,Minería,09/09/2018,Aprobado,SIN DESCRIPCION,-73.17972761,-14.72682934,RD N° 020-2018-SENACE-PE/DEAR,
1279,EGEJUNIN TUTLUMAYO-IV S.A.C.,20546151167,PRIMER INFORME TÉCNICO SUSTENTATORIO PARA LA INSTALACION DE COMPONENTES AUXILIARES,C.H. TULUMAYO IV,ITS,Electricidad,13/06/2020,Aprobado,SIN DESCRIPCION,-75.10089754,-11.56285786,RD N° 00143-2020-SENACE-PE/DEAR,
1421,MUNICIPALIDAD PROVINCIAL DE AMBO,20146008926,CREACIÓN DE INFRAESTRUCTURA DE DEFENSA RIBEREÑA EN LA ZONA EL ARROYO DEL DISTRITO DE AMBO - PROVINCIA DE AMBO - DEPARTAMENTO DE HUÁNUCO,INFRAESTRUCTURA DE DEFENSA RIBEREÑA,Clasificación,Agricultura,21/03/2022,Aprobado,SIN DESCRIPCION,-76.20325873,-10.12302545,RD N° 156-2022-SENACE-PE/DEIN,
1424,COMPAÑÍA MINERA ARES S.A.C.,20192779333,QUINTO INFORME TÉCNICO SUSTENTATORIO DE LA SEGUNDA MODIFICACIÓN DEL ESTUDIO DE IMPACTO AMBIENTAL DE LA U.O. PALLANCATA,PALLANCATA,ITS,Minería,07/09/2020,Aprobado,SIN DESCRIPCION,-70.39899865,-13.15209764,RD N° 132-2020-SENACE-PE/DEAR,
1143,CONCESIONARIA INTEROCEANICA SUR TRAMO 2 S.A.,20511125040,"INFORME TÉCNICO SUSTENTATORIO PARA LA CANTERA MARKJOPATA KM 54+190 LI, DEL PROYECTO CORREDOR VIAL INTEROCEÁNICO SUR PERÚ-BRASIL, TRAMO N° 2 URCOS – PUENTE INAMBARI","PROYECTO “CORREDOR VIAL INTEROCEÁNICO SUR, PERÚ – BRASIL TRAMO N°2: URCOS – INAMBARI”",ITS,Transportes,11/08/2021,Aprobado,SIN DESCRIPCION,-71.00137096,-13.58334373,RD N° 00185-2021-SENACE-PE/DEIN,
1144,JINZHAO MINING PERÚ S.A.,20520694839,INFORME TÉCINOC SUSTENTATORIO PROYECTO MINERO PAMPA DEL PONGO,PAMPA DEL PONGO,ITS,Minería,30/12/2017,Aprobado,SIN DESCRIPCION,-74.8361,-15.3609,RD N° 020-2018-SENACE-JEF/DEAR,
1145,CONCESIONARIA INTEROCEANICA SUR - TRAMO 3 S.A.,20511129975,"OBRA ACCESORIA DE ESTABILIZACIÓN DEL SECTOR CRÍTICO KM 318+000 – KM 321+000 DEL PROYECTO CORREDOR VIAL INTEROCEÁNICO SUR PERÚ-BRASIL, TRAMO N° 3 PUENTE INAMBARI – IÑAPARI","OBRA ACCESORIA DE ESTABILIZACIÓN DEL SECTOR CRÍTICO KM 318+000 – KM 321+000 DEL PROYECTO CORREDOR VIAL INTEROCEÁNICO SUR PERÚ-BRASIL, TRAMO N° 3 PUENTE INAMBARI – IÑAPARI",ITS,Transportes,19/02/2019,Aprobado,SIN DESCRIPCION,-70.06839137,-12.89360479,RD N° 00096-2019--SENACE-PE/DEIN,
1230,MUNICIPALIDAD DIST.DE CHALLHUAHUACHO,20288774553,"CREACIÓN DE CAMINOS VECINALES DE CHOCCOYO A LOS ANEXOS PAQQARY – UNION LOMAS, CHOCCOYO – CCATCCANTA, CHOCCOYO – ALMASAMACHINAPATA, DE LA COMUNIDAD CAMPESINA DE CHOCCOYO DEL DISTRITO DE CHALLHUAHUACHO - PROVINCIA DE COTABAMBAS - DEPARTAMENTO DE APURIMAC",OFICINA DE ESTUDIOS Y PROYECTOS,Clasificación,Transportes,16/06/2021,Aprobado,SIN DESCRIPCION,-72.3591563,-14.22511115,RD N° 00026-2022-SENACE-PE/DEIN,
1231,CNPC PERÚ S.A.,20356476434,MODIFICACIÓN DE LA UBICACIÓN DEL PROYECTO DE SÍSMICA 2D,SIN UNIDAD,ITS,Hidrocarburos,05/06/2019,Aprobado,SIN DESCRIPCION,-73.08533707,-12.16711456,RD N° 137-2019-SENACE-PE/DEAR,
1232,COMPAÑIA MINERA MISKI MAYO S.R.L.,20506285314,SEGUNDO INFORME TÉCNICO SUSTENTATORIO DE LA SEGUNDA MODIFICACIÓN DEL ESTUDIO DE IMPACTO AMBIENTAL DETALLADO DE LA MINA DE FOSFATOS BAYÓVAR,MINA DE FOSFATOS BAYÓVAR,ITS,Minería,18/09/2020,Aprobado,SIN DESCRIPCION,-80.79762408,-6.02137901,RD N° 137-2020-SENACE-PE/DEAR,
1234,SAVIA PERÚ S.A.,20203058781,PERFORACION EXPLORATORIA Y DESARROLLO LOTE Z-2B - PEÑA NEGRA,LOTE Z-2B,ITS,Hidrocarburos,20/02/2018,Aprobado,SIN DESCRIPCION,-81.26696204,-4.3061036,RD N° 054-2018-SENACE-JEF/DEAR,
1235,CONCESIONARIA IIRSA NORTE S.A.,20511004251,"ITS PARA LAS OBRAS ACCESORIAS EN LOS SECTORES KM 552+970 – KM 553+000 Y KM 501+870 – KM 501+950 DEL PROYECTO CORREDOR VIAL AMAZONAS NORTE, TRAMO 2: TARAPOTO - RIOJA","OBRAS ACCESORIAS EN LOS SECTORES KM 552+970 – KM 553+000 Y KM 501+870 – KM 501+950 DEL PROYECTO CORREDOR VIAL AMAZONAS NORTE, TRAMO 2: TARAPOTO - RIOJA",ITS,Transportes,09/07/2019,Aprobado,SIN DESCRIPCION,-76.84167805,-6.12385326,RD N° 00149-2019-SENACE-PE/DEIN,
1280,COMPAÑIA MINERA ARES S.A.C.,20192779333,PRIMER INFORME TÉCNICO SUSTENTATORIO DEL PROYECTO DE EXPLOTACIÓN CRESPO,U.M. CRESPO,ITS,Minería,31/03/2020,Aprobado,SIN DESCRIPCION,-72.38519095,-14.76404163,RD N° 083-2020-SENACE-PE,
1281,MUNICIPALIDAD DISTRITAL DE  SAN MIGUEL DE CAURI,20176232227,CREACION DEL SERVICIO DE TRANSITABILIDAD EN EL TRAMO: EMP. HU-1161 (TUNANCANCHA) – HUANCAN – PICON (COLPAS) DISTRITO DE SAN MIGUEL DE CAURI - PROVINCIA DE LAURICOCHA DEPARTAMENTO DE HUANUCO,CREACION DEL SERVICIO DE TRANSITABILIDAD EN EL TRAMO: EMP. HU-1161 (TUNANCANCHA) – HUANCAN – PICON (COLPAS) DISTRITO DE SAN MIGUEL DE CAURI - PROVINCIA DE LAURICOCHA DEPARTAMENTO DE HUANUCO,Clasificación,Transportes,07/05/2021,Aprobado,SIN DESCRIPCION,-76.48726519,-10.14966886,RD N° 00142-2021-SENACE-PE/DEIN,
1284,COMPAÑÍA MINERA COIMOLACHE S.A.,20140688640,SEXTO INFORME TÉCNICO SUSTENTATORIO DE LA SEGUNDA MODIFICACIÓN DEL ESTUDIO DE IMPACTO AMBIENTAL,U.M. TANTAHUATAY-CIÉNAGA NORTE,ITS,Minería,24/02/2020,Aprobado,SIN DESCRIPCION,-78.69104144,-6.73433487,RD N° 00080-2020-SENACE-PE/DEAR,
1285,AUTORIDAD PARA LA RECONSTRUCCION CON CAMBIOS,20602114091,"CREACIÓN DEL SERVICIO DE PROTECCIÓN CONTRA INUNDACIONES EN LA QUEBRADA SAN IDELFONSO, EN LOS DISTRITOS DE EL PORVENIR, TRUJILLO Y VICTOR LARCO HERRERA DE LA PROVINCIA DE TRUJILLO - DEPARTAMENTO DE LA LIBERTAD",SIN UNIDAD,IGAPRO,Agricultura,29/05/2022,Aprobado,SIN DESCRIPCION,-78.97361703,-8.02890098,RD N° 00142-2022-SENACE-PE/DEIN,
1425,MUNICIPALIDAD DISTRITAL DE ANCHIHUAY,20574738866,"CREACIÓN CAMINO VECINAL BUENA GANA - MARAYNIYOQ, DISTRITO DE ANCHIHUAY – LA MAR - AYACUCHO","CREACIÓN CAMINO VECINAL BUENA GANA - MARAYNIYOQ, DISTRITO DE ANCHIHUAY – LA MAR - AYACUCHO",Clasificación,Transportes,10/07/2019,Aprobado,SIN DESCRIPCION,-73.60211956,-12.90625629,RD N° 00181-2019-SENACE-PE/DEIN,
1426,MINSUR S.A.,20100136741,INFORME TÉCNICO SUSTENTATORIO MODIFICACIONES EN EL DEPOSITO DE RELAVES B3 Y EN LA PLANTA DE TRATAMIENTO DE AGUA POTABLE,U.M. SAN RAFAEL,ITS,Minería,02/07/2016,Aprobado,SIN DESCRIPCION,-70.3237,-14.2258,RD N° 055-2016-SENACE/DCA,
1428,ENERGÉTICA MONZÓN S.A.C.,20566087457,LÍNEA DE TRANSMISIÓN 138 KV S.E. AYANUNGA - S.E. AMPLIACIÓN 8 DE AGOSTO,L.T. AYANUNGA-AMPLIACION,Clasificación,Electricidad,08/03/2017,Aprobado,SIN DESCRIPCION,-76.4582175,-9.31037971,RD N° 134-2017-SENACE/DCA,
1429,CONCESIONARIA IIRSA NORTE S.A.,20511004251,"OBRA ACCESORIA EN EL SECTOR KM 581+039 – KM 581+409 DEL PROYECTO CORREDOR VIAL AMAZONAS NORTE, TRAMO 2: TARAPOTO – RIOJA.","OBRA ACCESORIA EN EL SECTOR KM 581+039 – KM 581+409 DEL PROYECTO CORREDOR VIAL AMAZONAS NORTE, TRAMO 2: TARAPOTO – RIOJA.",ITS,Transportes,20/02/2019,Aprobado,SIN DESCRIPCION,-76.84167805,-6.12385326,RD N° 00114-2019-SENACE-PE/DEIN,
1054,ANDEAN POWER S.A.C.,20503684242,LÍNEA DE TRANSMISIÓN 60 KV TRAMO V-10 HACIA S.E. CARHUAC,L.T. CARHUAC,Clasificación,Electricidad,25/04/2016,Aprobado,SIN DESCRIPCION,-76.5035,-11.6613,RD N° 049-2016-SENACE/DCA,
1055,UPLAND OIL AND GAS LLC SUCURSAL DEL PERÚ,20516244161,REUBICACIÓN DE PLATAFORMAS D PERFORACIÓN D 02 POZOS EXPLORATORIOS Y 19 POZOS CONFIRMATORIOS DEL EIA DE PERFORACIÓN DE 36 POZOS EN LA FASE DE EXPLORACIÓN(6 EXPLORATORIOS Y 30 CONFIRMATORIOS)-LOTE X,LOTE XXIII,ITS,Hidrocarburos,30/04/2018,Aprobado,SIN DESCRIPCION,-80.631,-3.7036,RD N° 103-2018-SENACE-JEF/DEAR,
1056,AUTOPISTA DEL NORTE S.A.C.,20520929658,"ITS PARA “INCORPORAR EL DEPÓSITO DE MATERIAL EXCEDENTE (DME) LA LÁMPARA KM 377+300 MD Y EL DEPÓSITO DE MATERIAL EXCEDENTE (DME) RÍO CASMA KM 379+500 MI”, DEL PROYECTO MEIA “SEGUNDA CALZADA RED VIAL N° 4 PATIVILCA – DV. SALAVERRY”",SIN UNIDAD,ITS,Transportes,15/12/2017,Aprobado,SIN DESCRIPCION,-78.32465574,-9.46633917,RD N° 057-2018-SENACE-JEF/DEIN,
1057,SHAHUINDO S.A.C.,20505792042,"PROYECTO: ""ACTUALIZACIÓN DEL ESTUDIO DEFINITIVO DE INGENIERÍA PARA EL PUENTE CHUQUIBAMBA Y ACCESOS""",SIN UNIDAD,Clasificación,Transportes,16/06/2017,Aprobado,SIN DESCRIPCION,-78.14029134,-7.60848716,RD N° 320-2017-SENACE/DCA,
759,"SAPET DEVELOPMENT PERÚ INC., SUCURSAL DEL PERÚ",20168702346,MODIFICACIÓN DE UBICACIÓN DE DIECIOCHO (18) POZOS DE DESARROLLO EN EL LOTE VII/VI,LOTE VII/VI,ITS,Hidrocarburos,08/06/2017,Aprobado,SIN DESCRIPCION,-81.21173445,-4.52022958,RD N° 200-2017-SENACE/DCA,
760,COMPAÑIA MINERA CHUNGAR S.A.C.,20514608041,PLAN DE PARTICIPACIÓN CIUDADANA (CON TUPA) - M-CLS-NT-00044-2019 - PLAN DE PARTICIPACIÓN CIUDADANA PREVIO A LA PRESENTACIÓN DE LA MEIA-D ANIMON,ANIMON,PPC,Minería,25/08/2020,Aprobado,SIN DESCRIPCION,-70.39899865,-13.15209764,RD N° 140-2020-SENACE-PE/DEAR,
761,MUNICIPALIDAD DISTRITAL SAN ISIDRO DE MAINO,20168006862,"CREACIÓN DE LA VÍA VECINAL EN LOS TRAMOS HISHMISHTRANCA – PUMAHUASI, HISHMISHTRANCA – TIOPUCRO, CORRAL – SAHUAL, DISTRITO DE SAN ISIDRO DEL MAINO, PROVINCIA CHACHAPOYAS, REGIÓN AMAZONAS","CREACIÓN DE LA VÍA VECINAL EN LOS TRAMOS HISHMISHTRANCA – PUMAHUASI, HISHMISHTRANCA – TIOPUCRO, CORRAL – SAHUAL, DISTRITO DE SAN ISIDRO DEL MAINO, PROVINCIA CHACHAPOYAS, REGIÓN AMAZONAS",Clasificación,Transportes,29/04/2019,Aprobado,SIN DESCRIPCION,-77.86909847,-6.32619989,RD N° 00122-2019-SENACE-PE/DEIN,
762,COMPAÑÍA MINERA ANTAPACCAY S.A.,20114915026,MEIA DEL PROYECTO ANTAPACCAY EXPANSIÓN TINTAYA INTEGRACIÓN COROCCOHUAYCO,U.M. ANTAPACCAY,MEIA-d,Minería,27/04/2018,Aprobado,SIN DESCRIPCION,-71.2618,-14.9546,RD N° 00196-2019-SENACE-PE/DEAR,
764,MUNICIPALIDAD DISTRITAL DE MEGANTONI,20601625017,"CONSTRUCCIÓN DEL CAMINO VECINAL DEL SECTOR VISTA ALEGRE MISHAHUA HACIA ALTO MISHAHUA, DEL DISTRITO DE MEGANTONI, LA CONVENCIÓN - CUSCO","CONSTRUCCIÓN DEL CAMINO VECINAL DEL SECTOR VISTA ALEGRE MISHAHUA HACIA ALTO MISHAHUA, DEL DISTRITO DE MEGANTONI, LA CONVENCIÓN - CUSCO",Clasificación,Transportes,21/11/2019,Aprobado,SIN DESCRIPCION,-72.96531854,-11.30276426,RD N° 074-2020-SENACE-PE,
856,MINSUR S.A.,20100136741,REAPROVECHAMIENTO DE RELAVES DE LA UNIDAD MINERA SAN RAFAEL,U.M. SAN RAFAEL,MEIA-d,Minería,14/09/2016,Aprobado,SIN DESCRIPCION,-70.3254,-14.2296,RD N° 095-2017-SENACE-DCA,
858,GERENCIA SUB REGIONAL LUCIANO CASTILLO COLONNA DEL GOBIERNO REGIONAL DE PIURA,20315880069,"PROYECTO DE INVERSIÓN PÚBLICA ""MEJORAMIENTO Y CONSTRUCCIÓN CARRETERA EL GUINEO - CHIVATOS, DISTRITO DE SUYO - AYABACA -PIURA""",SIN UNIDAD,Clasificación,Transportes,31/05/2017,Aprobado,SIN DESCRIPCION,-80.13431348,-4.51346691,RD N° 034-2017-SENACE- JEF/DEIN,
859,TREVALI PERÚ S.A.C.,20516488973,SEGUNDO INFORME TÉCNICO SUSTENTATORIO (ITS) DE LA UNIDAD MINERA SANTANDER,SANTANDER,ITS,Minería,02/02/2021,Aprobado,SIN DESCRIPCION,-76.52423823,-11.18433573,"RD N° 051-2021-SENACE-PE/DEAR
",
861,COMPANÍA MINERA ARES S.A.C.,20192779333,TERCER ITS DE LA 2DA MODIFICACIÓN DEL ESTUDIO DE IMPACTO AMBIENTAL DE LA U.O. PALLANCATA,PALLANCATA,ITS,Minería,07/12/2018,Aprobado,SIN DESCRIPCION,-73.17972761,-14.72682934,RD N° 010-2019-SENACE-PE/DEAR,
862,CONCESIONARIA IIRSA NORTE S.A.,20511004251,"ITS DE LAS INSTALACIONES AUXILIARES PARA EL MANTENIMIENTO DEL TRAMO N°6: PIURA - PAITA, DEL PROYECTO CORREDOR VIAL AMAZONAS NORTE","INSTALACIONES AUXILIARES PARA EL MANTENIMIENTO DEL TRAMO N°6: PIURA - PAITA, DEL PROYECTO CORREDOR VIAL AMAZONAS NORTE",ITS,Transportes,18/07/2019,Aprobado,SIN DESCRIPCION,-80.75123974,-5.15656882,RD N° 00155-2019-SENACE-PE/DEIN,
883,COMPAÑÍA DE MINAS BUENAVENTURA S.A.A.,20100079501,PRIMER ITS DE LA MEIA DE LA UEA UCHUCCHACUA,U.M. UCHUCCHACUA,ITS,Minería,10/02/2017,Aprobado,SIN DESCRIPCION,-76.68099049,-10.62593988,RD N° 077-2017-SENACE/DCA,
954,MUNICIPALIDAD DISTRITAL DE MORROPE,20198667260,"MEJORAMIENTO DEL CAMINO VECINAL, MORROPE, PEDREGAL, LAS MERCEDES, HUACA DE BARRO, LAS PAMPAS, LAGARTERA, BARRIO NUEVO. DISTRITO DE MORROPE - LAMBAYEQUE - LAMBAYEQUE",SIN UNIDAD,Clasificación,Transportes,03/01/2017,Aprobado,SIN DESCRIPCION,-79.97486426,-79.97486426,RD N° 116-2017-SENACE/DCA,
956,CEPSA PERUANA S.A.C.,20516908930,MODIFICACIÓN DE COMPONENTES Y ACTIVIDADES DEL PROYECTO DE PERFORACIÓN EXPLORATORIA DEL POZO SAN ALEJANDRO 2X,LOTE 131,ITS,Hidrocarburos,05/04/2017,Aprobado,SIN DESCRIPCION,-75.10423389,-8.83863417,RD N° 173-2017-SENACE/DCA,
957,CONSORCIO TRANSMANTARO S.A.,20383316473,LÍNEA DE DISTRIBUCIÓN EN10KV VILLA AZUL - S.E. COLCABAMBA,S.E. MATARO,ITS,Electricidad,31/01/2017,Aprobado,SIN DESCRIPCION,-74.64658938,-12.37538878,RD N° 047-2017-SENACE/DCA,
1060,COMPAÑIA DE MINAS BUENAVENTURA S.A.A.,20100079501,TERCER INFORME TÉCNICO SUSTENTATORIO DE LA U.E.A. JULCANI,U.E.A. JULCANI,ITS,Minería,26/04/2019,Aprobado,SIN DESCRIPCION,-74.80457437,-12.94399997,RD N° 095-2019-SENACE-PE/DEAR,
1062,AEROPUERTOS DEL PERU S.A.,20514513172,PPC DEL EIA DETALLADO PARA EL PROYECTO “MEJORAMIENTO DEL SERVICIO AEROPORTUARIO DE LA REGIÓN LAMBAYEQUE MEDIANTE LA MODERNIZACIÓN DEL AEROPUERTO INTERNACIONAL CAPITÁN FAP JOSÉ ABELARDO QUIÑONES GONZÁLES DE CHICLAYO”,SIN UNIDAD,PPC,Transportes,15/03/2021,Aprobado,SIN DESCRIPCION,-79.82734978,-79.82734978,RD N° 00071-2021-SENACE-PE/DEIN,
1063,PETRÓLEOS DEL PERÚ PETROPERÚ S.A.,20100128218,PPC DE LA MODIFICACIÓN DEL EIA DEL “PROYECTO ODERNIZACIÓN REFINERÍA TALARA - PROYECTO CONSTRUCCIÓN E INSTALACIÓN DE LA LÍNEA DE TRANSMISIÓN ELÉCTRICA DESDE LA SUBESTACIÓN PARIÑAS HASTA LA REFINERÍA TALARA”,SIN UNIDAD,PPC,Hidrocarburos,09/05/2018,Aprobado,SIN DESCRIPCION,-81.22969648,-4.59001059,RD N° 070-2018-SENACE-JEF/DEAR,
1064,ARIANA OPERACIONES MINERAS S.A.C.,20543905306,SEGUNDO ITS UNIDAD MINERA ARIANA,SIN UNIDAD,ITS,Minería,21/11/2019,Aprobado,SIN DESCRIPCION,-76.32123846,-11.49626839,RDN°0041 -2020-SENACE-PE/DEAR,
765,INNOVA AMBIENTAL S.A.,20302891452,INFORME TECNICO SUSTENTATORIO DEL RELLENO SANITARIO CUMBRE,RELLENO SANITARIO CUMBRE,ITS,Residuos Sólidos,09/11/2022,Aprobado,SIN DESCRIPCION,-79.03521741,-7.94229141,,
766,GOBIERNO REGIONAL DE PASCO,20489252270,"EVAP DEL PROYECTO MEJORAMIENTO DE LA CARRETERA DEL CENTRO POBLADO DE PARIAMARCA – YANACACHI – NUEVA AURORA, DISTRITO DE TICLACAYAN – PASCO – PASCO","MEJORAMIENTO DE LA CARRETERA DEL CENTRO POBLADO DE PARIAMARCA – YANACACHI – NUEVA AURORA, DISTRITO DE TICLACAYAN – PASCO – PASCO",Clasificación,Transportes,06/11/2018,Aprobado,SIN DESCRIPCION,-76.15976918,-10.64982749,RD N° 00099-2019-SENACE-PE/DEIN ,
769,CONCESIONARIA IIRSA NORTE S.A.,20511004251,"ITS DEPÓSITO DE MATERIAL EXCEDENTE KM 154 +000 LD, TRAMO 4 OLMOS - CORRAL QUEMADO (DISTRITO DE CALLAYUC, PROVINCIA DE CUTERVO, REGIÓN CAJAMARCA)",CORREDOR VIAL AMAZONAS NORTE,ITS,Transportes,25/07/2018,Aprobado,SIN DESCRIPCION,-78.85800693,-6.00821737,RD N° 00050-2018-SENACE-PE/DEIN,
770,PROYECTO ESPECIAL DE INFRAESTRUCTURA DE TRANSPORTE NACIONAL - PROVIAS NACIONAL,20503503639,"MEJORAMIENTO A NIVEL DE AUTOPISTA Y/O PAR VIAL, MATARANI – EMP. PE -1S","MEJORAMIENTO A NIVEL DE AUTOPISTA Y/O PAR VIAL, MATARANI – EMP. PE -1S",Clasificación,Transportes,27/02/2019,Aprobado,SIN DESCRIPCION,-71.87181486,-16.62430383,RD N° 00134-2019-SENACE-PE/DEIN,
864,CONSORCIO TRANSMANTARO S.A.,20383316473,INFORME TÉCNICO SUSTENTATORIO N° 3 PARA EL PROYECTO “ENLACE 500 KV MANTARO-NUEVA YANANGO-CARAPONGO Y SUBESTACIONES ASOCIADAS” – ITS N° 3 – COYA.,ENLACE 500 KV MANTARO-NUEVA YANANGO-CARAPONGO Y SUBESTACIONES ASOCIADAS,ITS,Electricidad,30/07/2021,Aprobado,SIN DESCRIPCION,-74.84604225,-12.06818581,RD N° 00166-2021-SENACE-PE/DEIN,
867,LUZ DEL SUR S.A.A.,20331898008,EVAP DEL PROYECTO NUEVA SET SAN MIGUEL Y LÍNEAS ASOCIADAS.,SIN UNIDAD,Clasificación,Electricidad,16/04/2018,Aprobado,SIN DESCRIPCION,-76.86430774,-11.97240524,RD N° 00107-2018-SENACE-JEF/DEIN,
868,CONCESIONARIA IIRSA NORTE S.A.,20511004251,"ITS PARA LAS OBRAS ACCESORIAS EN LOS SECTORES KM 487+850 – KM 487+950 Y KM 506+080 – KM 506+190 DEL PROYECTO CORREDOR VIAL AMAZONAS NORTE, TRAMO 2: TARAPOTO - RIOJA","INFORME TÉCNICO SUSTENTATORIO PARA LAS OBRAS ACCESORIAS EN LOS SECTORES KM 487+850 – KM 487+950 Y KM 506+080 – KM 506+190 DEL PROYECTO CORREDOR VIAL AMAZONAS NORTE, TRAMO 2: TARAPOTO - RIOJA",ITS,Transportes,30/04/2019,Aprobado,SIN DESCRIPCION,-77.01973776,-6.04602129,RD N° 00100-2019-SENACE-PE/DEIN ,
961,GOLD FIELDS LA CIMA S.A.,20507828915,CUARTO ITS DE LA UM CERRO CORONA,U.M. CERRO CORONA,ITS,Minería,18/06/2018,Aprobado,SIN DESCRIPCION,-78.6297,-6.7658,RD N° 109-2018-SENACE-JEF/DEAR,
962,PLUSPETROL PERÚ CORPORATION S.A.,20304177552,INFORME TÉCNICO SUSTENTATORIO PARA LA REUBICACIÓN A LA LOCACIÓN MALVINAS DEL POZO 1 PROYECTADO EN LA LOCACIÓN KIMARO OSTE DEL LOTE 88,LOTE 88,ITS,Hidrocarburos,06/12/2018,Aprobado,SIN DESCRIPCION,-72.88,-11.8096,RD N° 00042-2019-SENACE-PE/DEAR,
964,MARCOBRE S.A.C.,20508972734,PRIMER ITS AL EIA DEL PROYECTO MINA JUSTA,MINA JUSTA,ITS,Minería,26/09/2016,Aprobado,SIN DESCRIPCION,-75.0756,-15.1505,RD N° 102-2016-SENACE-DCA,
1067,CONCESIONARIA IIRSA NORTE S.A.,20511004251,"ITS MODIFICACIÓN DEL PROYECTO CORREDOR VIAL AMAZONAS NORTE, PARA LA AMPLIACIÓN DE TRES ÁREAS AUXILIARES (DME´S): TRAMO N° 3 DV. CORRAL QUEMADO - RIOJA (AMPLIACIÓN DEL DME KM 198+855 LI Y AMPLIACIÓN DEL DME KM 293+550 LD) Y TRAMO N°4 DV. OLMOS - C",SIN UNIDAD,ITS,Transportes,26/06/2017,Aprobado,SIN DESCRIPCION,-79.61749765,-79.61749765,RD N° 030-2017-SENACE- JEF/DEIN,
1068,OLYMPIC PERU INC SUCURSAL DEL PERU,20305875539,"INFORME TECNICO SUSTENTATORIO PROYECTO DE AMPLIACIÓN PARA LA INSTALACIÓN DE LA ESTACIÓN DE FISCALIZACIÓN OLYMPIC 01 (EFO-01), LOTE XIII-B",LOTE XIII-B,ITS,Hidrocarburos,11/08/2021,Aprobado,SIN DESCRIPCION,-81.06760443,-5.253305,RD N° 00136-2021-SENACE-PE/DEAR,
771,LIMA AIRPORT PARTNERS S.R.L.,20501577252,SEGUNDA MODIFICACIÓN DEL ESTUDIO DE IMPACTO AMBIENTAL DETALLADO DEL AEROPUERTO INTERNACIONAL JORGE CHÁVEZ,INFRAESTRUCTURA AEROPORTUARIA,MEIA-d,Transportes,21/12/2021,Aprobado,SIN DESCRIPCION,-77.11944211,-12.02151859,RD N° 00167-2022-SENACE-PE/DEIN,
772,VOLCAN COMPAÑÍA MINERA S.A.A.,20383045267,PRIMER INFORME TÉCNICO SUSTENTATORIO DE LA UNIDAD MINERA TICLIO,U.M. TICLIO,ITS,Minería,09/01/2019,Aprobado,SIN DESCRIPCION,-76.17609795,-11.59769712,RD N° 045-2019-SENACE-PE/DEAR,
774,NATUCULTURA S.A.,20451871286,FUNDO MATSUBARA III Y SALAS DE LA EMPRESA NATUCULTURA S.A.,NATUCULTURA,Clasificación,Agricultura,28/06/2019,Aprobado,SIN DESCRIPCION,-76.3819833,-13.00621581,RD N° 00192-2019-SENACE-PE/DEAR,
775,CONCESIONARIA INTEROCEANICA SUR TRAMO 2 S.A.,20511125040,"ITS DEL DEPÓSITO DE MATERIAL EXCEDENTE KM 202+640 LD DEL PROYECTO CORREDOR VIAL INTEROCEÁNICO SUR PERÚ - BRASIL, TRAMO N° 2: URCOS – PUENTE INAMBARI.","PROYECTO CORREDOR VIAL INTEROCEÁNICO SUR PERÚ - BRASIL, TRAMO N° 2: URCOS – PUENTE INAMBARI",ITS,Transportes,19/03/2021,Aprobado,SIN DESCRIPCION,-70.67779566,-13.20281872,RD N° 00107-2021-SENACE-PE/DEIN,
869,PROYECTO ESPECIAL TAMBO CCARACOCHA-PETACC,20278885420,PPC DEL EIA-D DEL PROYECTO “CONTROL DE DESBORDES E INUNDACIONES DEL RÍO ICA Y QUEBRADA CANSAS/CHANCHAJALLA”,SIN UNIDAD,PPC,Agricultura,17/01/2018,Aprobado,SIN DESCRIPCION,-75.70312809,-75.70312809,RD N° 041-2018-SENACE-JEF/DEIN,
870,HYDRO GLOBAL PERÚ S.A.C.,20600538251,PPC DEL PROYECTO “LÍNEA DE TRANSMISIÓN PARA LA CONEXIÓN DE LA CENTRAL HIDROELÉCTRICA SAN GABÁN III AL SEIN”,SIN UNIDAD,PPC,Electricidad,02/03/2018,Aprobado,SIN DESCRIPCION,-70.58707824,-70.58707824,RD N° 00068-2018-SENACE-JEF/DEIN,
871,CONSORCIO TRANSMANTARO S.A.,20383316473,PPC PARA EL PROYECTO “ENLACE 500 KV MANTARO-NUEVA YANANGO-CARAPONGO Y SUBESTACIONES ASOCIADAS”,SIN UNIDAD,PPC,Electricidad,24/05/2018,Aprobado,SIN DESCRIPCION,-75.75437336,-75.75437336,RD N° 00109-2018-SENACE-JEF/DEIN,
872,CONSORCIO TRANSMANTARO S.A.,20383316473,PPC PARA EL PROYECTO “ENLACE 500 KV NUEVA YANANGO - NUEVA HUÁNUCO Y SUBESTACIONES ASOCIADAS”,SIN UNIDAD,PPC,Electricidad,24/05/2018,Aprobado,SIN DESCRIPCION,-75.69486078,-75.69486078,RD N° 00114-2018-SENACE-JEF/DEIN,
873,MUNICIPALIDAD DISTRITAL DE OCOBAMBA,20277520126,CREACIÓN DEL CAMINO VECINAL ENTRE LAS COMUNIDADES DE YANAMAYO -TASTAYOC DEL DISTRITO DE OCOBAMBA - PROVINCIA DE LA CONVENCIÓN - DEPARTAMENTO DE CUSCO,CREACIÓN DEL CAMINO VECINAL YANAMAYO-TASTAYOC,Clasificación,Transportes,08/09/2022,Aprobado,SIN DESCRIPCION,-72.25455027,-13.09667386,RD N° 00063-2023-SENACE-PE/DEIN,
968,PETROLERA MONTERRICO S.A.,20338598301,CONSTRUCCIÓN DE FCILIDADES EN LAS BATERÍAS DE PRODUCCIÓN LOTES II - XV,LOTE II Y XV,ITS,Hidrocarburos,30/01/2020,Aprobado,SIN DESCRIPCION,-81.14102191,-4.4135315,RD N° 082-2020-SENACE-PE,
970,CONCESIONARIA INTEROCEANICA SUR - TRAMO 3 S.A.,20511129975,"ITS PARA LA PLANTA DE TRATAMIENTO DE AGUA RESIDUAL EN LA UNIDAD INTEGRADA DE PEAJE Y PESAJE – UNIÓN PROGRESO KM 354+700, DEL PROYECTO CORREDOR VIAL INTEROCEÁNICO SUR PERÚ BRASIL, TRAMO N°3 PUENTE INA*","PLANTA DE TRATAMIENTO DE AGUA RESIDUAL EN LA UNIDAD INTEGRADA DE PEAJE Y PESAJE – UNIÓN PROGRESO KM 354+700, DEL PROYECTO CORREDOR VIAL INTEROCEÁNICO SUR PERÚ BRASIL, TRAMO N°3 PUENTE INAMBARI - IÑAPARI",ITS,Transportes,31/10/2019,Aprobado,SIN DESCRIPCION,-69.77593959,-12.88156875,RD N° 00020-2020-SENACE-PE/DEIN,
971,EMPRESA ADMINISTRADORA CERRO S.A.C.,20538848060,PRIMERA MODIFICACIÓN DEL ESTUDIO DE IMPACTO AMBIENTAL DETALLADO DE LA UNIDAD MINERA CERRO DE PASCO,CERRO DE PASCO,Clasificación,Minería,02/07/2021,Aprobado,SIN DESCRIPCION,-76.259628,-10.678518,RD N° 00145-2021-SENACE-PE/DEAR,
973,TREVALI PERÚ S.A.C.,20516488973,SEGUNDA MODIFICACIÓN DEL ESTUDIO DE IMPACTO AMBIENTAL DETALLADO DEL PROYECTO DE EXPLOTACIÓN DE MINA SANTANDER,SANTANDER,PPC,Minería,19/10/2022,Aprobado,SIN DESCRIPCION,-76.51885858,-11.19502136,RD N° 00047-2023-SENACE-PE/DEAR,
1074,PETRÓLEOS DEL PERÚ – PETROPERÚ S.A.,20100128218,MEJORAS DEL SISTEMA DE RESPUESTA CONTRAINCENDIOS DEL PROYECTO MODERNIZACIÓN REFINERÍA TALARA,REFINERIA TALARA,ITS,Hidrocarburos,15/01/2019,Aprobado,SIN DESCRIPCION,-81.27550981,-4.58726144,RD N° 00059-2019-SENACE-PE/DEAR,
777,LA ARENA S.A.,20205467603,ITS III MODIFICACIÓN DEL EIA DEL PROYECTO LA ARENA,U.M. LA ARENA,ITS,Minería,29/12/2017,Aprobado,SIN DESCRIPCION,-78.13050296,-7.89209965,RD N° 023-2018-SENACE-JEF/DEAR,
778,CEPSA PERUANA S.A.C.,20516908930,DESARROLLO E INSTALACIONES DE PRODUCCIÓN DEL LOTE 131,LOTE 131,EIA-d,Hidrocarburos,27/09/2016,Aprobado,SIN DESCRIPCION,-75.0759,-8.9188,RD N° 108-2017-SENACE-DCA,
779,COMPAÑÍA MINERA LAS CAMELIAS S.A.,20100171652,FLOR DE LOTO 2-B,SIN UNIDAD,Clasificación,Minería,30/10/2017,Aprobado,SIN DESCRIPCION,-76.14352313,-10.8261732,RD N° 067-2018-SENACE-JEF/DEAR,
780,GOLD FIELDS LA CIMA S.A.,20507828915,MEJORAS TECNOLOGICAS EN LA UNIDAD MINERA CERRO CORONA,U.M. CERRO CORONA,ITS,Minería,08/10/2016,Aprobado,SIN DESCRIPCION,-78.6297,-6.7658,RD N° 112-2016-SENACE/DCA,
781,BEAR CREEK MINING S.A.C.,20519387043,SEGUNDO ITS DEL PROYECTO CORANI,U.M. CORANI,ITS,Minería,27/09/2017,Aprobado,SIN DESCRIPCION,-70.70393365,-14.04168099,RD N° 340-2017-SENACE-DCA,
879,ICM PACHAPAQUI S.A.C.,20512208119,AFIANZAMIENTO HÍDRICO DE LA QUEBRADA DESAGÜE PARA LA INCORPORACIÓN DE ÁREAS AGRÍCOLAS EN LA COMUNIDAD CAMPESINA DE AQUIA,AFIANZAMIENTO HÍDRICO DE LA QUEBRADA DESAGÜE PARA LA INCORPORACIÓN DE ÁREAS AGRÍCOLAS EN LA COMUNIDAD CAMPESINA DE AQUIA,Clasificación,Agricultura,22/07/2019,Aprobado,SIN DESCRIPCION,-77.15682319,-9.90868177,RD N° 00032-2020-SENACE-PE/DEIN,
975,PAN AMERICAN SILVER HUARÓN S.A.,20546191541,PROYECTO DE EVALUACIÓN DE POSIBLES RELAVES EN ZONAS DE CHOSICA,U.M. HUARON,ITS,Minería,16/09/2016,Aprobado,SIN DESCRIPCION,-76.41,-11.0101,RD N° 098-2016-SENACE/DCA,
977,CONCESIONARIA INTEROCEANICA SUR - TRAMO 3 S.A.,20511129975,"INFORME TÉCNICO SUSTENTATORIO PARA LOS ACOPIOS, ZONAS DE MEZCLA ASFÁLTICA Y PLANTAS DE ASFALTO DEL KM 352+075 LD, KM 367+955 LD, KM 387+100 LI Y EL DEPÓSITO DE MATERIAL EXCEDENTE KM 383+378 LD, DEL PROYECTO CORREDOR VIAL INTEROCEÁNICO SUR PERÚ-BRASIL, TRA",CORREDOR VIAL INTEROCEÁNICO SUR PERÚ – BRASIL TRAMO N° 3,ITS,Transportes,17/09/2021,Aprobado,SIN DESCRIPCION,-69.42232672,-12.69704872,RD N° 00197-2021-SENACE-PE/DEIN,
