ID,TITULAR,RUC,TITULO_PROYECTO,UNIDAD_PROYECTO,TIPO,ACTIVIDAD,FECHA_INICIO,ESTADO,DESCRIPCION,LONGITUD,LATITUD,RESOLUCION,LABEL
1915,CONCESIONARIA INTEROCEÁNICA SUR - TRAMO 3 S.A.,20511129975,"ITS PARA EL ACOPIO, ZONA DE MEZCLA ASFÁLTICA Y MICROPAVIMENTO EN EL KM 476+300 LD DEL PROYECTO CORREDOR VIAL INTEROCEÁNICO SUR PERÚ – BRASIL, TRAMO N° 3 INAMBARI – IÑAPARI","INFORME TÉCNICO SUSTENTATORIO PARA EL ACOPIO, ZONA DE MEZCLA ASFÁLTICA Y MICROPAVIMENTO EN EL KM 476+300 LD DEL PROYECTO CORREDOR VIAL INTEROCEÁNICO SUR PERÚ – BRASIL, TRAMO N° 3 INAMBARI – IÑAPARI",ITS,Transportes,11/03/2020,Aprobado,SIN DESCRIPCION,-69.14387705,-12.23857584,RD N° 057-2020-SENACE-PE,
1916,PERU LNG S.R.L.,20506342563,INFORME TÉCNICO SUSTENTATORIO (ITS) PARA LA INSTALACIÓN DE UN SISTEMA DE GENERACIÓN FOTOVOLTAICA – PAMPA MELCHORITA – PERU LNG,PAMPA MELCHORITA,ITS,Hidrocarburos,23/02/2022,Aprobado,SIN DESCRIPCION,-76.28915485,-13.24311364,RD N° 00070-2022-SENACE-PE/DEAR,
1918,ENERGIA RENOVABLE DEL SUR S.A.,20392847406,"HABILITACIÓN DE ACCESO PARA GRANDES COMPONENTES, MODIFICACIÓN DE CAMINOS INTERNOS Y ZANJAS DE MEDIA TENSIÓN Y AUMENTO DE PERSONAL EN LA ETAPA DE OPERACIÓN DEL PARQUE EÓLICO SAN JUAN Y SU INTERCONEXIÓN AL SEIN.",PE SAN JUAN Y SU INTERCONEXIÓN AL SEIN,ITS,Electricidad,09/02/2022,Aprobado,SIN DESCRIPCION,-75.10774578,-15.40547276,RD N° 00068-2022-SENACE-PE/DEAR,
1964,GERENCIA TERRITORIAL DE PURÚS DEL GOBIERNO REGIONAL DE UCAYALI,20351710617,"PPC PARA LA ELABORACIÓN DEL EIAD DEL PROYECTO “CREACIÓN DEL CAMINO VECINAL DESDE PUERTO ESPERANZA HASTA LA CC.NN. DE SAN MARCOS, PROVINCIA DE PURÚS, DEPARTAMENTO DE UCAYALI""",SIN UNIDAD,PPC,Transportes,11/10/2019,Aprobado,SIN DESCRIPCION,-70.80184708,-70.80184708,RD N° 00114-2020-SENACE-PE/DEIN,
1965,HYDRO GLOBAL PERÚ S.A.C.,20600538251,LÍNEA DE TRANSMISIÓN PARA LA CONEXIÓN DE LA CENTRAL HIDROELÉCTRICA SAN GABÁN III AL SEIN,C.H. SAN GABAN II,Clasificación,Electricidad,10/02/2017,Aprobado,SIN DESCRIPCION,-70.87695508,-13.83843387,RD N° 099-2017-SENACE/DCA,
1966,MUNICIPALIDAD DISTRITAL DE CAYNA,20191219415,"CREACION DEL SERVICIO DE PROTECCIÓN CONTRA INUNDACIONES, MARGEN IZQUIERDO Y DERECHO DEL RIO QUIO MAYO, DEL CENTRO POBLADO DE QUIO DEL DISTRITO DE CAYNA - PROVINCIA DE  AMBO - DEPARTAMENTO DE HUANUCO",CREACIÓN DEL SERVICIO DE  PROTECCION CONTRA INUNDACIONES,Clasificación,Agricultura,18/10/2021,Aprobado,SIN DESCRIPCION,-76.3716107,-10.20784771,RD N° 00071-2022-SENACE-PE/DEIN,
1967,INVERSIONES LEFKADA S.A.C.,20522595501,PALTOS OLMOS,PALTOS OLMOS,Clasificación,Agricultura,29/05/2018,Aprobado,SIN DESCRIPCION,-80.03927742,-6.02333849,RD N° 025-2018-SENACE-PE/DEAR,
1968,COMPAÑÍA MINERA ZAFRANAL S.A.C.,20538837611,ESTUDIO DE IMPACTO AMBIENTAL DETALLADO DEL PROYECTO DE EXPLOTACIÓN MINERA ZAFRANAL,ZAFRANAL,IntegrAmbiente,Minería,27/12/2021,Aprobado,SIN DESCRIPCION,-72.25725648,-16.0751779,RD N° 064-2023-SENACE-PE/DEAR,
1969,CONCESIONARIA IIRSA NORTE S.A.,20511004251,MANTENIMIENTO DE PROYECTOS DE INFRAESTRUCTURA DE TRANSPORTES  EN OPERACIÓN  (NO CONSIDERADOS EN EL ANEXO 1 RM 891-2019-MTC),TRAMO III,ITS,Transportes,13/07/2022,Aprobado,SIN DESCRIPCION,-77.20777887,-6.03177515,RD N° 00178-2022-SENACE-PE/DEIN,
2064,LA MUNICIPALIDAD DISTRITAL DE SAN RAFAEL,20531377924,"PIP “CREACIÓN DE LA TROCHA CARROZABLE CORRALCANCHA - CUSHI, DISTRITO DE SAN RAFAEL – AMBO - HUÁNUCO”",SIN UNIDAD,Clasificación,Transportes,10/01/2018,Aprobado,SIN DESCRIPCION,-76.08176043,-10.33951497,RD N° 00011-2018-SENACE-PE/DEIN,
2065,CONCESIONARIA IIRSA NORTE S.A.,20511004251,"ITS PARA LA CONSTRUCCIÓN DE LOS DEPÓSITOS DE MATERIAL EXCEDENTE KM 56+300 LI-1, 56+300 LI-2, 81+420 LI Y 116+540 LI DEL CORREDOR VIAL AMAZONAS NORTE (IIRSA NORTE), TRAMO N° 01 YURIMAGUAS. - TARAPOTO","CORREDOR VIAL AMAZONAS NORTE (IIRSA NORTE), TRAMO N° 01 YURIMAGUAS. - TARAPOTO",ITS,Transportes,26/01/2021,Aprobado,SIN DESCRIPCION,-76.28046624,-6.12297123,RD N° 00044-2021-SENACE-PE/DEIN,
2066,CONSORCIO TRANSMANTARO S.A.,20383316473,MODIFICACIÓN DEL ESTUDIO DE IMPACTO AMBIENTAL DETALLADO (EIA-D) DEL PROYECTO “ENLACE 500 KV NUEVA YANANGO – NUEVA HUÁNUCO Y SUBESTACIONES ASOCIADAS”,ENLACE 500 KV NUEVA YANANGO – NUEVA HUÁNUCO Y SUBESTACIONES ASOCIADAS,MEIA-d,Electricidad,27/01/2021,Aprobado,SIN DESCRIPCION,-76.11513228,-9.93501682,RD N° 00045-2021-SENACE-PE/DEIN,
2068,GOLD FIELDS LA CIMA S.A.,20507828915,VIII MODIFICACIÓN DEL ESTUDIO DE IMPACTO AMBIENTAL DE CERRO CORONA,U.M. CERRO CORONA,MEIA-d,Minería,17/12/2018,Aprobado,SIN DESCRIPCION,-78.6297,-6.7658,RD N° 0171-2019-SENACE-PE/DEAR,
1785,CIA MINERA PODEROSA S A,20137025354,SEGUNDO INFORME TÉCNICO SUSTENTATORIO (ITS) DE LA UNIDAD SANTA MARIA,SANTA MARIA,ITS,Minería,12/11/2021,Aprobado,SIN DESCRIPCION,-77.60766458,-7.76652535,RD N° 00012-2022-SENACE-PE/DEAR,
1787,PETROLEOS DEL PERÚ PETROPERU S.A.,20100128218,CONSTRUCCIÓN E INSTALACIÓN DE LA LÍNEA DE TRANSMISIÓN ELÉCTRICA DESDE LA SUBESTACIÓN PARIÑAS HASTA LA REFINERÍA TALARA,REFINERIA TALARA,MEIA-d,Hidrocarburos,05/09/2018,Aprobado,SIN DESCRIPCION,-81.2347,-4.5916,RD N° 00085-2019-SENACE-PE/DEAR,
1923,OXIDOS DE PASCO S.A.C.,20600715187,INFORME TÉCNICO SUSTENTATORIO DEL ESTUDIO DE IMPACTO AMBIENTAL EXCEPCIONAL PLANTA COMPLEMENTARIA PARA EL BENEFICIO DE OXIDADOS,OXIDOS DE PASCO,ITS,Minería,26/12/2017,Aprobado,SIN DESCRIPCION,-76.27556573,-10.67901185,RD N° 027-2018-SENACE-JEF/DEAR,
1924,COMPAÑÍA MINERA ANTAPACCAY S.A.,20114915026,EXPLOTACIÓN ANTAPACCAY-EXPANSIÓN TINTAYA,U.M. ANTAPACCAY,ITS,Minería,21/12/2016,Aprobado,SIN DESCRIPCION,-71.34080095,-14.91405903,RD N° 034-2017-SENACE/DCA,
1925,CSF CONTINUA MISTI S.A.C.,20600896637,CSF CONTINUA MISTI 300MW,CSF MISTI,Clasificación,Electricidad,13/07/2018,Aprobado,SIN DESCRIPCION,-71.78700871,-16.78103521,RD N° 012-2018-SENACE-PE/DEAR,
1926,GOBIERNO REGIONAL CUSCO,20527147612,TDRS DEL EIA-D DEL PROYECTO CONTRUCCIÓN DE LA PLANTA DE FRACCIONAMIENTO DE LÍQUIDOS DE GAS NATURAL (LGN) EN LA PROVINCIA DE LA CONVENCIÓN - CUSCO,PLANTA DE FRACCIONAMIENTO - CUSCO,Clasificación,Hidrocarburos,28/01/2022,Aprobado,SIN DESCRIPCION,-73.24389827,-12.66153126,Oficio N° 00263-2022-SENACE-PE/DEAR,
1927,CONCESIONARIA IIRSA NORTE S.A.,20511004251,"INFORME TÉCNICO SUSTENTATORIO PARA LA OBRA ACCESORIA DEL SECTOR KM 504+820 AL 504+960 DEL PROYECTO CORREDOR VIAL AMAZONAS NORTE, TRAMO N° 2 TARAPOTO - RIOJA",TRAMO II,ITS,Transportes,12/08/2021,Aprobado,SIN DESCRIPCION,-76.77185115,-6.272553,RD N° 00167-2021-SENACE-PE/DEIN,
1970,COMPAÑÍA MINERA ZAFRANAL S.A.C.,20538837611,PPC PREVIO A LA PRESENTACIÓN DEL EIA DETALLADO DEL PROYECTO DE EXPLOTACIÓN MINERA ZAFRANAL,SIN UNIDAD,PPC,Minería,27/02/2019,Aprobado,SIN DESCRIPCION,-71.93134607,-16.24107283,RD N° 062-2019-SENACE-PE/DEAR,
1972,MUNICIPALIDAD DE LA MOLINA,20131365700,"MEJORAMIENTO DE LA INFRAESTRUCTURA VIAL PARA LA TRANSITABILIDAD DE LA AV. LA MOLINA DESDE LA AV. MELGAREJO HASTA EL JR. MADRE SELVA, TRAMO I: DESDE LA AV. MELGAREJO HASTA LA AV. ELÍAS APARICIO EN EL DISTRITO DE LA MOLINA, PROVINCIA DE LIMA - LIMA",SIN UNIDAD,Clasificación,Transportes,27/10/2016,Aprobado,SIN DESCRIPCION,-76.93658627,-76.93658627,RD N° 007-2017-SENACE/DCA,
1973,CONCESIONARIA INTEROCEANICA SUR - TRAMO 2 S.A.,20511125040,"ITS PARA LA OBRA ACCESORIA DE ESTABILIZACIÓN DEL SECTOR CRÍTICO KM 8+928.67 – KM 9+024.00 DEL PROYECTO CORREDOR VIAL INTEROCEÁNICO SUR PERÚ-BRASIL, TRAMO N° 2 URCOS - PUENTE INAMBARI","OBRA ACCESORIA DE ESTABILIZACIÓN DEL SECTOR CRÍTICO KM 8+928.67 – KM 9+024.00 DEL PROYECTO CORREDOR VIAL INTEROCEÁNICO SUR PERÚ-BRASIL, TRAMO N° 2 URCOS - PUENTE INAMBARI",ITS,Transportes,19/07/2019,Aprobado,SIN DESCRIPCION,-71.60562191,-13.66068724,RD N° 00156-2019-SENACE-PE/DEIN,
1974,JINZHAO  MINING PERU S.A.,20520694839,3ER ITS DE LA UNIDAD MINERA PAMPA DEL PONGO,PAMPA DE PONGO,ITS,Minería,20/05/2022,Aprobado,SIN DESCRIPCION,-74.83396865,-15.39057068,RD N° 00109-2022-SENACE-PE/DEAR,
2075,ANDALUCITA S.A.,20512773924,TERCER INFORME TÉCNICO SUSTENTATORIO DE LA UNIDAD MINERA ANDALUCITA - U.E.A. LUCITA I,ANDALUCITA - U.E.A. LUCITA I,ITS,Minería,11/11/2021,Aprobado,SIN DESCRIPCION,-81.1189,-5.2066,RD N° 00019-2022-SENACE-PE/DEAR,
2076,RUTAS DE LIMA S.A.C.,20550372640,"ITS PARA LA ""INCORPORACIÓN DE ÁREAS AUXILIARES, CAMPAMENTO RAMIRO PRIALÉ, AMPLIACIÓN DME CORONEL Y DME LOS ROSALES AL EIA-D DEL PROYECTO VÍAS NUEVAS DE LIMA - TRAMO RAMIRO PRIALÉ""",SIN UNIDAD,ITS,Transportes,12/08/2016,Aprobado,SIN DESCRIPCION,-76.8855939,-12.00639583,075-2016-SENACE/DCA,
2078,PLUSPETROL PERU CORPORATION S.A.,20304177552,INFORME TÉCNICO SUSTENTATORIO PARA LA INSTALACIÓN DE UN SISTEMA DE RESPALDO AL ACTUAL SISTEMA DE ANTORCHAS DE LA PLANTA DE FRACCIONAMIENTO DE LGN PISCO,PLANTA PISCO,ITS,Hidrocarburos,16/01/2020,Aprobado,SIN DESCRIPCION,-76.23162434,-13.77607194,RD N° 064-2020-SENACE-PE,
2080,VOTORANTIM METAIS CAJAMARQUILLA S.A.,20261677955,MODIFICACIÓN DEL ESTUDIO DE IMPACTO AMBIENTAL DETALLADO DE LA REFINERÍA CAJAMARQUILLA,NEXA CAJAMARQUILLA,Clasificación,Minería,07/07/2020,Aprobado,SIN DESCRIPCION,-76.8828,-11.9672,RD N° 0115-2020-SENACE-PE/DEAR,
1788,PROYECTO ESPECIAL DE INFRAESTRUCTURA DE TRANSPORTE NACIONAL - PROVIAS NACIONAL,20503503639,CREACION DE LA VIA DE EVITAMIENTO EN LA CIUDAD DE JAEN,SOLICITUD DE CLASIFICACION Y APROBACION DE LOS TERMINOS DE REFERENCIA Y PLAN DE PARTICIPACION CIUDADANA DEL ESTUDIO DE IMPACTO AMBIENTAL DEL PROYECTO REFORMULACION DEL ESTUDIO DE PREINVERSION A NIVEL DE PERFIL: CREACION DE LA VIA DE EVITAMIENTO EN LA CIUD,Clasificación,Transportes,28/09/2018,Aprobado,SIN DESCRIPCION,-78.78636098,-5.75973103,RD N° 00027-2019-SENACE-PE/DEIN,
1790,OLYMPIC PERU INC SUCURSAL DEL PERU,20305875539,"ITS MODIFICACIÓN DE LA LÍNEA DE RECOLECCIÓN DE GAS ENTRE MANIFOLD MOCHICA - MANIFOLD LA CASITA E INCORPORACIÓN DE UN SISTEMA DE TRATAMIENTO DE AGUAS RESIDUALES DOMÉSTICAS CON INFILTRACIÓN, LOTE XIII-B",LOTE XIII-B,ITS,Hidrocarburos,17/06/2019,Aprobado,SIN DESCRIPCION,-80.98726964,-5.34577057,RD N° 0153-2019-SENACE-PE/DEAR,
1791,INFRAESTRUCTURAS Y ENERGÍAS DEL PERU S.A.C.,20393826879,INFORME TÉCNICO SUSTENTATORIO DEL PROYECTO RESERVA FRÍA DE GENERACIÓN - PLANTA PUERTO MALDONADO,CT PUERTO MALDONADO,ITS,Electricidad,05/02/2021,Aprobado,SIN DESCRIPCION,-69.22289345,-12.5898613,RD N° 00055-2021-SENACE-PE/DEAR,
1929,MINERA BATEAS S.A.C.,20510704291,PRIMER ITS PARA LA MODIFICACIÓN DE COMPONENTES PRINCIPALES Y AUXILIARES DE LA 2DA MEIA DEL PROYECTO AMPLIACIÓN DE MINA PLANTA DE BENEFICIO HUAYLLACHO DE 1030 TMD A 1500 TMD,SAN CRISTOBAL - CAYLLOMA,ITS,Minería,12/02/2018,Aprobado,SIN DESCRIPCION,-71.86070062,-15.18680909,RD N° 044-2018-SENACE-JEF/DEAR,
1930,LIMA AIRPORT PARTNERS S.R.L.,20501577252,INFORME TÉCNICO SUSTENTATORIO (ITS) PARA LA ACTUALIZACIÓN DE LA MODIFICACIÓN DEL ESTUDIO DE IMPACTO AMBIENTAL (MEIA) DEL AEROPUERTO INTERNACIONAL JORGE CHÁVEZ (AIJC),INFRAESTRUCTURA AEROPORTUARIA,ITS,Transportes,06/11/2020,Aprobado,SIN DESCRIPCION,-77.11972212,-12.02047415,RD N° 00003-2021-SENACE-PE/DEIN,
1931,INTERSUR CONCESIONES S.A.,20511130124,DEPÓSITOS DE MATERIAL EXCEDENTE DEL TRAMO 4 AZÁNGARO - PUENTE INAMBARI DEL  CORREDOR VIAL INTEROCEÁNICO SUR PERÚ - BRASIL,DEPÓSITOS DE MATERIAL EXCEDENTE,ITS,Transportes,15/10/2021,Aprobado,SIN DESCRIPCION,-70.43552057,-14.06355314,RD N° 00011-2022-SENACE-PE/DEIN,
1976,MINERA CHINALCO PERÚ S.A,20506675457,PPC PREVIO A LA PRESENTACIÓN DE LA MEIA PARA EL PROYECTO DE EXPANSIÓN DE LA UNIDAD MINERA TOROMOCHO A 170 000 TPD,SIN UNIDAD,PPC,Minería,05/08/2019,Aprobado,SIN DESCRIPCION,-76.116891,-11.625066,RDN°143-2019-SENACE-PE/DEAR,
1978,COMPAÑÍA MINERA RAURA S.A.,20100163552,"PARTICIPACIÓN CIUDADANA DE LA ETAPA DURANTE LA ELABORACIÓN DE LA SEGUNDA MODIFICACIÓN AL EIA DEL DEPÓSITO DE RELAVES NIEVE UCRO II, ETAPAS 4 Y 5 DE LA UNIDAD MINERA RAURA, PRESENTADO POR COMPAÑÍA MINERA RAURA S.A",SIN UNIDAD,PPC,Minería,10/08/2018,Aprobado,SIN DESCRIPCION,-76.7464992,-10.45792975,RD N° 0002-2018-SENACE- PE/DEAR,
1979,SOCIEDAD MINERA EL BROCAL S.A.A.,20100017572,CUARTO INFORME TÉCNICO SUSTENTATORIO DE LA MODIFICACIÓN DEL EIA AMPLIACIÓN DE OPERACIONES A 18000 TMD,U.M. COLQUIJIRCA,ITS,Minería,01/03/2018,Aprobado,SIN DESCRIPCION,-76.2856,-10.7663,RD N° 060-2018-SENACE-JER/DEAR,
2058,COMPAÑIA MINERA ARES S.A.C.,20192779333,PROPUESTA DE PARTICIPACIÓN CIUDADANA - ETAPA DE ELABORACIÓN,U.O. INMACULADA,PPC,Minería,06/11/2020,Aprobado,SIN DESCRIPCION,-73.24250776,-14.94375857,RD N° 00151-2020-SENACE-PE/DEAR,
2059,PLUSPETROL PERÚ CORPORATION S.A.,20304177552,"MODIFICACIÓN DEL SISTEMA DE DESPACHO TERRESTRE EN LA PLANTA DE FRACCIONAMIENTO DE LÍQUIDOS DE GAS NATURAL (PFLGN), PISCO",PLANTA PISCO,ITS,Hidrocarburos,17/05/2016,Aprobado,SIN DESCRIPCION,-76.229,-13.7705,RD N° 044-2016-SENACE/DCA,
2061,GOLD FIELDS LA CIMA S.A.,20507828915,PRIMER INFORME TÉCNICO SUSTENTATORIO DE LA VIII MODIFICACIÓN DEL ESTUDIO DE IMPACTO AMBIENTAL DE CERRO CORONA,U.M. CERRO CORONA,ITS,Minería,28/01/2020,Aprobado,SIN DESCRIPCION,-78.63411302,-6.76675475,RD N° 00043-2020-SENACE-PE/DEAR,
2063,PAN AMERICAN SILVER HUARÓN S.A.,20546191541,MEJORA DE SERVICIO DE VENTILACIÓN MEDIANTE LA IMPLEMENTACIÓN DE UN RAISE BORER (RB-49) Y LA HABILITACIÓN DE UN COMEDOR CENTRAL - HUARÓN,U.M. HUARON,ITS,Minería,13/02/2018,Aprobado,SIN DESCRIPCION,-76.41,-11.0101,RD N° 043-2018-SENACE-JEF/DEAR,
1793,AUTORIDAD PARA LA RECONSTRUCCION CON CAMBIOS,20602114091,"MEJORAMIENTO Y AMPLIACION DEL SERVICIO DE PROTECCIÓN ANTE INUNDACIONES Y MOVIMIENTO DE MASAS EN LA QUEBRADA HUAYCOLORO, DISTRITO DE SAN ANTONIO - PROVINCIA DE HUAROCHIRI - DEPARTAMENTO DE  LIMA",SIN UNIDAD,IGAPRO,Agricultura,20/01/2023,Aprobado,SIN DESCRIPCION,-76.9007459,-11.98739516,RD Nº 00062-2023-SENACE-PE/DEIN,
1794,MONTE AZUL CENTRO SOCIEDAD ANONIMA CERRADA - MONTE AZUL CENTRO S.A.C,20555714654,"TERMINAL DE RECEPCIÓN DE RECEPCIÓN, ALMACENAMIENTO Y DESPACHO DE GLP E HIDROCARBUROS LÍQUIDOS – VILLA EL SALVADOR",TERMINAL DE ALMACENAMIENTO DE GLP E HIDROCARBUROS LÍQUIDOS,ITS,Hidrocarburos,21/12/2021,Aprobado,SIN DESCRIPCION,-76.94382103,-12.24104637,RD N° 00136-2022-SENACE-PE/DEAR,
1933,ASOCIACION DE AGRICULTORES UNIDOS BAMBAMARCA-CHOTA,20560012471,"EVALUACION AMBIENTAL PRELIMINAR (EVAP) DEL PREDIO AGRÍCOLA PAMPAS DE RIO SECO, DEL DISTRITO DE PUEBLO NUEVO - PROVINCIA DE CHEPEN- DEPARTAMENTO DE LA LIBERTAD",PREDIO AGRÍCOLA,Clasificación,Agricultura,30/03/2022,Aprobado,SIN DESCRIPCION,-79.57543605,-7.20150838,RD N° 141-2022-SENACE-PE/DEAR,
1934,"SOUTHERN PERU COPPER CORPORATION, SUCURSAL DEL PERÚ",20100147514,CUARTO INFORME TÉCNICO SUSTENTATORIO DE LA UNIDAD MINERA CUAJONE,CUAJONE,ITS,Minería,27/07/2021,Aprobado,SIN DESCRIPCION,-70.74063795,-17.05131584,RD N° 00128-2021-SENACE-PE/DEAR,
1935,ANABI S.A.C.,20517187551,"II ITS MODIFICACIÓN, AMPLIACIÓN E IMPLEMENTACIÓN DE NUEVOS COMPONENTES MINEROS",U.M. ANAMA,ITS,Minería,08/11/2016,Aprobado,SIN DESCRIPCION,-72.7558,-14.3406,RD N° 140-2016-SENACE/DCA,
1938,CERDOS SUR PERÚ S.A. - CERSUR S.A.,20563407426,EVALUACIÓN AMBIENTAL PRELIMINAR PARA LA CONSTRUCCIÓN DE UNA PLANTA DE BENEFICIOS DE CERDOS DE LA EMPRESA CERDOS SUR PERÚ S.A.,AGRICULTURA,Clasificación,Agricultura,15/06/2021,Aprobado,SIN DESCRIPCION,-76.72471973,-12.46345596,RD N° 00123-2021-SENACE-PE/DEAR,
1981,TAL S.A.,20131565659,"EVALUACIÓN AMBIENTAL PRELIMINAR (EVAP), DEL PROYECTO “PLANTA DE ALIMENTOS DE ABEJAS DE LA EMPRESA TAL S.A., CHAO – VIRÚ – LA LIBERTAD”",PLANTA DE ABEJAS,Clasificación,Agricultura,16/07/2018,Aprobado,SIN DESCRIPCION,-78.6297001,-8.58832202,RD N° 00034-2018-SENACE-PE/DEAR,
1982,INNOVA AMBIENTAL S.A.,20302891452,"PROYECTO DE INFRAESTRUCTURA DE DISPOSICIÓN FINAL DE RESIDUOS SÓLIDOS NO MUNICIPALES PELIGROSOS Y NO PELIGROSOS - ""RELLENO DE SEGURIDAD - LA JOYA","PROYECTO DE INFRAESTRUCTURA DE DISPOSICIÓN FINAL DE RESIDUOS SÓLIDOS NO MUNICIPALES PELIGROSOS Y NO PELIGROSOS - ""RELLENO DE SEGURIDAD - LA JOYA",Clasificación,Residuos Sólidos,13/03/2019,Aprobado,SIN DESCRIPCION,-71.86197111,-16.54530107,RD N° 00143-2019-SENACE-PE/DEIN,
1984,CONCESIONARIA IIRSA NORTE S.A.,20601375932,"ITS PARA LAS INSTALACIONES AUXILIARES TIPO DME Y ACOPIOS PARA LA CONSERVACIÓN DEL TRAMO N° 5: PIURA - DV OLMOS, DEL PROYECTO CORREDOR VIAL AMAZONAS NORTE","INSTALACIONES AUXILIARES TIPO DME Y ACOPIOS PARA LA CONSERVACIÓN DEL TRAMO N° 5: PIURA - DV OLMOS, DEL PROYECTO CORREDOR VIAL AMAZONAS NORTE",ITS,Transportes,06/08/2019,Aprobado,SIN DESCRIPCION,-80.55471464,-5.17383413,RD N° 00151-2019-SENACE-PE/DEIN,
1985,ICM PACHAPAQUI S.A.C.,20512208119,EXPANSIÓN A 3300 TMD DE LA UNIDAD MINERA PACHAPAQUI,PACHAPAQUI,MEIA-d,Minería,29/04/2016,Aprobado,SIN DESCRIPCION,-77.05601423,-9.95012327,RD N° 023-2017-SENACE-JEF/DEAR,
2069,PROYECTO ESPECIAL DE INFRAESTRUCTURA DE TRANSPORTE NACIONAL - PROVIAS NACIONAL,20503503639,"SOLICITUD DE CLASIFICACION DE ESTUDIOS AMBIENTALES DEL PROYECTO CREACION DE LOS SERVICIOS DE TRANSITABILIDAD DESDE LA LOCALIDAD DE HUACHIS - TAMBILLO (SOLEDAD DE TAMBO) - TAULLI, DISTRITO DE HUACHIS *","CREACION DE LOS SERVICIOS DE TRANSITABILIDAD DESDE LA LOCALIDAD DE HUACHIS - TAMBILLO (SOLEDAD DE TAMBO) - TAULLI, DISTRITO DE HUACHIS - ANCASH",Clasificación,Transportes,09/08/2018,Aprobado,SIN DESCRIPCION,-77.09946566,-9.41147478,RD N° 00010-2019-SENACE-PE/DEIN,
2071,PLUSPETROL PERÚ CORPORATION S.A.,20304177552,AMPLIACIÓN DE TANQUES DE ALMACENAMIENTO DE DIÉSEL EN LA PLANTA DE FRACCIONAMIENTO DE LÍQUIDOS DE GAS NATURAL DE PISCO,PLANTA PISCO,ITS,Hidrocarburos,28/09/2017,Aprobado,SIN DESCRIPCION,-76.22810707,-13.77735516,RD N° 030-2017-SENACE-JEF/DEAR,
2073,OLYMPIC PERÚ INC SUCURSAL DEL PERÚ,20305875539,"MODIFICACIÓN DE LA UBICACIÓN, ÁREA DE LA PLATAFORMA, LÍNEAS DE FLUJO Y VÍAS DE ACCESO DE CUATRO (04) POZOS DE GAS EN EL LOTE XIII-B",LOTE XIII-B,ITS,Hidrocarburos,24/10/2022,Aprobado,SIN DESCRIPCION,-80.97491763,-5.34162453,RD N°  00026-2023-SENACE-PE/DEAR,
2074,HUDBAY PERÚ S.A.C.,20511165181,TERCER ITS DE LA UM CONSTANCIA,U.M. CONSTANCIA,ITS,Minería,05/06/2019,Aprobado,SIN DESCRIPCION,-71.77388212,-14.47432846,RD N° 120-2019-SENACE-PE/DEAR,
1799,PROVIAS DESCENTRALIZADO - MTC,20380419247,"“CONSTRUCCIÓN DEL PUENTE VEHICULAR SALVADOR SOBRE EL RÍO HUALLAGA EN AUCAYACU, DISTRITO DE JOSÉ CRESPO Y CASTILLO - LEONCIO PRADO - HUÁNUCO (SNIP 282952)”",SIN UNIDAD,Clasificación,Transportes,06/03/2018,Aprobado,SIN DESCRIPCION,-76.12771391,-8.91587517,RD N° 00087-2018-SENACE-PE/DEIN,
1801,COMPAÑIA MINERA ANTAMINA S.A.,20330262428,SEXTO INFORME TÉCNICO SUSTENTATORIO DE LA UNIDAD MINERA ANTAMINA,ANTAMINA,ITS,Minería,09/02/2021,Aprobado,SIN DESCRIPCION,-77.03114493,-9.56878021,RD N° 057-202021-SENACE-PE/DEAR,
1803,COMPAÑIA MINERA KOLPA S.A.,20600020022,PLAN DE PARTICIPACIÓN CIUDADANA (CON TUPA) - 06786-2017 - PROPUESTA DE MECANISMO DE PARTICIPACION CIUDADANA PREVIO A LA PRESENTACIÓN DE LA MEIA,SIN UNIDAD,PPC,Minería,22/12/2020,Aprobado,SIN DESCRIPCION,-74.9824,-13.074,RD N° 022-2021-SENACE-PE/DEAR,
1939,GOBIERNO REGIONAL DE AREQUIPA,20498390570,"MEJORAMIENTO Y CULMINACIÓN DE CONSTRUCCIÓN DE LA CARRETERA PAMPACOCHA – CUPE, DISTRITO DE TORO, PROVINCIA LA UNIÓN, REGIÓN AREQUIPA",MEJORAMIENTO Y APERTURA,Clasificación,Transportes,23/11/2021,Aprobado,SIN DESCRIPCION,-72.96906366,-15.27569409,RD N° 00092-2022-SENACE-PE/DEIN,
1940,MINERA CHINALCO PERÚ S.A.,20506675457,MODIFICACIÓN DEL ESTUDIO DE IMPACTO AMBIENTAL PARA EL PROYECTO DE LA UNIDAD MINERA TOROMOCHO A 170 000 TPD,U.M. TOROMOCHO,MEIA-d,Minería,06/03/2020,Aprobado,SIN DESCRIPCION,-76.14117887,-11.60780137,RD N° 00083-2021-SENACE-PE/DEAR,
1942,AUTORIDAD PARA LA RECONSTRUCCION CON CAMBIOS,20602114091,"CREACIÓN DEL SERVICIO DE PROTECCIÓN FRENTE A INUNDACIONES EN LA QUEBRADA CORRALES, DISTRITO DE CORRALES, PROVINCIA DE TUMBES, DEPARTAMENTO DE TUMBES",SIN UNIDAD,IGAPRO,Agricultura,06/07/2022,Aprobado,SIN DESCRIPCION,-80.48007869,-3.61799272,RD N° 00144-2022-SENACE-PE/DEIN,
1943,MINSUR S.A.,20100136741,PRIMER INFORME TÉCNICO SUSTENTATORIO DE LA SEGUNDA MODIFICACIÓN DEL ESTUDIO DE IMPACTO AMBIENTAL DETALLADO DE LA U.M. PUCAMARCA.,PUCAMARCA,ITS,Minería,03/05/2019,Aprobado,SIN DESCRIPCION,-69.81586669,-17.76055095,RD N° 0113-2019-SENACE-PE/DEAR,
1944,CONCESIONARIA INTEROCEANICA SUR TRAMO 2 S.A.,20511125040,"INFORME TÉCNICO SUSTENTATORIO PARA EL DEPÓSITO DE MATERIAL EXCEDENTE (DME) KM 179+200 LI DEL PROYECTO CORREDOR VIAL INTEROCEÁNICO SUR PERÚ - BRASIL, TRAMO N° 2: URCOS – PUENTE INAMBARI","PROYECTO “CORREDOR VIAL INTEROCEÁNICO SUR, PERÚ – BRASIL TRAMO N°2: URCOS – INAMBARI”",ITS,Transportes,25/02/2022,Aprobado,SIN DESCRIPCION,-70.82404972,-13.31380948,RD N° 00102-2022-SENACE-PE/DEIN,
1813,GRAN TIERRA ENERGY PERÚ S.R.L.,20513842377,PROYECTO DE DESARROLLO DEL CAMPO PETROLERO BRETAÑA NORTE LOTE 95,LOTE 95,EIA-d,Hidrocarburos,17/10/2018,Aprobado,SIN DESCRIPCION,-74.3282,-5.2437,RD N° 00091-2019-SENACE-PE/DEAR,
1989,GOBIERNO REGIONAL HUANUCO,20489250731,"MEJORAMIENTO Y AMPLIACION DE LOS SERVICIOS DE PROTECCION CONTRA DESBORDES DE AGUA EN EL CENTRO POBLADO DE LLICUA MARGEN DERECHA E IZQUIERDA DE LA QUEBRADA AGORAGRA (LONG. 1395 ML) DISTRITO DE AMARILIS, PROVINCIA Y REGION HUANUCO",MEJORAMIENTO Y AMPLIACION DE LOS SERVICIOS DE PROTECCION CONTRA DESBORDES DE AGUA,Clasificación,Agricultura,14/04/2021,Aprobado,SIN DESCRIPCION,-76.22277082,-9.93345654,RD N° 00154-2021-SENACE-PE/DEIN,
1990,AUTORIDAD AUTÓNOMA DE MAJES DEL GOBIERNO REGIONAL DE AREQUIPA,20162554167,CUARTO ITS MODIFICACIÓN DE COMPONENTES AUXILIARES APROBADOS POR EL EIA DE LA REPRESA ANGOSTURA Y GESTIÓN A NIVEL DEFINITIVO,SIN UNIDAD,ITS,Agricultura,18/05/2018,Aprobado,SIN DESCRIPCION,-71.63175549,-15.19108696,RD N° 0088-2019-SENACE-PE/DEIN,
1718,CNPC PERÚ S.A.,20356476434,MODIFICACIÓN DEL ÁREA DE LAS PLATAFORMAS DE PERFORACIÓN E INCORPORACIÓN DEL USO DE TUBERÍAS DE HDPE EN LAS LÍNEAS DE CONDUCCIÓN – LOTE X,LOTE X,ITS,Hidrocarburos,15/06/2017,Aprobado,SIN DESCRIPCION,-81.17085359,-4.28361388,RD N° 210-2017-SENACE/DCA,
1720,MINERA AURIFERA RETAMAS S.A.,20132367800,MODIFICACIÓN DEL PLAN DE PARTICIPACIÓN CIUDADANA,UEA RETAMAS,MPPC,Minería,15/11/2022,Aprobado,SIN DESCRIPCION,-77.43774348,-8.05748115,RD N° 00004-2023-SENACE-PE/DEAR,
1805,RED DE ENERGIA DEL PERU SA,20504645046,"ITS DEL PROYECTO INSTALACIÓN DEL TRANSFORMADOR DE 30 MVA 138/22.9/10,5 KV Y CELDAS EN 22.9 KV Y 10.5 KV EN LA SUBESTACIÓN TINGO MARÍA","INFORME TÉCNICO SUSTENTATORIO DEL PROYECTO INSTALACIÓN DEL TRANSFORMADOR DE 30 MVA 138/22.9/10,5 KV Y CELDAS EN 22.9 KV Y 10.5 KV EN LA SUBESTACIÓN TINGO MARÍA",ITS,Electricidad,10/05/2019,Aprobado,SIN DESCRIPCION,-75.99279245,-9.28966138,RD N° 00110-2019-SENACE-PE/DEIN,
1807,MUNICIPALIDAD DISTRITAL DE PAUCARTAMBO,20191043546,"CREACION DE TROCHA CARROZABLE ANEXO LIRIOPAMPA – PARACSHA DEL CENTRO POBLADO DE CHUPACA, DISTRITO DE PAUCARTAMBO, PASCO – PASCO","CREACION DE TROCHA CARROZABLE ANEXO LIRIOPAMPA – PARACSHA DEL CENTRO POBLADO DE CHUPACA, DISTRITO DE PAUCARTAMBO, PASCO – PASCO",Clasificación,Transportes,03/06/2019,Aprobado,SIN DESCRIPCION,-75.8875789,-10.70727699,RD N° 00153-2019-SENACE-PE/DEIN,
1808,"SOUTHERN PERU COPPER CORPORATION, SUCURSAL DEL PERÚ",20100147514,QUINTO INFORME TÉCNICO SUSTENTATORIO,"EXPLOTACIÓN, BENEFICIO Y LABOR GENERAL MINERO METÁLICOS",ITS,Minería,27/12/2022,Aprobado,SIN DESCRIPCION,-70.70980438,-17.04308217,RD N° 00069-2023-SENACE-PE/DEAR,
1809,PETROLEOS DEL PERU PETROPERU SA,20100128218,AMPLIACIÓN DE LA CAPACIDAD DEL SISTEMA DE TRATAMIENTO DE TURBO Y DE LA CAPACIDAD DE ALMACENAMIENTO DE CRUDO Y NAFTAS DEL PROYECTO MODERNIZACIÓN REFINERÍA TALARA,REFINERÍA TALARA,ITS,Hidrocarburos,13/11/2020,Aprobado,SIN DESCRIPCION,-81.28099823,-4.579,RD N° 00044-2021-SENACE-PE/DEAR,
1852,PROYECTO ESPECIAL DE INFRAESTRUCTURA DE TRANSPORTE NACIONAL - PROVIAS NACIONAL,20503503639,INFORME TÉCNICO SUSTENTATORIO PARA INCORPORAR 01 NUEVO DEPÓSITO DE MATERIAL EXCEDENTE (DME) UBICADO EN EL ÁREA DE INFLUENCIA INDIRECTA DEL PROYECTO: DME 57 KM 35+830B LD,"MEJORAMIENTO DE LA CARRETERA HUÁNUCO – CONOCOCHA, SECTOR: HUÁNUCO – LA UNIÓN – HUALLANCA, RUTA PE-3N",ITS,Transportes,15/12/2020,Aprobado,SIN DESCRIPCION,-76.47641208,-9.8679757,RD N° 00039-2021-SENACE-PE/DEIN,
1856,"SOUTHERN PERU COPPER CORPORATION, SUCURSAL DEL PERÚ",20100147514,LOS CHANCAS,LOS CHANCAS,Clasificación,Minería,10/01/2022,Aprobado,SIN DESCRIPCION,-73.11193964,-14.15743265,RD N° 00111-2022-SENACE-PE/DEAR,
1992,CNPC PERU S.A.,20356476434,"PROYECTO DE MODIFICACIÓN DE LA UBICACIÓN, TAMAÑO DE LA PLATAFORMA, PROFUNDIDAD, VÍAS DE ACCESO Y LÍNEAS DE CONDUCCIÓN DE 59 POZOS DE DESARROLLO EN EL LOTE X",LOTE X,ITS,Hidrocarburos,30/10/2019,Aprobado,SIN DESCRIPCION,-81.14532234,-4.27808254,RD N° 00035-2020-SENACE-PE/DEAR,
1993,FENIX POWER PERU S.A.,20509514641,"INFORME TÉCNICO SUSTENTATORIO PARA LA OPTIMIZACIÓN DEL USO DE AGUA DEL SISTEMA DE ENFRIAMIENTO Y MODIFICACIÓN DE COMPONENTES AUXILIARES DE LA CENTRAL TERMOELÉCTRICA FENIX POWER - LAS SALINAS, CHILCA",FENIX,ITS,Electricidad,01/12/2020,Aprobado,SIN DESCRIPCION,-76.73636358,-12.54372625,RD N° 054-2021-SENACE-PE/DEAR,
1994,CONCESIONARIA IIRSA NORTE S.A.,20511004251,"ITS PARA LOS DEPÓSITOS DE MATERIAL EXCEDENTE KM 357+800 LI, KM 357+920 LI Y KM 362+100 LI DEL PROYECTO CORREDOR VIAL AMAZONAS NORTE, TRAMO 3: CORRAL QUEMADO - RIOJA","DEPÓSITOS DE MATERIAL EXCEDENTE KM 357+800 LI, KM 357+920 LI Y KM 362+100 LI DEL PROYECTO CORREDOR VIAL AMAZONAS NORTE, TRAMO 3: CORRAL QUEMADO - RIOJA",ITS,Transportes,08/05/2020,Aprobado,SIN DESCRIPCION,-77.84966467,-5.70652126,RD N° 00102-2020-SENACE-PE/DEIN,
