ID,TITULAR,RUC,TITULO_PROYECTO,UNIDAD_PROYECTO,TIPO,ACTIVIDAD,FECHA_INICIO,ESTADO,DESCRIPCION,LONGITUD,LATITUD,RESOLUCION,LABEL
506,ENGIE ENERGÍA PERÚ S.A.,20333363900,EVALUACIÓN PRELIMINAR (EVAP) DEL PROYECTO INTIPAMPA,INTIPAMPA,Clasificación,Electricidad,08/06/2016,Aprobado,SIN DESCRIPCION,-70.86,-17.2312,RD N° 071-2016-SENACE/DCA,
509,AUTOPISTA DEL NORTE S.A.C.,20520929658,"INFORME TECNICO SUSTENTATORIO (ITS) PARA INCORPORAR NUEVAS AREAS AUXILIARES: DME 01 KM 0+800, CANTERA VESIQUE KM 0+800, PATIO DE MAQUINAS KM 4+600 Y PLANTA DE CONCRETO KM 34+820",VÍA DE EVITAMIENTO CHIMBOTE,ITS,Transportes,13/05/2021,Aprobado,SIN DESCRIPCION,-78.47093463,-9.19702212,RD N° 00115-2021-SENACE-PE/DEIN,
549,MARCOBRE S.A.C.,20508972734,QUINTO INFORME TÉCNICO SUSTENTATORIO DE LA MODIFICACIÓN DEL ESTUDIO DE IMPACTO AMBIENTAL DEL PROYECTO MINA JUSTA,MINA JUSTA,ITS,Minería,09/07/2021,Aprobado,SIN DESCRIPCION,-75.06873612,-15.16531649,RD N° 00116-2021-SENACE-PE/DEAR,
551,CONCESIONARIA IIRSA NORTE S.A.,20511004251,MANTENIMIENTO DE PROYECTOS DE INFRAESTRUCTURA DE TRANSPORTES  EN OPERACIÓN  (NO CONSIDERADOS EN EL ANEXO 1 RM 891-2019-MTC),TRAMO III,ITS,Transportes,20/07/2022,Aprobado,SIN DESCRIPCION,-78.48852721,-5.71524758,RD N° 00174-2022-SENACE-PE/DEIN,
552,GRAÑA Y MONTERO PETROLERA S.A.,20100153832,REUBICACIÓN DE 20 POZOS DE DESARROLLO Y FACILIDADES DE PRODUCCIÓN EN LAS ZONAS A Y D DEL LOTE IV,LOTE IV,ITS,Hidrocarburos,11/11/2016,Aprobado,SIN DESCRIPCION,-81.162,-4.4791,RD N° 133-2016-SENACE/DCA,
554,MINSUR S.A.,20100136741,SEGUNDO INFORME TÉCNICO SUSTENTATORIO DE CAMBIOS A LA PLANTA FUNDICIÓN Y REFINERÍA DE ESTAÑO DE MINSUR S.A.,MINSUR,ITS,Minería,26/04/2016,Aprobado,SIN DESCRIPCION,-76.1745,-13.7791,RD N° 024-2016-SENACE/DCA,
555,NEXA RESOURCES EL PORVENIR S.A.C.,20492744833,QUINTO INFORME TÉCNICO SUSTENTATORIO PARA LA MODIFICACIÓN DE COMPONENTES AUXILIARES DE LA UNIDAD MINERA EL PORVENIR,U.M. EL PORVENIR,ITS,Minería,08/11/2018,Aprobado,SIN DESCRIPCION,-76.21057555,-10.62619379,RD N° 058-2018-SENACE-PE/DEAR,
556,ANGLO AMERICAN QUELLAVECO S.A.,20137913250,IV MODIFICACIÓN DEL EIA DEL PROYECTO QUELLAVECO,U.M. QUELLAVECO,ITS,Minería,05/03/2018,Aprobado,SIN DESCRIPCION,-70.6942,-17.1652,RD N° 055-2018-SENACE-JEF/DEAR,
558,PETRÓLEOS DEL PERÚ PETROPERÚ S.A.,20100128218,MODIFICACIÓN PLANTA DE ÁCIDO SULFÚRICO Y MEJORA TECN. EN ALTERNATIVAS DE CONSTRUCCIÓN DEL SIST.CAPTACIÓN DE AGUA DE MAR Y DE EFLUENTES INDUSTRIALES TRATADOS DEL PROYECTO MODERNIZACIÓN REFINERÍA,REFINERIA TALARA,ITS,Hidrocarburos,21/06/2017,Aprobado,SIN DESCRIPCION,-81.28524297,-4.57665534,RD N° 256-2017-SENACE/DCA,
559,"SAPET DEVELOPMENT PERÚ INC., SUCURSAL DEL PERÚ",20168702346,MODIFICACIÓN Y AMPLIACIÓN DEL DUCTO DE RECOLECCIÓN DE GAS NATURAL DE BAJA PRESIÓN PARA SU DISPOSICIÓN EN EL EX LOTE VII,LOTE VII,ITS,Hidrocarburos,30/06/2017,Aprobado,SIN DESCRIPCION,-81.23100692,-4.68613935,RD N° 230-2017-SENACE/DCA,
572,PROYECTO ESPECIAL DE INFRAESTRUCTURA DE TRANSPORTE NACIONAL - PROVIAS NACIONAL,20503503639,SOLICITUD DE CLASIFICACION DE ESTUDIOS AMBIENTAL DEL PROYECTO REEMPLAZO DEL PUENTE TABLACHACA I EN LOS CORREDOR VIAL NACIONAL RUTA PE 3N TRAMO CONOCOCHA - HUARAZ - PUENTE QUIROZ,REEMPLAZO DEL PUENTE TABLACHACA I EN LOS CORREDOR VIAL NACIONAL RUTA PE 3N TRAMO CONOCOCHA - HUARAZ - PUENTE QUIROZ,Clasificación,Transportes,03/07/2018,Aprobado,SIN DESCRIPCION,-78.21119124,-8.54273107,RD N° 00042-2018-SENACE-PE/DEIN,
573,LA ARENA S.A.,20205467603,SEGUNDO ITS DE LA TERCERA MEIA-D DE LA U.M. LA ARENA,U.M. LA ARENA,ITS,Minería,26/11/2018,Aprobado,SIN DESCRIPCION,-78.13074324,-7.89273372,RD N° 0006-2019-SENACE-PE/DEAR,
575,PERU LNG S.R.L.,20506342563,INCORPORACIÓN DE UNA MEJORA TECNOLÓGICA PARA RECUPERAR ETANO DEL GAS NATURAL DE LA PLANTA DE LICUEFACCIÓN – PAMPA MELCHORITA – PERU LNG,SIN UNIDAD,ITS,Hidrocarburos,08/05/2019,Aprobado,SIN DESCRIPCION,-76.2978417,-13.2446993,RD N° 104-2019-SENACE-PE/DEAR,
561,CIA MINERA COIMOLACHE SA,20140688640,PLAN DE PARTICIPACIÓN CIUDADANA (CON TUPA) - 01753-2017 - PLAN DE PARTICIPACIÓN CIUDADANA PREVIO A LA PRESENTACIÓN DE LA TERCERA MODIFICACIÓN DEL ESTUDIO DE IMPACTO AMBIENTAL DE LA U. P. TANTAHUATAY,SIN UNIDAD,PPC,Minería,15/01/2021,Aprobado,SIN DESCRIPCION,-78.68525161,-6.73371564,RD N° 00038-2021-SENACE-PE/DEAR,
562,"SAPET DEVELOPMENT PERÚ INC., SUCURSAL DEL PERÚ",20168702346,"MODIFICACIÓN Y AMPLIACIÓN DEL DUCTO DE RECOLECCIÓN DE GAS NATURAL DE BAJA PRESIÓN, EX LOTE VI",LOTE VI,ITS,Hidrocarburos,16/09/2016,Aprobado,SIN DESCRIPCION,-81.2953,-4.4747,RD N° 085-2016-SENACE/DCA,
564,GOLD FIELDS LA CIMA S.A.,20507828915,"EXPLOTACIÓN, BENEFICIO Y LABOR GENERAL MINERO METÁLICOS",CERRO CORONA,ITS,Minería,19/07/2022,Aprobado,SIN DESCRIPCION,-78.63396933,-6.76319334,RD N° 0146-2022-SENACE-PE/DEAR,
565,COMPAÑIA MINERA LINCUNA S.A.,20458538701,PLAN DE PARTICIPACIÓN CIUDADANA (CON TUPA) - M-CLS-NT-00232-2019 - PLAN DE PARTICIPACIÓN CIUDADANA DURANTE LA ELABORACIÓN DEL PROYECTO,PROYECTO HUANCAPETÍ,PPC,Minería,27/10/2021,Aprobado,SIN DESCRIPCION,-77.51906029,-9.76714244,R. D. N° 00164-2021-SENACE-PE/DEAR,
566,ENEL GREEN POWER PERÚ S.A.,20543298574,MODIFICACIÓN DEL ESTUDIO DE IMPACTO AMBIENTAL DETALLADO DE LA CENTRAL EÓLICA WAYRA I PARA EL PROYECTO WAYRA EXTENSIÓN,CENTRAL EOLICA WAYRA,Clasificación,Electricidad,14/03/2019,Aprobado,SIN DESCRIPCION,-75.05621473,-15.05347184,RD N° 00087-2019-SENACE-PE/DEAR,
569,GENRENT DEL PERÚ S.A.C.,20567129331,INFORME TÉCNICO SUSTENTATORIO PARA MODIFICACIÓN DE VÍAS DE ACCESO – LÍNEA DE TRANSMISIÓN DE 60 KV - IQUITOS,C.T. IQUITOS NUEVA,ITS,Electricidad,06/07/2017,Aprobado,SIN DESCRIPCION,-73.24670539,-3.65695563,RD N° 211-2017-SENACE/DCA,
571,MUNICIPALIDAD PROVINCIAL DE CANDARAVE,20159714285,"CREACIÓN DEL SERVICIO DE AGUA PARA RIEGO DEL SECTOR DE RIEGO CALLAZAS PARA LAS COMISIONES DE USUARIOS DE CAIRANI, HUANUARA, QUILAHUANI Y CANDARAVE, PROVINCIA DE CANDARAVE - TACNA",REPRESA CALLAZAS,Clasificación,Agricultura,23/09/2020,Aprobado,SIN DESCRIPCION,-70.27191924,-17.05040715,RD N° 00028-2021-SENACE-PE/DEIN,
537,CONCESIONARIA INTEROCEANICA SUR TRAMO 2 S.A.,20511125040,"ITS PARA LA OBRA ACCESORIA DE ESTABILIZACIÓN DEL SECTOR CRÍTICO KM 244+300 – KM 244+500 DEL PROYECTO CORREDOR VIAL INTEROCEÁNICO SUR PERÚ-BRASIL, TRAMO N° 2 URCOS - PUENTE INAMBARI","INFORME TÉCNICO SUSTENTATORIO PARA LA OBRA ACCESORIA DE ESTABILIZACIÓN DEL SECTOR CRÍTICO KM 244+300 – KM 244+500 DEL PROYECTO CORREDOR VIAL INTEROCEÁNICO SUR PERÚ-BRASIL, TRAMO N° 2 URCOS - PUENTE INAMBARI
",ITS,Transportes,04/06/2020,Aprobado,SIN DESCRIPCION,-70.39727314,-13.18942492,RD N° 00087-2020-SENACE-PE/DEIN,
539,GASODUCTO SUR PERUANO S.A.,20563236354,MEJORAS A LA SEGURIDAD ENERGÉTICA DEL PAÍS Y DESARROLLO DEL GASODUCTO SUR PERUANO,GASODUCTO SUR PERUANO,ITS,Hidrocarburos,25/04/2016,Aprobado,SIN DESCRIPCION,-73.0767,-12.2132,RD N° 057-2016-SENACE/DCA,
540,MINERA LAS BAMBAS S.A.,20538428524,TERCER ITS DE LA SEGUNDA MODIFICACIÓN DEL EIA PROYECTO LAS BAMBAS,LAS BAMBAS,ITS,Minería,21/06/2017,Aprobado,SIN DESCRIPCION,-72.3111318,-14.08383574,RD N° 219-2017-SENACE-DCA,
544,PROYECTO ESPECIAL DE INFRAESTRUCTURA DE TRANSPORTE NACIONAL - PROVIAS,20503503639,ITS PARA INCORPORAR 10 NUEVOS DEPÓSITOS DE MATERIAL EXCEDENTE: DME 01KM 103+810 LI; DME 02 KM 106+150 LI; DME 03 KM 108+160 LI; DME 04 KM 111+490 LI; DME 05 KM 116+820 LI; DME 06 KM 117+653 LI; DME 07 KM 124+750 LI; DME 08 KM 128+675 LI,MEJORAMIENTO DE LA CARRETERA,ITS,Transportes,14/12/2020,Aprobado,SIN DESCRIPCION,-76.80432,-9.776518,RD N° 00029-2021-SENACE-PE/DEIN,
545,MUNICIPALIDAD DISTRITAL DE ORONCCOY,20601577608,"CONSTRUCCION DE CAMINO VECINAL UNION PROGRESO TORRE - PACCHA - MANDOR - BELEN CHAPI - VACAHUASI - HUALLHUA - PUMACHACA, DISTRITO DE ORONCCOY - LA MAR - AYACUCHO","“CREACION DE TROCHA CARROZABLE TRAMO UCHUMARCA – CARAHUAIN L=7+000 KM DISTRITO DE YANAHUANCA, PROVINCIA DANIEL ALCIDES CARRION – PASCO.",Clasificación,Transportes,27/07/2020,Aprobado,SIN DESCRIPCION,-73.42595264,-13.16606323,RD N° 00149-2020-SENACE-PE/DEIN,
546,GASODUCTO SUR PERUANO S.A.,20563236354,MODIFICACIÓN DE COMPONENTES AUXILIARES DEL TRAZO ENTRE LOS TRAMOS KP 04+000 AL KP 40+000,GASODUCTO SUR PERUANO,ITS,Hidrocarburos,28/06/2016,Aprobado,SIN DESCRIPCION,-73.0502,-11.9885,RD N° 078-2016-SENACE/DCA,
547,COMPAÑIA MINERA SAN IGNACIO DE MOROCOCHA S.A.A.,20100177421,PRIMER INFORME TÉCNICO SUSTENTATORIO DE LA MODIFICACIÓN DEL ESTUDIO DE IMPACTO AMBIENTAL DEL PROYECTO CONDUCCIÓN Y DISPOSICIÓN FINAL DE RELAVES LA ESPERANZA DE LA UNIDAD MINERA SAN VICENTE “MEJORA TECNOLÓGICA EN LA PLANTA CONCENTRADORA”,UNIDAD MINERA SAN VICENTE,ITS,Minería,18/10/2021,Aprobado,SIN DESCRIPCION,-75.38652163,-11.23406477,RD N° 00162-2021-SENACE-PE/DEAR,
579,SOCIEDAD MINERA EL BROCAL S.A.A.,20100017572,MODIFICACION DEL EIA AMPLIACION DE OPERACIONES A 18000 TMD,U.M. COLQUIJIRCA,ITS,Minería,11/10/2016,Aprobado,SIN DESCRIPCION,-76.2856,-10.7663,RD N° 113-2016-SENACE/DCA,
580,NEXA RESOURCES PERU S.A.C.,20100110513,TERCER ITS DE LA MODIFICACIÓN DEL ESTUDIO DE IMPACTO AMBIENTAL DE LA U.M. CERRO LINDO PARA AMPLIACIÓN DE LA PLANTA CONCENTRADORA A 22.5 K TMD E INSTALACIONES ADICIONALES.,UM CERRO LINDO,ITS,Minería,07/08/2020,Aprobado,SIN DESCRIPCION,-75.99558315,-13.09060665,RD N° 00145-2020-SENACE-PE/DEAR,
581,COMPAÑÍA MINERA CONDESTABLE S.A.,20100056802,INCORPORACIÓN Y/O AMPLIACIÓN DE COMPONENTES E INTEGRACIÓN DE LAS UNIDADES,U.M. CONDESTABLE,ITS,Minería,23/04/2018,Aprobado,SIN DESCRIPCION,-76.5951,-12.6975,RD N° 071-2018-SENACE-JEF/DEAR,
582,CONSORCIO TRANSMANTARO S.A.,20383316473,CONSTRUCCIÓN DE LA PRIMERA ETAPA DE LA S.E. CARAPONGO Y ENLACES DE CONEXIÓN A LÍNEAS ASOCIADAS,S.E. CARAPONGO,Clasificación,Electricidad,08/04/2016,Aprobado,SIN DESCRIPCION,-76.8656,-11.9805,RD N° 029-2016-SENACE/DCA,
595,COMPAÑÍA MINERA LINCUNA S.A.,20458538701,"TERCER INFORME TÉCNICO SUSTENTATORIO ""ACTIVIDADES DE EXPLORACIÓN, MODIFICACIÓN DE COMPONENTES AUXILIARES Y CAMBIO DE CRONOGRAMA EN RELLENO HIDRAÚLICO""",U.M. HUANCAPETI,ITS,Minería,24/01/2020,Aprobado,SIN DESCRIPCION,-77.54510754,-9.75729587,RD N° 066-2020-SENACE-PE/DEAR,
596,TERNA PERU S.A.C.,20602232256,ITS PARA EL MEJORAMIENTO TECNOLÓGICO EN LAS FUNDACIONES DE TORRES EN LOS TRAMOS T230-T267 Y T274-T297,MEJORAMIENTO TECNOLÓGICO EN LAS FUNDACIONES DE TORRES EN LOS TRAMOS T230-T267 Y T274-T298,ITS,Electricidad,12/02/2020,Aprobado,SIN DESCRIPCION,-74.66033373,-8.41843332,RD N° 056-2020-SENACE-PE/DEI,
597,MINERA LA ZANJA S.R.L.,20507975977,QUINTO INFORME TÉCNICO SUSTENTATORIO DE LA IV MEIAD DE LA UM LA ZANJA,LA ZANJA,ITS,Minería,23/01/2022,Aprobado,SIN DESCRIPCION,-78.90192169,-6.82886942,RD N° 00055-2022-SENACE-PE/DEAR,
598,SOCIEDAD MINERA CERRO VERDE S.A.A.,20170072465,SÉPTIMO INFORME TÉCNICO SUSTENTATORIO DE LA  MODIFICACIÓN DE ESTUDIO DE IMPACTO AMBIENTAL Y SOCIAL DE LA EXPANSIÓN  DE LA UNIDAD DE PRODUCCIÓN CERRO VERDE,UNIDAD DE PRODUCCIÓN CERRO VERDE,ITS,Minería,22/01/2022,Aprobado,SIN DESCRIPCION,-71.58299055,-16.52561525,RD N° 00079-2022-SENACE-PE/DEAR,
599,GAZ ET L'ENERGIE S.A.C.,20522662462,PROYECTO CENTRAL TÉRMICA HUMAY,C.T. HUMAY,Clasificación,Electricidad,22/02/2017,Aprobado,SIN DESCRIPCION,-75.95838916,-13.71404519,RD N° 114-2017-SENACE/DCA,
601,PROGRAMA DE GOBIERNO REGIONAL DE LIMA METROPOLITANA,20518396332,"DIA ""MEJORAMIENTO DE PISTAS Y VEREDAS DE LA CALLE TOKIO, TRAMO: AV. LOS LAURELES - AV. LAS AGUILAS Y EN LA AV. LAS AGUILAS, TRAMO: CALLE TOKIO - AV. LOS CISNES DISTRITO DE LURIGANCHO, PROVINCIA DE LI*","MEJORAMIENTO DE PISTAS Y VEREDAS DE LA CALLE TOKIO, TRAMO: AV. LOS LAURELES - AV. LAS AGUILAS Y EN LA AV. LAS AGUILAS, TRAMO: CALLE TOKIO - AV. LOS CISNES DISTRITO DE LURIGANCHO, PROVINCIA DE LIMA -LIMA, CODIGO DE INVERSION 2386505",Clasificación,Transportes,08/08/2018,Aprobado,SIN DESCRIPCION,-76.93109746,-12.01830267,RD N° 00007-2019-SENACE-PE/DEIN,
602,GOBIERNO REGIONAL DE ANCASH,20530689019,"CREACIÓN DEL SERVICIO DE PROTECCIÓN EN RIBERA DEL RIO HUARMEY VULNERABLE ANTE EL PELIGRO EN EL SECTOR EL ARENAL – PUENTE PANAMERICANA, DISTRITO DE HUARMEY, PROVINCIA DE HUARMEY, DEPARTAMENTO DE ANCASH",PROTECCIÓN EN RIBERA DEL RIO HUARMEY,IGAPRO,Agricultura,28/10/2020,Aprobado,SIN DESCRIPCION,-78.15508061,-10.0726606,RD N° 00007-2021-SENACE-PE/DEIN,
603,CNPC PERÚ S.A.,20356476434,AMPLIACIÓN DEL ÁREA DE LAS PLATAFORMAS DE PERFORACIÓN Y FACILIDADES DE PRODUCCIÓN PARA 42 POZOS,LOTE X,ITS,Hidrocarburos,17/02/2017,Aprobado,SIN DESCRIPCION,-81.16118187,-4.28121767,RD N° 072-2017-SENACE/DCA,
604,COMPAÑÍA MINERA CHUNGAR S.A.C.,20514608041,MOD. POR AMPLIACIÓN EIA ISLAY 500 A 2000 TMSD,U.M. ISLAY,ITS,Minería,28/05/2018,Aprobado,SIN DESCRIPCION,-76.468,-11.0103,RD N° 094-2018-SENACE-JEF/DEAR,
617,IMPALA TERMINALS PERU S.A.C.,20506377600,TERCER ITS DEL ALMACÉN GARZA AZUL,ILO,ITS,Minería,01/07/2020,Aprobado,SIN DESCRIPCION,-77.12860255,-12.04388931,RD N° 105-2020-SENACE-PE/DEAR,
619,CNPC PERÚ S.A.,20356476434,"ITS PARA LA “MODIFICACIÓN DE LA UBICACIÓN, TAMAÑO DE LA PLATAFORMA, VÍAS DE ACCESO, PROFUNDIDAD Y LÍNEA DE CONDUCCIÓN DE POZO PROFUNDO 1416 EN EL LOTE X”",SIN UNIDAD,ITS,Hidrocarburos,24/07/2019,Aprobado,SIN DESCRIPCION,-81.22897636,-4.32147629,RD N° 0167-2019-SENACE-PE/DEAR,
620,EMERGENT COLD PERU S.A.C.,20603281994,"PLANTA DE PROCESAMIENTO, CONGELAMIENTO, EMPAQUE Y ALMACENAMIENTO DE FRUTAS",CONGELADOS ERMERGENT,Clasificación,Agricultura,24/10/2018,Aprobado,SIN DESCRIPCION,-80.68951908,-5.15702479,RD N° 00037-2019-SENACE-PE/DEAR,
621,SOCIEDAD MINERA AUSTRIA DUVAZ S.A.C.,20100102171,"EXTENSIÓN DEL DEPÓSITO DE RELAVES PUQUIOCOCHA, AMPLIACIÓN DEL ALMACÉN DE CONCENTRADOS Y MODIFICACIÓN DE COMPONENTES AUXILIARES",U.M. PUQUIOCOCHA,ITS,Minería,20/12/2016,Aprobado,SIN DESCRIPCION,-76.13276867,-11.59644155,RD N° 023-2017-SENACE/DCA,
622,ENGIE ENERGÍA PERÚ S.A.,20333363900,"MODIFICACIÓN DE COMPONENTES AUXILIARES DE LA CENTRAL HIDROELÉCTRICA QUITARACSA I, POR LA INCLUSIÓN DEL CAMPAMENTO CAVERNA Y SISTEMAS DE TRATAMIENTO EN CASA DE MÁQUINAS",C.H. QUITARACSA I,ITS,Electricidad,18/07/2017,Aprobado,SIN DESCRIPCION,-77.84703518,-8.80356492,RD N° 270-2017-SENACE/DCA,
623,ACCESS WORLD (PERÚ) S.A.C.,20557068245,ESTACIÓN DE TRASVASE DE CONCENTRADOS MINERALES ACCESS WORLD,ACCESS WORLD,Clasificación,Minería,11/12/2017,Aprobado,SIN DESCRIPCION,-77.12164439,-12.04754348,RD N° 041-2018-SENACE-JEF/DEAR,
605,MINERA LA ZANJA S.R.L.,20507975977,CUARTO ITS DE LA CUARTA MODIFICACIÓN DEL ESTUDIO DE IMPACTO AMBIENTAL DETALLADO DEL PROYECTO LA ZANJA,U.M. LA ZANJA,ITS,Minería,22/07/2019,Aprobado,SIN DESCRIPCION,-78.88720346,-6.82124766,RD N° 0160-2019-SENACE-PE/DEAR,
606,EMPRESA DE GENERACIÓN ELÉCTRICA SAN GABÁN S.A.,20262221335,PLAN DE PARTICIPACIÓN CIUDADANA PARA LA ELABORACIÓN Y EVALUACIÓN DE LA MODIFICACIÓN DEL EIA DEL PROYECTO “CENTRAL HIDROELÉCTRICA SAN GABÁN II”,SIN UNIDAD,PPC,Electricidad,23/07/2021,Aprobado,SIN DESCRIPCION,-70.60936713,-70.60936713,RD N° 00113-2021-SENACE-PE/DEAR,
607,MUNICIPALIDAD DISTRITAL DE LA JOYA,20167246029,"PROYECTO MEJORAMIENTO DEL SERVICIO DE AGUA PARA RIEGO DE LA JOYA NUEVA EN LOS SECTORES DE LA CANO, SAN CAMILO Y SAN ISIDRO, DISTRITO DE LA JOYA, PROVINCIA DE AREQUIPA, REGIÓN AREQUIPA”",SIN UNIDAD,Clasificación,Agricultura,09/03/2018,Aprobado,SIN DESCRIPCION,-71.83911149,-16.66295493,RD N° 00076-2018-SENACE-PE/DEIN,
609,GEOPARK PERÚ S.A.C.,20565367952,LOTE 64,LOTE 64,Clasificación,Hidrocarburos,01/12/2017,Aprobado,SIN DESCRIPCION,-77.29823814,-3.14220073,RD N° 040-2018-SENACE-JEF/DEAR,
610,GOBIERNO REGIONAL MOQUEGUA,20519752604,"MEJORAMIENTO DEL SERVICIO DE PROVISIÒN DE AGUA PARA RIEGO EN LOS BLOQUES DE ILUBAYA, TORATA Y YACANGO DEL DISTRITO DE TORATA - PROVINCIA DE MARISCAL NIETO - DEPARTAMENTO DE MOQUEGUA","MEJORAMIENTO DEL SERVICIO DE PROVISIÓN DE AGUA PARA RIEGO EN LOS BLOQUES DE ILUBAYA, TORATA Y YACANGO, DISTRITO DE TORATA, PROVINCIA DE MARISCAL NIETO, DEPARTAMENTO DE MOQUEGUA",Clasificación,Agricultura,16/02/2022,Aprobado,SIN DESCRIPCION,-70.64478329,-17.00153883,RD N° 0148-2022-SENACE-PE/DEIN,
611,SHAHUINDO S.A.C.,20505792042,MODIFICACIÓN DE INSTALACIONES AUXILIARES,U.M. SHAHUINDO,ITS,Minería,28/02/2017,Aprobado,SIN DESCRIPCION,-78.20191828,-7.61210397,RD N° 089-2017-SENACE/DCA,
613,CONCESIONARIA INTEROCEANICA SUR - TRAMO 2 S.A.,20511125040,"ITS PARA EL DEPÓSITO DE MATERIAL EXCEDENTE KM 146+900 LD DEL PROYECTO CORREDOR VIAL INTEROCEÁNICO SUR PERÚ- BRASIL, TRAMO Nº 2 URCOS – INAMBARI","CORREDOR VIAL INTEROCEÁNICO SUR, PERÚ-BRASIL, TRAMO 2: URCOS - INAMBARI",ITS,Transportes,31/07/2018,Aprobado,SIN DESCRIPCION,-70.89579055,-13.52613218,RD N° 00097-2018-SENACE-PE/DEIN,
614,MINERA YANACOCHA S.R.L.,20137291313,MODIFICACIÓN DEL ESTUDIO DE IMPACTO AMBIENTAL YANACOCHA,U.M. YANACOCHA,MEIA-d,Minería,30/04/2018,Aprobado,SIN DESCRIPCION,-78.5205,-6.9862,RD N° 00049-2019-SENACE-PE/DEAR,
615,GOLD FIELDS LA CIMA S.A.,20507828915,U.M. CERRO CORONA,U.M. CERRO CORONA,ITS,Minería,29/12/2017,Aprobado,SIN DESCRIPCION,-78.62061249,-6.76329946,RD N° 021-2018-SENACE-JEF/DEAR,
616,AUTOPISTA DEL NORTE S.A.C.,20520929658,EVAP PROYECTO DE REHABILITACIÓN DE LA CALZADA ACTUAL: TRAMO VIAL PATIVILCA – SANTA – CRUCE DE LA PANAMERICANA NORTE CON EL PUERTO SALAVERRY Y SALAVERRY - EMPALME R01N,REHABILITACIÓN DE LA CALZADA ACTUAL: TRAMO VIAL PATIVILCA – SANTA – CRUCE DE LA PANAMERICANA NORTE CON EL PUERTO SALAVERRY Y SALAVERRY - EMPALME R01N,Clasificación,Transportes,29/03/2019,Aprobado,SIN DESCRIPCION,-78.99739628,-8.17464834,Oficio N° 00444-2019-SENACE-PE/DEIN ,
583,MUNICIPALIDAD DISTRITAL DE CHIRIMOTO,20207202127,"CREACIÓN DE LA CARRETERA VECINAL LUZ DEL ORIENTE – TRIANGULO DE LA ESPERANZA – NUEVA UNIÓN DISTRITO DE CHIRIMOTO, PROVINCIA DE RODRIGUEZ DE MENDOZA – AMAZONAS",CREACIÓN DE LA CARRETERA VECINAL,Clasificación,Transportes,19/04/2021,Aprobado,SIN DESCRIPCION,-77.30511404,-6.73968598,En Evaluación,
584,CONCESIONARIA INTEROCEÁNICA SUR - TRAMO 3 S.A.,20511129975,"ITS PARA EL “DEPÓSITO DE MATERIAL EXCEDENTE KM 551+860 LI DEL PROYECTO CORREDOR VIAL INTEROCEÁNICO SUR PERÚ – BRASIL, TRAMO N° 3 PUENTE INAMBARI - IÑAPARI”",SIN UNIDAD,ITS,Transportes,10/04/2018,Aprobado,SIN DESCRIPCION,-69.24283774,-69.24283774,RD N° 078-2018-SENACE-JEF/DEIN,
585,CONCESIONARIA INTEROCEÁNICA SUR - TRAMO 3 S.A.,20511129975,"ITS PARA LA “HABILITACIÓN DEL ACOPIO KM 590+500 LD DEL CORREDOR VIAL INTEROCEÁNICO SUR, TRAMO N° 3 PUENTE INAMBARI – IÑAPARI”",SIN UNIDAD,ITS,Transportes,28/03/2018,Aprobado,SIN DESCRIPCION,-69.42130935,-69.42130935,RD N° 088-2018-SENACE-JEF/DEIN,
586,MINERA YANACOCHA S.R.L.,20137291313,SEGUNDO INFORME TÉCNICO SUSTENTATORIO DE LA SEGUNDA MODIFICACIÓN DEL ESTUDIO DE IMPACTO AMBIENTAL YANACOCHA,YANACOCHA,ITS,Minería,17/11/2021,Aprobado,SIN DESCRIPCION,-78.52286097,-6.98703181,RD N° 0031-2022-SENACE-PE/DEAR,
587,COMPAÑÍA DE MINAS BUENAVENTURA S.A.A.,20100079501,SEGUNDO INFORME TÉCNICO SUSTENTATORIO DE LA MODIFICACIÓN DEL ESTUDIO DE IMPACTO AMBIENTAL - UNIDAD MINERA ORCOPAMPA,U.M. ORCOPAMPA,ITS,Minería,25/07/2018,Aprobado,SIN DESCRIPCION,-72.35781806,-15.27144774,RD N° 008-2018-SENACE-PE/DEAR,
588,PROYECTO ESPECIAL DE INFRAESTRUCTURA DE TRANSPORTE NACIONAL - PROVIAS NACIONAL,20503503639,ITS PARA LA INTEGRACIÓN DE TERRENOS ADICIONALES AL POLÍGONO DEL PROYECTO “MEJORAMIENTO DEL SERVICIO AEROPORTUARIO EN LA REGIÓN CUSCO MEDIANTE EL NUEVO AEROPUERTO INTERNACIONAL DE CHINCHERO – CUSCO”,“MEJORAMIENTO DEL SERVICIO AEROPORTUARIO EN LA REGIÓN CUSCO MEDIANTE EL NUEVO AEROPUERTO INTERNACIONAL DE CHINCHERO – CUSCO”,ITS,Transportes,05/10/2018,Aprobado,SIN DESCRIPCION,-72.06550063,-13.40699091,RD N° 00078-2018-SENACE-PE/DEIN,
589,DIRECCION REGIONAL DE TRANSPORTES Y COMUNICACIONES DEL GOBIERNO REGIONAL MADRE DE DIOS,20199189710,"CREACIÓN DEL CAMINO VECINAL, INICIO DESVÍO MARGEN DERECHA KM 92 VÍA INTEROCEÁNICA (PE. 30C) SOL NACIENTE – HUACAMAYO, DISTRITO DE INAMBARI, PROVINCIA DE TAMBOPATA – MADRE DE DIOS","“CREACIÓN DEL CAMINO VECINAL, INICIO DESVÍO MARGEN DERECHA KM 92 VÍA INTEROCEÁNICA (PE. 30C) SOL NACIENTE – HUACAMAYO, DISTRITO DE INAMBARI, PROVINCIA DE TAMBOPATA – MADRE DE DIOS”",Clasificación,Transportes,25/11/2021,Aprobado,SIN DESCRIPCION,-69.89347401,-12.89414201,RD N° 00095-2022-SENACE-PE/DEIN,
590,MARCOBRE S.A.C.,20508972734,CUARTO ITS DE LA MODIFICACIÓN DEL EIAD DEL PROYECTO MINA JUSTA,MINA JUSTA,ITS,Minería,29/01/2021,Aprobado,SIN DESCRIPCION,-75.0857432,-15.16364374,RD N° 00041-2021-SENACE-PE/DEAR,
592,COMPAÑÍA MINERA ARES S.A.C.,20192779333,SEGUNDA MEIA - AMPLIACIÓN A 3000 DE LA U.O. PALLANCATA,PALLANCATA,MEIA-d,Minería,02/05/2017,Aprobado,SIN DESCRIPCION,-73.17802817,-14.7201373,RD N° 342-2017-SENACE-DCA,
593,GRAÑA Y MONTERO PETROLERA S.A.,20100153832,"MEJORAS Y AMPLIACIÓN DE BATERÍAS DE PRODUCCIÓN EN EL LOTE IV: BATERÍA 191, BATERÍA 193 Y BATERÍA 5058",SIN UNIDAD,ITS,Hidrocarburos,07/08/2019,Aprobado,SIN DESCRIPCION,-81.18253829,-4.49652438,RD N° 0180-2019-SENACE-PE/DEAR,
634,CONCESIONARIA IIRSA NORTE S.A.,20511004251,"ITS PARA LA OBRA ACCESORIA EN EL KM 167+740 - KM 167+950 DEL PROYECTO CORREDOR VIAL AMAZONAS NORTE, TRAMO 4: OLMOS - CORRAL QUEMADO","INFORME TÉCNICO SUSTENTATORIO PARA LA OBRA ACCESORIA EN EL KM 167+740 - KM 167+950 DEL PROYECTO CORREDOR VIAL AMAZONAS NORTE, TRAMO 4: OLMOS - CORRAL QUEMADO",ITS,Transportes,26/05/2019,Aprobado,SIN DESCRIPCION,-78.83737738,-5.8988517,RD N° 00148-2019-SENACE-PE/DEIN,
636,MARCOBRE S.A.C.,20508972734,TERCER ITS DE LA MODIFICACIÓN DEL EIAD DEL PROYECTO MINA JUSTA,MINA JUSTA,ITS,Minería,12/11/2018,Aprobado,SIN DESCRIPCION,-75.0617,-15.1625,RD N° 059-2018-SENACE-PE/DEAR,
637,MINSUR S.A.,20100136741,"MODIFICACIÓN DEL EIA DEL PROYECTO ""REAPROVECHAMIENTO DE RELAVES EN LA UNIDAD MINERA ACUMULACIÓN QUENAMARI - SAN RAFAEL""",SIN UNIDAD,MEIA-d,Minería,14/09/2016,Aprobado,SIN DESCRIPCION,-70.3211634,-14.23732838,RD N° 095-2017-SENACE/DCA,
642,CONCESIONARIA INTEROCEANICA SUR - TRAMO 3 S.A.,20511129975,"INFORME TÉCNICO SUSTENTATORIO PARA EL DEPÓSITO DE MATERIAL EXCEDENTE KM 289+626 LI DEL PROYECTO CORREDOR VIAL INTEROCEÁNICO SUR PERÚ-BRASIL, TRAMO N° 3 PUENTE INAMBARI - IÑAPARI",CORREDOR VIAL INTEROCEÁNICO SUR PERÚ – BRASIL TRAMO N° 3,ITS,Transportes,19/05/2021,Aprobado,SIN DESCRIPCION,-69.42227177,-12.69722958,RD N° 00116-2021-SENACE-PE/DEIN,
659,MUNICIPALIDAD PROVINCIAL DANIEL CARRION,20601577608,"CREACION DE TROCHA CARROZABLE TRAMO UCHUMARCA – CARAHUAIN L=7+000 KM DISTRITO DE YANAHUANCA, PROVINCIA DANIEL ALCIDES CARRION – PASCO",CONSTRUCCIÓN DE CAMINO VECINAL,Clasificación,Transportes,21/07/2020,Aprobado,SIN DESCRIPCION,-76.51409616,-10.64783287,RD N° 00142-2020-SENACE-PE/DEIN,
660,CONCESIONARIA INTEROCEANICA SUR - TRAMO 2 S.A.,20511125040,"ITS PARA EL DEPÓSITO DE MATERIAL EXCEDENTE KM 163+460 LI DEL PROYECTO CORREDOR VIAL INTEROCEÁNICO SUR PERÚ- BRASIL, TRAMO Nº 2 URCOS - INAMBARI.","CORREDOR VIAL INTEROCEÁNICO SUR, PERÚ-BRASIL, TRAMO 2: URCOS - INAMBARI",ITS,Transportes,04/08/2018,Aprobado,SIN DESCRIPCION,-70.90075458,-13.4061613,RD N° 00043-2018-SENACE-PE/DEIN,
661,MINSUR S.A.,20100136741,REAPROVECHAMIENTO DE RELAVES EN LA UNIDAD MINERA SAN RAFAEL,U.M. SAN RAFAEL,ITS,Minería,02/05/2017,Aprobado,SIN DESCRIPCION,-70.32541821,-14.22957477,RD N° 158-2017-SENACE-DCA,
662,COMPAÑÍA MINERA ATACOCHA S.A.A.,20100123500,MODIFICACIÓN DEL ESTUDIO DE IMPACTO AMBIENTAL DE UM ATACOCHA,U.M. ATACOCHA,MEIA-d,Minería,28/11/2017,Aprobado,SIN DESCRIPCION,-76.21550921,-10.5792993,RD N° 119-2018-SENACE-JEF/DEAR,
647,PACIFIC OFF SHORE PERÚ S.R.L,20546353118,"MODIFICACIÓN Y OPTIMIZACIÓN DEL MONITOREO FÍSICO, QUÍMICO Y BIOLÓGICO PARA LAS ACTIVIDADES DE HIDROCARBUROS EN LA PLATAFORMA MARINA CX-11, CAMPO CORVINA – LOTE Z1",LOTE Z-1,ITS,Hidrocarburos,16/11/2018,Aprobado,SIN DESCRIPCION,-80.74383898,-3.59231584,RD N° 00020-2019-SENACE-PE/DEAR,
651,TRANSPORTADORA DE GAS DEL PERÚ S.A.,20499432021,SISTEMA DE TRANSPORTE POR DUCTOS DE GAS NATURAL Y LIQUIDOS DE GAS NATURAL CAMISEA - LIMA,TGP,ITS,Hidrocarburos,21/09/2017,Aprobado,SIN DESCRIPCION,-73.07243163,-12.47109053,RD N° 006-2017-SENACE-JEF/DEAR,
652,MARCOBRE S.A.C.,20508972734,MODIFICACIÓN DEL EIA DEL PROYECTO MINA JUSTA,MINA JUSTA,ITS,Minería,31/10/2017,Aprobado,SIN DESCRIPCION,-75.06173559,-15.16248845,RD N° 029-2017-SENACE-JEF/DEAR,
653,IBEREÓLICA PACIFICO S.A.C.,20600820045,PARQUE EÓLICO PACÍFICO Y SU LÍNEA DE TRANSMISIÓN,SIN UNIDAD,Clasificación,Electricidad,09/11/2018,Aprobado,SIN DESCRIPCION,-74.97916073,-15.40057162,RD N° 00043-2019-SENACE-PE/DEAR,
654,CONSORCIO TRANSMANTARO S.A.,20383316473,LÍNEA DE TRANSMISIÓN 500 KV MANTARO – MARCONA – SOCABAYA – MONTALVO Y SUBESTACIONES ASOCIADAS,S.E. MATARO,ITS,Electricidad,09/10/2017,Aprobado,SIN DESCRIPCION,-74.32697841,-13.27732755,RD N° 341-2017-SENACE-DCA,
655,MINERA COLQUISIRI S.A.,20107290177,SEGUNDO INFORME TÉCNICO SUSTENTATORIO DE LA MODIFICATORIA DEL ESTUDIO DE IMPACTO AMBIENTAL DE LA U.E.A. “MARÍA TERESA”,U.E.A. MARÍA TERESA,ITS,Minería,20/02/2022,Aprobado,SIN DESCRIPCION,-77.27743218,-11.49583004,RD N° 00057-2022-SENACE-PE/DEAR,
657,AUTORIDAD PARA LA RECONSTRUCCIÓN CON CAMBIOS,20602114091,"CREACIÓN DEL SERVICIO DE PROTECCIÓN CONTRA INUNDACIONES DEL RÍO CAÑETE ENTRE EL TRAMO DE LA DESEMBOCADURA DEL RÍO CAÑETE - LOCALIDAD DE PAULLO, EN LOS DISTRITOS DE SAN VICENTE DE CAÑETE, NUEVO IMPERIAL Y LUNAHUANÁ DE LA PROVINCIA DE CAÑETE - DEPARTAM",SIN UNIDAD,IGAPRO,Agricultura,09/06/2022,Aprobado,SIN DESCRIPCION,-76.34594,-13.12344,RD N° 00183-2022-SENACE-PE/DEIN,
